data,date,time,alertDate,category,category_desc,matrix_id,rid
 באר שבע 289,24.07.2014,17:05:26,2014-07-24T17:05:00,1,ירי רקטות וטילים,1,1
 באר שבע 291,24.07.2014,17:05:26,2014-07-24T17:05:00,1,ירי רקטות וטילים,1,1
באר שבע 288,24.07.2014,17:05:26,2014-07-24T17:05:00,1,ירי רקטות וטילים,1,1
 אשקלון 256,24.07.2014,17:05:35,2014-07-24T17:06:00,1,ירי רקטות וטילים,1,2
 באר שבע 291,24.07.2014,17:05:35,2014-07-24T17:06:00,1,ירי רקטות וטילים,1,2
 באר שבע 289,24.07.2014,17:05:35,2014-07-24T17:06:00,1,ירי רקטות וטילים,1,2
באר שבע 288,24.07.2014,17:05:35,2014-07-24T17:06:00,1,ירי רקטות וטילים,1,2
 באר שבע 289,24.07.2014,17:05:59,2014-07-24T17:06:00,1,ירי רקטות וטילים,1,3
 באר שבע 291,24.07.2014,17:05:59,2014-07-24T17:06:00,1,ירי רקטות וטילים,1,3
אשקלון 256,24.07.2014,17:05:59,2014-07-24T17:06:00,1,ירי רקטות וטילים,1,3
באר שבע 289,24.07.2014,17:06:02,2014-07-24T17:06:00,1,ירי רקטות וטילים,1,4
 באר שבע 291,24.07.2014,17:06:02,2014-07-24T17:06:00,1,ירי רקטות וטילים,1,4
באר שבע 288,24.07.2014,17:06:08,2014-07-24T17:06:00,1,ירי רקטות וטילים,1,5
 באר שבע 289,24.07.2014,17:06:08,2014-07-24T17:06:00,1,ירי רקטות וטילים,1,5
 באר שבע 291,24.07.2014,17:06:08,2014-07-24T17:06:00,1,ירי רקטות וטילים,1,5
באר שבע 288,24.07.2014,17:06:11,2014-07-24T17:06:00,1,ירי רקטות וטילים,1,6
 באר שבע 291,24.07.2014,17:06:11,2014-07-24T17:06:00,1,ירי רקטות וטילים,1,6
באר שבע 288,24.07.2014,17:06:14,2014-07-24T17:06:00,1,ירי רקטות וטילים,1,7
 באר שבע 289,24.07.2014,17:06:15,2014-07-24T17:06:00,1,ירי רקטות וטילים,1,8
באר שבע 288,24.07.2014,17:06:15,2014-07-24T17:06:00,1,ירי רקטות וטילים,1,8
באר שבע 289,24.07.2014,17:06:49,2014-07-24T17:07:00,1,ירי רקטות וטילים,1,9
עוטף עזה 230,27.07.2014,09:57:09,2014-07-27T09:57:00,1,ירי רקטות וטילים,1,10
עוטף עזה 237,27.07.2014,10:55:01,2014-07-27T10:55:00,1,ירי רקטות וטילים,1,11
עוטף עזה 218,27.07.2014,12:29:40,2014-07-27T12:30:00,1,ירי רקטות וטילים,1,12
 עוטף עזה 217,27.07.2014,13:44:10,2014-07-27T13:44:00,1,ירי רקטות וטילים,1,13
עוטף עזה 218,27.07.2014,13:44:10,2014-07-27T13:44:00,1,ירי רקטות וטילים,1,13
עוטף עזה 218,27.07.2014,13:59:00,2014-07-27T13:59:00,1,ירי רקטות וטילים,1,14
עוטף עזה 217,27.07.2014,14:03:55,2014-07-27T14:04:00,1,ירי רקטות וטילים,1,15
עוטף עזה 237,27.07.2014,14:06:49,2014-07-27T14:07:00,1,ירי רקטות וטילים,1,16
עוטף עזה 224,27.07.2014,14:43:07,2014-07-27T14:43:00,1,ירי רקטות וטילים,1,17
עוטף עזה 224,27.07.2014,14:43:29,2014-07-27T14:43:00,1,ירי רקטות וטילים,1,18
עוטף עזה 224,27.07.2014,16:00:30,2014-07-27T16:01:00,1,ירי רקטות וטילים,1,19
 אשקלון 249,27.07.2014,16:41:47,2014-07-27T16:42:00,1,ירי רקטות וטילים,1,20
 עוטף עזה 251,27.07.2014,16:41:47,2014-07-27T16:42:00,1,ירי רקטות וטילים,1,20
 אשקלון 251,27.07.2014,16:41:47,2014-07-27T16:42:00,1,ירי רקטות וטילים,1,20
אשקלון 250,27.07.2014,16:41:47,2014-07-27T16:42:00,1,ירי רקטות וטילים,1,20
אשקלון 250,27.07.2014,16:41:50,2014-07-27T16:42:00,1,ירי רקטות וטילים,1,21
 אשקלון 251,27.07.2014,16:41:50,2014-07-27T16:42:00,1,ירי רקטות וטילים,1,21
 אשקלון 249,27.07.2014,16:41:50,2014-07-27T16:42:00,1,ירי רקטות וטילים,1,21
 אשדוד 282,27.07.2014,16:41:50,2014-07-27T16:42:00,1,ירי רקטות וטילים,1,21
 עוטף עזה 251,27.07.2014,16:41:50,2014-07-27T16:42:00,1,ירי רקטות וטילים,1,21
 אשדוד 282,27.07.2014,16:41:57,2014-07-27T16:42:00,1,ירי רקטות וטילים,1,22
 אשדוד 280,27.07.2014,16:41:57,2014-07-27T16:42:00,1,ירי רקטות וטילים,1,22
 אשקלון 249,27.07.2014,16:41:57,2014-07-27T16:42:00,1,ירי רקטות וטילים,1,22
 עוטף עזה 251,27.07.2014,16:41:57,2014-07-27T16:42:00,1,ירי רקטות וטילים,1,22
 אשקלון 251,27.07.2014,16:41:57,2014-07-27T16:42:00,1,ירי רקטות וטילים,1,22
 אשקלון 250,27.07.2014,16:41:57,2014-07-27T16:42:00,1,ירי רקטות וטילים,1,22
אשדוד 281,27.07.2014,16:41:57,2014-07-27T16:42:00,1,ירי רקטות וטילים,1,22
אשדוד 281,27.07.2014,16:42:24,2014-07-27T16:42:00,1,ירי רקטות וטילים,1,23
 אשדוד 280,27.07.2014,16:42:24,2014-07-27T16:42:00,1,ירי רקטות וטילים,1,23
 אשקלון 249,27.07.2014,16:42:24,2014-07-27T16:42:00,1,ירי רקטות וטילים,1,23
 אשדוד 282,27.07.2014,16:42:24,2014-07-27T16:42:00,1,ירי רקטות וטילים,1,23
 אשקלון 249,27.07.2014,16:42:39,2014-07-27T16:43:00,1,ירי רקטות וטילים,1,24
אשדוד 282,27.07.2014,16:42:39,2014-07-27T16:43:00,1,ירי רקטות וטילים,1,24
אשקלון 249,27.07.2014,16:42:47,2014-07-27T16:43:00,1,ירי רקטות וטילים,1,25
פזורה 31,27.07.2014,17:21:23,2014-07-27T17:21:00,1,ירי רקטות וטילים,1,26
 נגב 296,27.07.2014,17:21:39,2014-07-27T17:22:00,1,ירי רקטות וטילים,1,27
 פזורה 31,27.07.2014,17:21:39,2014-07-27T17:22:00,1,ירי רקטות וטילים,1,27
באר שבע 286,27.07.2014,17:21:39,2014-07-27T17:22:00,1,ירי רקטות וטילים,1,27
באר שבע 292,27.07.2014,17:21:55,2014-07-27T17:22:00,1,ירי רקטות וטילים,1,28
 באר שבע 286,27.07.2014,17:21:55,2014-07-27T17:22:00,1,ירי רקטות וטילים,1,28
 פזורה 31,27.07.2014,17:21:55,2014-07-27T17:22:00,1,ירי רקטות וטילים,1,28
 נגב 296,27.07.2014,17:21:55,2014-07-27T17:22:00,1,ירי רקטות וטילים,1,28
 נגב 297,27.07.2014,17:21:55,2014-07-27T17:22:00,1,ירי רקטות וטילים,1,28
באר שבע 292,27.07.2014,17:22:11,2014-07-27T17:22:00,1,ירי רקטות וטילים,1,29
 באר שבע 286,27.07.2014,17:22:11,2014-07-27T17:22:00,1,ירי רקטות וטילים,1,29
 נגב 297,27.07.2014,17:22:11,2014-07-27T17:22:00,1,ירי רקטות וטילים,1,29
 אשקלון 234,27.07.2014,17:22:11,2014-07-27T17:22:00,1,ירי רקטות וטילים,1,29
 נגב 296,27.07.2014,17:22:11,2014-07-27T17:22:00,1,ירי רקטות וטילים,1,29
 פזורה 31,27.07.2014,17:22:11,2014-07-27T17:22:00,1,ירי רקטות וטילים,1,29
 עוטף עזה 234,27.07.2014,17:22:11,2014-07-27T17:22:00,1,ירי רקטות וטילים,1,29
 נגב 296,27.07.2014,17:22:14,2014-07-27T17:22:00,1,ירי רקטות וטילים,1,30
 אשקלון 256,27.07.2014,17:22:14,2014-07-27T17:22:00,1,ירי רקטות וטילים,1,30
 עוטף עזה 234,27.07.2014,17:22:14,2014-07-27T17:22:00,1,ירי רקטות וטילים,1,30
 אשקלון 234,27.07.2014,17:22:14,2014-07-27T17:22:00,1,ירי רקטות וטילים,1,30
 פזורה 31,27.07.2014,17:22:14,2014-07-27T17:22:00,1,ירי רקטות וטילים,1,30
 באר שבע 286,27.07.2014,17:22:14,2014-07-27T17:22:00,1,ירי רקטות וטילים,1,30
באר שבע 292,27.07.2014,17:22:14,2014-07-27T17:22:00,1,ירי רקטות וטילים,1,30
 נגב 297,27.07.2014,17:22:14,2014-07-27T17:22:00,1,ירי רקטות וטילים,1,30
באר שבע 292,27.07.2014,17:22:21,2014-07-27T17:22:00,1,ירי רקטות וטילים,1,31
 באר שבע 286,27.07.2014,17:22:21,2014-07-27T17:22:00,1,ירי רקטות וטילים,1,31
 אשקלון 256,27.07.2014,17:22:21,2014-07-27T17:22:00,1,ירי רקטות וטילים,1,31
 עוטף עזה 234,27.07.2014,17:22:21,2014-07-27T17:22:00,1,ירי רקטות וטילים,1,31
 נגב 296,27.07.2014,17:22:21,2014-07-27T17:22:00,1,ירי רקטות וטילים,1,31
 אשקלון 234,27.07.2014,17:22:21,2014-07-27T17:22:00,1,ירי רקטות וטילים,1,31
 נגב 297,27.07.2014,17:22:21,2014-07-27T17:22:00,1,ירי רקטות וטילים,1,31
 אשקלון 234,27.07.2014,17:22:24,2014-07-27T17:22:00,1,ירי רקטות וטילים,1,32
באר שבע 292,27.07.2014,17:22:24,2014-07-27T17:22:00,1,ירי רקטות וטילים,1,32
 באר שבע 286,27.07.2014,17:22:24,2014-07-27T17:22:00,1,ירי רקטות וטילים,1,32
 עוטף עזה 234,27.07.2014,17:22:24,2014-07-27T17:22:00,1,ירי רקטות וטילים,1,32
 נגב 296,27.07.2014,17:22:24,2014-07-27T17:22:00,1,ירי רקטות וטילים,1,32
 באר שבע 285,27.07.2014,17:22:24,2014-07-27T17:22:00,1,ירי רקטות וטילים,1,32
 אשקלון 256,27.07.2014,17:22:24,2014-07-27T17:22:00,1,ירי רקטות וטילים,1,32
 נגב 297,27.07.2014,17:22:24,2014-07-27T17:22:00,1,ירי רקטות וטילים,1,32
 נגב 296,27.07.2014,17:22:33,2014-07-27T17:23:00,1,ירי רקטות וטילים,1,33
 אשקלון 256,27.07.2014,17:22:33,2014-07-27T17:23:00,1,ירי רקטות וטילים,1,33
 באר שבע 286,27.07.2014,17:22:33,2014-07-27T17:23:00,1,ירי רקטות וטילים,1,33
באר שבע 292,27.07.2014,17:22:33,2014-07-27T17:23:00,1,ירי רקטות וטילים,1,33
 באר שבע 285,27.07.2014,17:22:33,2014-07-27T17:23:00,1,ירי רקטות וטילים,1,33
 נגב 297,27.07.2014,17:22:33,2014-07-27T17:23:00,1,ירי רקטות וטילים,1,33
 באר שבע 285,27.07.2014,17:22:37,2014-07-27T17:23:00,1,ירי רקטות וטילים,1,34
 נגב 296,27.07.2014,17:22:37,2014-07-27T17:23:00,1,ירי רקטות וטילים,1,34
 אשקלון 256,27.07.2014,17:22:37,2014-07-27T17:23:00,1,ירי רקטות וטילים,1,34
באר שבע 292,27.07.2014,17:22:37,2014-07-27T17:23:00,1,ירי רקטות וטילים,1,34
 נגב 297,27.07.2014,17:22:37,2014-07-27T17:23:00,1,ירי רקטות וטילים,1,34
 באר שבע 285,27.07.2014,17:22:41,2014-07-27T17:23:00,1,ירי רקטות וטילים,1,35
 נגב 297,27.07.2014,17:22:41,2014-07-27T17:23:00,1,ירי רקטות וטילים,1,35
 נגב 296,27.07.2014,17:22:41,2014-07-27T17:23:00,1,ירי רקטות וטילים,1,35
באר שבע 292,27.07.2014,17:22:41,2014-07-27T17:23:00,1,ירי רקטות וטילים,1,35
באר שבע 292,27.07.2014,17:22:45,2014-07-27T17:23:00,1,ירי רקטות וטילים,1,36
 באר שבע 286,27.07.2014,17:22:45,2014-07-27T17:23:00,1,ירי רקטות וטילים,1,36
 נגב 297,27.07.2014,17:22:45,2014-07-27T17:23:00,1,ירי רקטות וטילים,1,36
 באר שבע 285,27.07.2014,17:22:45,2014-07-27T17:23:00,1,ירי רקטות וטילים,1,36
 באר שבע 291,27.07.2014,17:22:45,2014-07-27T17:23:00,1,ירי רקטות וטילים,1,36
 נגב 296,27.07.2014,17:22:45,2014-07-27T17:23:00,1,ירי רקטות וטילים,1,36
באר שבע 286,27.07.2014,17:22:53,2014-07-27T17:23:00,1,ירי רקטות וטילים,1,37
 באר שבע 291,27.07.2014,17:22:53,2014-07-27T17:23:00,1,ירי רקטות וטילים,1,37
 נגב 297,27.07.2014,17:22:53,2014-07-27T17:23:00,1,ירי רקטות וטילים,1,37
 באר שבע 285,27.07.2014,17:22:53,2014-07-27T17:23:00,1,ירי רקטות וטילים,1,37
 נגב 296,27.07.2014,17:22:53,2014-07-27T17:23:00,1,ירי רקטות וטילים,1,37
 נגב 297,27.07.2014,17:23:06,2014-07-27T17:23:00,1,ירי רקטות וטילים,1,38
 באר שבע 291,27.07.2014,17:23:06,2014-07-27T17:23:00,1,ירי רקטות וטילים,1,38
 באר שבע 285,27.07.2014,17:23:06,2014-07-27T17:23:00,1,ירי רקטות וטילים,1,38
באר שבע 286,27.07.2014,17:23:06,2014-07-27T17:23:00,1,ירי רקטות וטילים,1,38
 נגב 297,27.07.2014,17:23:21,2014-07-27T17:23:00,1,ירי רקטות וטילים,1,39
באר שבע 286,27.07.2014,17:23:21,2014-07-27T17:23:00,1,ירי רקטות וטילים,1,39
 באר שבע 291,27.07.2014,17:23:21,2014-07-27T17:23:00,1,ירי רקטות וטילים,1,39
 באר שבע 291,27.07.2014,17:23:22,2014-07-27T17:23:00,1,ירי רקטות וטילים,1,40
באר שבע 286,27.07.2014,17:23:22,2014-07-27T17:23:00,1,ירי רקטות וטילים,1,40
באר שבע 292,27.07.2014,17:23:31,2014-07-27T17:24:00,1,ירי רקטות וטילים,1,41
 באר שבע 291,27.07.2014,17:23:31,2014-07-27T17:24:00,1,ירי רקטות וטילים,1,41
 נגב 297,27.07.2014,17:23:31,2014-07-27T17:24:00,1,ירי רקטות וטילים,1,41
 באר שבע 286,27.07.2014,17:23:31,2014-07-27T17:24:00,1,ירי רקטות וטילים,1,41
 נגב 297,27.07.2014,17:23:41,2014-07-27T17:24:00,1,ירי רקטות וטילים,1,42
באר שבע 292,27.07.2014,17:23:41,2014-07-27T17:24:00,1,ירי רקטות וטילים,1,42
נגב 297,27.07.2014,17:24:29,2014-07-27T17:24:00,1,ירי רקטות וטילים,1,43
עוטף עזה 217,27.07.2014,18:10:44,2014-07-27T18:11:00,1,ירי רקטות וטילים,1,44
עוטף עזה 237,27.07.2014,18:41:49,2014-07-27T18:42:00,1,ירי רקטות וטילים,1,45
עוטף עזה 237,27.07.2014,18:42:13,2014-07-27T18:42:00,1,ירי רקטות וטילים,1,46
עוטף עזה 230,27.07.2014,19:31:59,2014-07-27T19:32:00,1,ירי רקטות וטילים,1,47
עוטף עזה 224,27.07.2014,19:48:55,2014-07-27T19:49:00,1,ירי רקטות וטילים,1,48
עוטף עזה 217,27.07.2014,20:03:04,2014-07-27T20:03:00,1,ירי רקטות וטילים,1,49
אשקלון 254,27.07.2014,21:00:31,2014-07-27T21:01:00,1,ירי רקטות וטילים,1,50
 עוטף עזה 216,27.07.2014,21:00:31,2014-07-27T21:01:00,1,ירי רקטות וטילים,1,50
 אשקלון 255,27.07.2014,21:00:35,2014-07-27T21:01:00,1,ירי רקטות וטילים,1,51
 עוטף עזה 216,27.07.2014,21:00:35,2014-07-27T21:01:00,1,ירי רקטות וטילים,1,51
אשקלון 254,27.07.2014,21:00:35,2014-07-27T21:01:00,1,ירי רקטות וטילים,1,51
 עוטף עזה 216,27.07.2014,21:00:35,2014-07-27T21:01:00,1,ירי רקטות וטילים,1,52
אשקלון 254,27.07.2014,21:00:35,2014-07-27T21:01:00,1,ירי רקטות וטילים,1,52
 אשקלון 255,27.07.2014,21:00:35,2014-07-27T21:01:00,1,ירי רקטות וטילים,1,52
 אשקלון 255,27.07.2014,21:00:48,2014-07-27T21:01:00,1,ירי רקטות וטילים,1,53
אשקלון 254,27.07.2014,21:00:48,2014-07-27T21:01:00,1,ירי רקטות וטילים,1,53
 עוטף עזה 216,27.07.2014,21:00:51,2014-07-27T21:01:00,1,ירי רקטות וטילים,1,54
 אשקלון 255,27.07.2014,21:00:51,2014-07-27T21:01:00,1,ירי רקטות וטילים,1,54
אשקלון 254,27.07.2014,21:00:51,2014-07-27T21:01:00,1,ירי רקטות וטילים,1,54
אשקלון 255,27.07.2014,21:01:00,2014-07-27T21:01:00,1,ירי רקטות וטילים,1,55
 עוטף עזה 216,27.07.2014,21:01:00,2014-07-27T21:01:00,1,ירי רקטות וטילים,1,55
עוטף עזה 216,27.07.2014,21:01:02,2014-07-27T21:01:00,1,ירי רקטות וטילים,1,56
עוטף עזה 227,27.07.2014,23:19:00,2014-07-27T23:19:00,1,ירי רקטות וטילים,1,57
אשקלון 246,28.07.2014,07:14:47,2014-07-28T07:15:00,1,ירי רקטות וטילים,1,58
עוטף עזה 217,28.07.2014,12:38:38,2014-07-28T12:39:00,1,ירי רקטות וטילים,1,59
עוטף עזה 217,28.07.2014,12:39:11,2014-07-28T12:39:00,1,ירי רקטות וטילים,1,60
עוטף עזה 225,28.07.2014,13:28:55,2014-07-28T13:29:00,1,ירי רקטות וטילים,1,61
עוטף עזה 225,28.07.2014,13:28:55,2014-07-28T13:29:00,1,ירי רקטות וטילים,1,62
עוטף עזה 227,28.07.2014,14:46:41,2014-07-28T14:47:00,1,ירי רקטות וטילים,1,63
 עוטף עזה 217,28.07.2014,14:56:31,2014-07-28T14:57:00,1,ירי רקטות וטילים,1,64
עוטף עזה 218,28.07.2014,14:56:31,2014-07-28T14:57:00,1,ירי רקטות וטילים,1,64
 אשקלון 247,28.07.2014,16:58:39,2014-07-28T16:59:00,1,ירי רקטות וטילים,1,65
אשקלון 246,28.07.2014,16:58:39,2014-07-28T16:59:00,1,ירי רקטות וטילים,1,65
 אשקלון 247,28.07.2014,16:59:03,2014-07-28T16:59:00,1,ירי רקטות וטילים,1,66
אשקלון 246,28.07.2014,16:59:03,2014-07-28T16:59:00,1,ירי רקטות וטילים,1,66
אשקלון 247,28.07.2014,16:59:04,2014-07-28T16:59:00,1,ירי רקטות וטילים,1,67
אשקלון 246,28.07.2014,17:13:05,2014-07-28T17:13:00,1,ירי רקטות וטילים,1,68
 אשקלון 250,28.07.2014,17:13:05,2014-07-28T17:13:00,1,ירי רקטות וטילים,1,68
 אשקלון 247,28.07.2014,17:13:07,2014-07-28T17:13:00,1,ירי רקטות וטילים,1,69
 אשקלון 250,28.07.2014,17:13:07,2014-07-28T17:13:00,1,ירי רקטות וטילים,1,69
 עוטף עזה 217,28.07.2014,17:13:07,2014-07-28T17:13:00,1,ירי רקטות וטילים,1,69
 עוטף עזה 218,28.07.2014,17:13:07,2014-07-28T17:13:00,1,ירי רקטות וטילים,1,69
אשקלון 246,28.07.2014,17:13:07,2014-07-28T17:13:00,1,ירי רקטות וטילים,1,69
 אשקלון 250,28.07.2014,17:13:24,2014-07-28T17:13:00,1,ירי רקטות וטילים,1,70
 אשקלון 247,28.07.2014,17:13:24,2014-07-28T17:13:00,1,ירי רקטות וטילים,1,70
אשקלון 246,28.07.2014,17:13:24,2014-07-28T17:13:00,1,ירי רקטות וטילים,1,70
אשקלון 247,28.07.2014,17:13:32,2014-07-28T17:14:00,1,ירי רקטות וטילים,1,71
עוטף עזה 231,28.07.2014,18:08:30,2014-07-28T18:09:00,1,ירי רקטות וטילים,1,72
אשדוד 271,28.07.2014,18:19:54,2014-07-28T18:20:00,1,ירי רקטות וטילים,1,73
 אשדוד 272,28.07.2014,18:20:36,2014-07-28T18:21:00,1,ירי רקטות וטילים,1,74
אשקלון 245,28.07.2014,18:20:36,2014-07-28T18:21:00,1,ירי רקטות וטילים,1,74
באר שבע 288,28.07.2014,18:39:23,2014-07-28T18:39:00,1,ירי רקטות וטילים,1,75
 באר שבע 289,28.07.2014,18:39:34,2014-07-28T18:40:00,1,ירי רקטות וטילים,1,76
באר שבע 288,28.07.2014,18:39:34,2014-07-28T18:40:00,1,ירי רקטות וטילים,1,76
 אשקלון 256,28.07.2014,18:39:39,2014-07-28T18:40:00,1,ירי רקטות וטילים,1,77
 באר שבע 289,28.07.2014,18:39:39,2014-07-28T18:40:00,1,ירי רקטות וטילים,1,77
באר שבע 288,28.07.2014,18:39:39,2014-07-28T18:40:00,1,ירי רקטות וטילים,1,77
 באר שבע 289,28.07.2014,18:40:05,2014-07-28T18:40:00,1,ירי רקטות וטילים,1,78
אשקלון 256,28.07.2014,18:40:05,2014-07-28T18:40:00,1,ירי רקטות וטילים,1,78
באר שבע 289,28.07.2014,18:40:06,2014-07-28T18:40:00,1,ירי רקטות וטילים,1,79
עוטף עזה 218,28.07.2014,18:41:03,2014-07-28T18:41:00,1,ירי רקטות וטילים,1,80
 כרמל 81,28.07.2014,19:09:37,2014-07-28T19:10:00,1,ירי רקטות וטילים,1,81
 כרמל 82,28.07.2014,19:09:37,2014-07-28T19:10:00,1,ירי רקטות וטילים,1,81
מנשה 102,28.07.2014,19:09:37,2014-07-28T19:10:00,1,ירי רקטות וטילים,1,81
מנשה 102,28.07.2014,19:10:34,2014-07-28T19:11:00,1,ירי רקטות וטילים,1,82
 מנשה 104,28.07.2014,19:10:49,2014-07-28T19:11:00,1,ירי רקטות וטילים,1,83
מנשה 102,28.07.2014,19:10:49,2014-07-28T19:11:00,1,ירי רקטות וטילים,1,83
מנשה 104,28.07.2014,19:11:04,2014-07-28T19:11:00,1,ירי רקטות וטילים,1,84
מנשה 104,28.07.2014,19:11:04,2014-07-28T19:11:00,1,ירי רקטות וטילים,1,85
מנשה 107,28.07.2014,19:11:28,2014-07-28T19:11:00,1,ירי רקטות וטילים,1,86
 מנשה 105,28.07.2014,19:11:28,2014-07-28T19:11:00,1,ירי רקטות וטילים,1,86
 מנשה 104,28.07.2014,19:11:28,2014-07-28T19:11:00,1,ירי רקטות וטילים,1,86
 מנשה 105,28.07.2014,19:12:16,2014-07-28T19:12:00,1,ירי רקטות וטילים,1,87
מנשה 107,28.07.2014,19:12:16,2014-07-28T19:12:00,1,ירי רקטות וטילים,1,87
עוטף עזה 217,28.07.2014,19:21:36,2014-07-28T19:22:00,1,ירי רקטות וטילים,1,88
עוטף עזה 217,28.07.2014,19:22:01,2014-07-28T19:22:00,1,ירי רקטות וטילים,1,89
עוטף עזה 237,28.07.2014,20:09:53,2014-07-28T20:10:00,1,ירי רקטות וטילים,1,90
עוטף עזה 237,28.07.2014,20:09:53,2014-07-28T20:10:00,1,ירי רקטות וטילים,1,91
עוטף עזה 237,28.07.2014,20:42:05,2014-07-28T20:42:00,1,ירי רקטות וטילים,1,92
עוטף עזה 236,28.07.2014,21:56:16,2014-07-28T21:56:00,1,ירי רקטות וטילים,1,93
 אשקלון 238,28.07.2014,21:56:16,2014-07-28T21:56:00,1,ירי רקטות וטילים,1,93
 עוטף עזה 238,28.07.2014,21:56:16,2014-07-28T21:56:00,1,ירי רקטות וטילים,1,93
 עוטף עזה 238,28.07.2014,21:56:33,2014-07-28T21:57:00,1,ירי רקטות וטילים,1,94
אשקלון 238,28.07.2014,21:56:33,2014-07-28T21:57:00,1,ירי רקטות וטילים,1,94
עוטף עזה 237,28.07.2014,21:57:30,2014-07-28T21:58:00,1,ירי רקטות וטילים,1,95
עוטף עזה 237,29.07.2014,02:14:38,2014-07-29T02:15:00,1,ירי רקטות וטילים,1,96
 אשדוד 273,29.07.2014,02:28:45,2014-07-29T02:29:00,1,ירי רקטות וטילים,1,97
 אשדוד 266,29.07.2014,02:28:45,2014-07-29T02:29:00,1,ירי רקטות וטילים,1,97
 אשדוד 268,29.07.2014,02:28:45,2014-07-29T02:29:00,1,ירי רקטות וטילים,1,97
אשדוד 275,29.07.2014,02:28:45,2014-07-29T02:29:00,1,ירי רקטות וטילים,1,97
 אשדוד 272,29.07.2014,02:28:45,2014-07-29T02:29:00,1,ירי רקטות וטילים,1,97
 אשדוד 267,29.07.2014,02:28:45,2014-07-29T02:29:00,1,ירי רקטות וטילים,1,97
אשדוד 271,29.07.2014,02:28:53,2014-07-29T02:29:00,1,ירי רקטות וטילים,1,98
 אשדוד 275,29.07.2014,02:28:53,2014-07-29T02:29:00,1,ירי רקטות וטילים,1,98
 אשדוד 268,29.07.2014,02:28:53,2014-07-29T02:29:00,1,ירי רקטות וטילים,1,98
 אשדוד 266,29.07.2014,02:28:53,2014-07-29T02:29:00,1,ירי רקטות וטילים,1,98
 אשדוד 273,29.07.2014,02:28:53,2014-07-29T02:29:00,1,ירי רקטות וטילים,1,98
 אשדוד 267,29.07.2014,02:28:53,2014-07-29T02:29:00,1,ירי רקטות וטילים,1,98
 אשדוד 272,29.07.2014,02:28:53,2014-07-29T02:29:00,1,ירי רקטות וטילים,1,98
אשדוד 271,29.07.2014,02:29:13,2014-07-29T02:29:00,1,ירי רקטות וטילים,1,99
 שפלה 175,29.07.2014,02:29:13,2014-07-29T02:29:00,1,ירי רקטות וטילים,1,99
 אשדוד 268,29.07.2014,02:29:13,2014-07-29T02:29:00,1,ירי רקטות וטילים,1,99
 אשדוד 266,29.07.2014,02:29:13,2014-07-29T02:29:00,1,ירי רקטות וטילים,1,99
 שפלה 169,29.07.2014,02:29:13,2014-07-29T02:29:00,1,ירי רקטות וטילים,1,99
 אשדוד 275,29.07.2014,02:29:13,2014-07-29T02:29:00,1,ירי רקטות וטילים,1,99
 שפלה 179,29.07.2014,02:29:13,2014-07-29T02:29:00,1,ירי רקטות וטילים,1,99
 שפלה 170,29.07.2014,02:29:13,2014-07-29T02:29:00,1,ירי רקטות וטילים,1,99
 אשדוד 273,29.07.2014,02:29:13,2014-07-29T02:29:00,1,ירי רקטות וטילים,1,99
 אשדוד 272,29.07.2014,02:29:13,2014-07-29T02:29:00,1,ירי רקטות וטילים,1,99
 אשדוד 267,29.07.2014,02:29:13,2014-07-29T02:29:00,1,ירי רקטות וטילים,1,99
 שפלה 173,29.07.2014,02:29:13,2014-07-29T02:29:00,1,ירי רקטות וטילים,1,99
 שפלה 174,29.07.2014,02:29:13,2014-07-29T02:29:00,1,ירי רקטות וטילים,1,99
 שפלה 178,29.07.2014,02:29:13,2014-07-29T02:29:00,1,ירי רקטות וטילים,1,99
אשדוד 271,29.07.2014,02:29:13,2014-07-29T02:29:00,1,ירי רקטות וטילים,1,100
 שפלה 175,29.07.2014,02:29:13,2014-07-29T02:29:00,1,ירי רקטות וטילים,1,100
 אשדוד 275,29.07.2014,02:29:13,2014-07-29T02:29:00,1,ירי רקטות וטילים,1,100
 אשדוד 268,29.07.2014,02:29:13,2014-07-29T02:29:00,1,ירי רקטות וטילים,1,100
 אשדוד 266,29.07.2014,02:29:13,2014-07-29T02:29:00,1,ירי רקטות וטילים,1,100
 שפלה 169,29.07.2014,02:29:13,2014-07-29T02:29:00,1,ירי רקטות וטילים,1,100
 שפלה 179,29.07.2014,02:29:13,2014-07-29T02:29:00,1,ירי רקטות וטילים,1,100
 שפלה 170,29.07.2014,02:29:13,2014-07-29T02:29:00,1,ירי רקטות וטילים,1,100
 אשדוד 273,29.07.2014,02:29:13,2014-07-29T02:29:00,1,ירי רקטות וטילים,1,100
 אשדוד 267,29.07.2014,02:29:13,2014-07-29T02:29:00,1,ירי רקטות וטילים,1,100
 שפלה 173,29.07.2014,02:29:13,2014-07-29T02:29:00,1,ירי רקטות וטילים,1,100
 שפלה 174,29.07.2014,02:29:13,2014-07-29T02:29:00,1,ירי רקטות וטילים,1,100
 אשדוד 272,29.07.2014,02:29:13,2014-07-29T02:29:00,1,ירי רקטות וטילים,1,100
 שפלה 178,29.07.2014,02:29:13,2014-07-29T02:29:00,1,ירי רקטות וטילים,1,100
אשדוד 271,29.07.2014,02:29:27,2014-07-29T02:29:00,1,ירי רקטות וטילים,1,101
 שפלה 175,29.07.2014,02:29:27,2014-07-29T02:29:00,1,ירי רקטות וטילים,1,101
 אשדוד 266,29.07.2014,02:29:27,2014-07-29T02:29:00,1,ירי רקטות וטילים,1,101
 שפלה 178,29.07.2014,02:29:27,2014-07-29T02:29:00,1,ירי רקטות וטילים,1,101
 אשדוד 268,29.07.2014,02:29:27,2014-07-29T02:29:00,1,ירי רקטות וטילים,1,101
 שפלה 169,29.07.2014,02:29:27,2014-07-29T02:29:00,1,ירי רקטות וטילים,1,101
 שפלה 170,29.07.2014,02:29:27,2014-07-29T02:29:00,1,ירי רקטות וטילים,1,101
 אשדוד 273,29.07.2014,02:29:27,2014-07-29T02:29:00,1,ירי רקטות וטילים,1,101
 אשדוד 267,29.07.2014,02:29:27,2014-07-29T02:29:00,1,ירי רקטות וטילים,1,101
 שפלה 173,29.07.2014,02:29:27,2014-07-29T02:29:00,1,ירי רקטות וטילים,1,101
 שפלה 179,29.07.2014,02:29:27,2014-07-29T02:29:00,1,ירי רקטות וטילים,1,101
 שפלה 174,29.07.2014,02:29:27,2014-07-29T02:29:00,1,ירי רקטות וטילים,1,101
אשדוד 271,29.07.2014,02:29:27,2014-07-29T02:29:00,1,ירי רקטות וטילים,1,102
 שפלה 175,29.07.2014,02:29:27,2014-07-29T02:29:00,1,ירי רקטות וטילים,1,102
 אשדוד 268,29.07.2014,02:29:27,2014-07-29T02:29:00,1,ירי רקטות וטילים,1,102
 אשדוד 266,29.07.2014,02:29:27,2014-07-29T02:29:00,1,ירי רקטות וטילים,1,102
 שפלה 169,29.07.2014,02:29:27,2014-07-29T02:29:00,1,ירי רקטות וטילים,1,102
 שפלה 178,29.07.2014,02:29:27,2014-07-29T02:29:00,1,ירי רקטות וטילים,1,102
 שפלה 179,29.07.2014,02:29:27,2014-07-29T02:29:00,1,ירי רקטות וטילים,1,102
 שפלה 170,29.07.2014,02:29:27,2014-07-29T02:29:00,1,ירי רקטות וטילים,1,102
 אשדוד 273,29.07.2014,02:29:27,2014-07-29T02:29:00,1,ירי רקטות וטילים,1,102
 אשדוד 267,29.07.2014,02:29:27,2014-07-29T02:29:00,1,ירי רקטות וטילים,1,102
 שפלה 173,29.07.2014,02:29:27,2014-07-29T02:29:00,1,ירי רקטות וטילים,1,102
 שפלה 174,29.07.2014,02:29:27,2014-07-29T02:29:00,1,ירי רקטות וטילים,1,102
שפלה 175,29.07.2014,02:29:35,2014-07-29T02:30:00,1,ירי רקטות וטילים,1,103
 אשדוד 268,29.07.2014,02:29:35,2014-07-29T02:30:00,1,ירי רקטות וטילים,1,103
 שפלה 169,29.07.2014,02:29:35,2014-07-29T02:30:00,1,ירי רקטות וטילים,1,103
 שפלה 178,29.07.2014,02:29:35,2014-07-29T02:30:00,1,ירי רקטות וטילים,1,103
 אשדוד 266,29.07.2014,02:29:35,2014-07-29T02:30:00,1,ירי רקטות וטילים,1,103
 שפלה 170,29.07.2014,02:29:35,2014-07-29T02:30:00,1,ירי רקטות וטילים,1,103
 אשדוד 273,29.07.2014,02:29:35,2014-07-29T02:30:00,1,ירי רקטות וטילים,1,103
 אשדוד 267,29.07.2014,02:29:35,2014-07-29T02:30:00,1,ירי רקטות וטילים,1,103
 שפלה 173,29.07.2014,02:29:35,2014-07-29T02:30:00,1,ירי רקטות וטילים,1,103
 שפלה 179,29.07.2014,02:29:35,2014-07-29T02:30:00,1,ירי רקטות וטילים,1,103
 שפלה 174,29.07.2014,02:29:35,2014-07-29T02:30:00,1,ירי רקטות וטילים,1,103
שפלה 175,29.07.2014,02:29:42,2014-07-29T02:30:00,1,ירי רקטות וטילים,1,104
 שפלה 169,29.07.2014,02:29:42,2014-07-29T02:30:00,1,ירי רקטות וטילים,1,104
 שפלה 178,29.07.2014,02:29:42,2014-07-29T02:30:00,1,ירי רקטות וטילים,1,104
 שפלה 179,29.07.2014,02:29:42,2014-07-29T02:30:00,1,ירי רקטות וטילים,1,104
 שפלה 170,29.07.2014,02:29:42,2014-07-29T02:30:00,1,ירי רקטות וטילים,1,104
 שפלה 173,29.07.2014,02:29:42,2014-07-29T02:30:00,1,ירי רקטות וטילים,1,104
 שפלה 174,29.07.2014,02:29:42,2014-07-29T02:30:00,1,ירי רקטות וטילים,1,104
דן 157,29.07.2014,02:30:17,2014-07-29T02:30:00,1,ירי רקטות וטילים,1,105
 שפלה 175,29.07.2014,02:30:17,2014-07-29T02:30:00,1,ירי רקטות וטילים,1,105
 דן 162,29.07.2014,02:30:17,2014-07-29T02:30:00,1,ירי רקטות וטילים,1,105
 שפלה 182,29.07.2014,02:30:17,2014-07-29T02:30:00,1,ירי רקטות וטילים,1,105
 שפלה 183,29.07.2014,02:30:17,2014-07-29T02:30:00,1,ירי רקטות וטילים,1,105
 שפלה 178,29.07.2014,02:30:17,2014-07-29T02:30:00,1,ירי רקטות וטילים,1,105
 שפלה 179,29.07.2014,02:30:17,2014-07-29T02:30:00,1,ירי רקטות וטילים,1,105
 שפלה 170,29.07.2014,02:30:17,2014-07-29T02:30:00,1,ירי רקטות וטילים,1,105
 שפלה 173,29.07.2014,02:30:17,2014-07-29T02:30:00,1,ירי רקטות וטילים,1,105
 שפלה 174,29.07.2014,02:30:17,2014-07-29T02:30:00,1,ירי רקטות וטילים,1,105
 שפלה 169,29.07.2014,02:30:17,2014-07-29T02:30:00,1,ירי רקטות וטילים,1,105
דן 157,29.07.2014,02:30:18,2014-07-29T02:30:00,1,ירי רקטות וטילים,1,106
 שפלה 175,29.07.2014,02:30:18,2014-07-29T02:30:00,1,ירי רקטות וטילים,1,106
 דן 162,29.07.2014,02:30:18,2014-07-29T02:30:00,1,ירי רקטות וטילים,1,106
 שפלה 182,29.07.2014,02:30:18,2014-07-29T02:30:00,1,ירי רקטות וטילים,1,106
 שפלה 169,29.07.2014,02:30:18,2014-07-29T02:30:00,1,ירי רקטות וטילים,1,106
 שפלה 178,29.07.2014,02:30:18,2014-07-29T02:30:00,1,ירי רקטות וטילים,1,106
 שפלה 173,29.07.2014,02:30:18,2014-07-29T02:30:00,1,ירי רקטות וטילים,1,106
 שפלה 174,29.07.2014,02:30:18,2014-07-29T02:30:00,1,ירי רקטות וטילים,1,106
 שפלה 170,29.07.2014,02:30:18,2014-07-29T02:30:00,1,ירי רקטות וטילים,1,106
 שפלה 179,29.07.2014,02:30:18,2014-07-29T02:30:00,1,ירי רקטות וטילים,1,106
 שפלה 183,29.07.2014,02:30:18,2014-07-29T02:30:00,1,ירי רקטות וטילים,1,106
 דן 162,29.07.2014,02:30:40,2014-07-29T02:31:00,1,ירי רקטות וטילים,1,107
דן 157,29.07.2014,02:30:40,2014-07-29T02:31:00,1,ירי רקטות וטילים,1,107
 שפלה 182,29.07.2014,02:30:40,2014-07-29T02:31:00,1,ירי רקטות וטילים,1,107
 שפלה 183,29.07.2014,02:30:40,2014-07-29T02:31:00,1,ירי רקטות וטילים,1,107
אשקלון 246,29.07.2014,03:05:39,2014-07-29T03:06:00,1,ירי רקטות וטילים,1,108
עוטף עזה 218,29.07.2014,04:10:05,2014-07-29T04:10:00,1,ירי רקטות וטילים,1,109
עוטף עזה 220,29.07.2014,05:59:52,2014-07-29T06:00:00,1,ירי רקטות וטילים,1,110
עוטף עזה 217,29.07.2014,09:17:32,2014-07-29T09:18:00,1,ירי רקטות וטילים,1,111
עוטף עזה 217,29.07.2014,09:37:28,2014-07-29T09:37:00,1,ירי רקטות וטילים,1,112
אשקלון 246,29.07.2014,11:12:59,2014-07-29T11:13:00,1,ירי רקטות וטילים,1,113
 אשקלון 250,29.07.2014,11:12:59,2014-07-29T11:13:00,1,ירי רקטות וטילים,1,113
 עוטף עזה 219,29.07.2014,11:13:02,2014-07-29T11:13:00,1,ירי רקטות וטילים,1,114
 עוטף עזה 217,29.07.2014,11:13:02,2014-07-29T11:13:00,1,ירי רקטות וטילים,1,114
 עוטף עזה 218,29.07.2014,11:13:02,2014-07-29T11:13:00,1,ירי רקטות וטילים,1,114
אשקלון 246,29.07.2014,11:13:02,2014-07-29T11:13:00,1,ירי רקטות וטילים,1,114
 אשקלון 247,29.07.2014,11:13:02,2014-07-29T11:13:00,1,ירי רקטות וטילים,1,114
 אשקלון 250,29.07.2014,11:13:02,2014-07-29T11:13:00,1,ירי רקטות וטילים,1,114
 אשקלון 247,29.07.2014,11:13:19,2014-07-29T11:13:00,1,ירי רקטות וטילים,1,115
 אשקלון 250,29.07.2014,11:13:19,2014-07-29T11:13:00,1,ירי רקטות וטילים,1,115
אשקלון 246,29.07.2014,11:13:19,2014-07-29T11:13:00,1,ירי רקטות וטילים,1,115
אשקלון 247,29.07.2014,11:13:26,2014-07-29T11:13:00,1,ירי רקטות וטילים,1,116
עוטף עזה 237,29.07.2014,13:19:33,2014-07-29T13:20:00,1,ירי רקטות וטילים,1,117
עוטף עזה 237,29.07.2014,13:40:43,2014-07-29T13:41:00,1,ירי רקטות וטילים,1,118
עוטף עזה 217,29.07.2014,13:56:13,2014-07-29T13:56:00,1,ירי רקטות וטילים,1,119
עוטף עזה 217,29.07.2014,13:56:13,2014-07-29T13:56:00,1,ירי רקטות וטילים,1,120
עוטף עזה 217,29.07.2014,14:00:05,2014-07-29T14:00:00,1,ירי רקטות וטילים,1,121
עוטף עזה 220,29.07.2014,14:12:11,2014-07-29T14:12:00,1,ירי רקטות וטילים,1,122
עוטף עזה 218,29.07.2014,14:17:09,2014-07-29T14:17:00,1,ירי רקטות וטילים,1,123
עוטף עזה 221,29.07.2014,14:26:47,2014-07-29T14:27:00,1,ירי רקטות וטילים,1,124
עוטף עזה 217,29.07.2014,15:19:09,2014-07-29T15:19:00,1,ירי רקטות וטילים,1,125
אשקלון 255,29.07.2014,15:58:03,2014-07-29T15:58:00,1,ירי רקטות וטילים,1,126
 עוטף עזה 216,29.07.2014,15:58:24,2014-07-29T15:58:00,1,ירי רקטות וטילים,1,127
 אשקלון 255,29.07.2014,15:58:24,2014-07-29T15:58:00,1,ירי רקטות וטילים,1,127
אשקלון 254,29.07.2014,15:58:24,2014-07-29T15:58:00,1,ירי רקטות וטילים,1,127
 עוטף עזה 216,29.07.2014,15:58:31,2014-07-29T15:59:00,1,ירי רקטות וטילים,1,128
אשקלון 254,29.07.2014,15:58:31,2014-07-29T15:59:00,1,ירי רקטות וטילים,1,128
 עוטף עזה 216,29.07.2014,15:58:31,2014-07-29T15:59:00,1,ירי רקטות וטילים,1,129
אשקלון 254,29.07.2014,15:58:31,2014-07-29T15:59:00,1,ירי רקטות וטילים,1,129
 עוטף עזה 225,29.07.2014,15:58:31,2014-07-29T15:59:00,1,ירי רקטות וטילים,1,129
 עוטף עזה 225,29.07.2014,15:58:41,2014-07-29T15:59:00,1,ירי רקטות וטילים,1,130
אשקלון 254,29.07.2014,15:58:41,2014-07-29T15:59:00,1,ירי רקטות וטילים,1,130
אשקלון 254,29.07.2014,15:58:48,2014-07-29T15:59:00,1,ירי רקטות וטילים,1,131
עוטף עזה 217,29.07.2014,16:06:58,2014-07-29T16:07:00,1,ירי רקטות וטילים,1,132
 אשקלון 245,29.07.2014,16:25:49,2014-07-29T16:26:00,1,ירי רקטות וטילים,1,133
 עוטף עזה 231,29.07.2014,16:25:49,2014-07-29T16:26:00,1,ירי רקטות וטילים,1,133
עוטף עזה 232,29.07.2014,16:25:49,2014-07-29T16:26:00,1,ירי רקטות וטילים,1,133
אשקלון 245,29.07.2014,16:26:06,2014-07-29T16:26:00,1,ירי רקטות וטילים,1,134
עוטף עזה 237,29.07.2014,17:10:58,2014-07-29T17:11:00,1,ירי רקטות וטילים,1,135
עוטף עזה 237,29.07.2014,17:11:01,2014-07-29T17:11:00,1,ירי רקטות וטילים,1,136
 עוטף עזה 236,29.07.2014,17:11:01,2014-07-29T17:11:00,1,ירי רקטות וטילים,1,136
עוטף עזה 236,29.07.2014,17:11:15,2014-07-29T17:11:00,1,ירי רקטות וטילים,1,137
עוטף עזה 224,29.07.2014,19:04:47,2014-07-29T19:05:00,1,ירי רקטות וטילים,1,138
עוטף עזה 217,29.07.2014,19:30:27,2014-07-29T19:30:00,1,ירי רקטות וטילים,1,139
עוטף עזה 217,29.07.2014,19:31:25,2014-07-29T19:31:00,1,ירי רקטות וטילים,1,140
עוטף עזה 217,29.07.2014,19:36:10,2014-07-29T19:36:00,1,ירי רקטות וטילים,1,141
עוטף עזה 217,29.07.2014,19:36:32,2014-07-29T19:37:00,1,ירי רקטות וטילים,1,142
עוטף עזה 217,29.07.2014,19:40:15,2014-07-29T19:40:00,1,ירי רקטות וטילים,1,143
בית שמש 191,29.07.2014,20:21:04,2014-07-29T20:21:00,1,ירי רקטות וטילים,1,144
 בית שמש 189,29.07.2014,20:21:31,2014-07-29T20:22:00,1,ירי רקטות וטילים,1,145
בית שמש 191,29.07.2014,20:21:31,2014-07-29T20:22:00,1,ירי רקטות וטילים,1,145
יהודה 188,29.07.2014,20:22:03,2014-07-29T20:22:00,1,ירי רקטות וטילים,1,146
 בית שמש 188,29.07.2014,20:22:03,2014-07-29T20:22:00,1,ירי רקטות וטילים,1,146
 בית שמש 189,29.07.2014,20:22:03,2014-07-29T20:22:00,1,ירי רקטות וטילים,1,146
 בית שמש 191,29.07.2014,20:22:03,2014-07-29T20:22:00,1,ירי רקטות וטילים,1,146
 יהודה 206,29.07.2014,20:22:03,2014-07-29T20:22:00,1,ירי רקטות וטילים,1,146
 בית שמש 189,29.07.2014,20:22:31,2014-07-29T20:23:00,1,ירי רקטות וטילים,1,147
 יהודה 206,29.07.2014,20:22:31,2014-07-29T20:23:00,1,ירי רקטות וטילים,1,147
 בית שמש 188,29.07.2014,20:22:31,2014-07-29T20:23:00,1,ירי רקטות וטילים,1,147
יהודה 188,29.07.2014,20:22:31,2014-07-29T20:23:00,1,ירי רקטות וטילים,1,147
 יהודה 206,29.07.2014,20:22:59,2014-07-29T20:23:00,1,ירי רקטות וטילים,1,148
 בית שמש 188,29.07.2014,20:22:59,2014-07-29T20:23:00,1,ירי רקטות וטילים,1,148
יהודה 188,29.07.2014,20:22:59,2014-07-29T20:23:00,1,ירי רקטות וטילים,1,148
פזורה 31,29.07.2014,21:26:36,2014-07-29T21:27:00,1,ירי רקטות וטילים,1,149
פזורה 31,29.07.2014,21:26:43,2014-07-29T21:27:00,1,ירי רקטות וטילים,1,150
 פזורה 25,29.07.2014,21:26:43,2014-07-29T21:27:00,1,ירי רקטות וטילים,1,150
 פזורה 25,29.07.2014,21:26:46,2014-07-29T21:27:00,1,ירי רקטות וטילים,1,151
 פזורה 31,29.07.2014,21:26:46,2014-07-29T21:27:00,1,ירי רקטות וטילים,1,151
 באר שבע 289,29.07.2014,21:26:46,2014-07-29T21:27:00,1,ירי רקטות וטילים,1,151
 באר שבע 286,29.07.2014,21:26:46,2014-07-29T21:27:00,1,ירי רקטות וטילים,1,151
באר שבע 292,29.07.2014,21:26:46,2014-07-29T21:27:00,1,ירי רקטות וטילים,1,151
 נגב 296,29.07.2014,21:26:46,2014-07-29T21:27:00,1,ירי רקטות וטילים,1,151
 באר שבע 286,29.07.2014,21:26:53,2014-07-29T21:27:00,1,ירי רקטות וטילים,1,152
 באר שבע 289,29.07.2014,21:26:53,2014-07-29T21:27:00,1,ירי רקטות וטילים,1,152
באר שבע 292,29.07.2014,21:26:53,2014-07-29T21:27:00,1,ירי רקטות וטילים,1,152
 פזורה 25,29.07.2014,21:26:53,2014-07-29T21:27:00,1,ירי רקטות וטילים,1,152
 נגב 296,29.07.2014,21:26:53,2014-07-29T21:27:00,1,ירי רקטות וטילים,1,152
 נגב 297,29.07.2014,21:26:53,2014-07-29T21:27:00,1,ירי רקטות וטילים,1,152
 פזורה 31,29.07.2014,21:26:53,2014-07-29T21:27:00,1,ירי רקטות וטילים,1,152
 נגב 297,29.07.2014,21:26:53,2014-07-29T21:27:00,1,ירי רקטות וטילים,1,153
 נגב 296,29.07.2014,21:26:53,2014-07-29T21:27:00,1,ירי רקטות וטילים,1,153
 פזורה 25,29.07.2014,21:26:53,2014-07-29T21:27:00,1,ירי רקטות וטילים,1,153
 פזורה 31,29.07.2014,21:26:53,2014-07-29T21:27:00,1,ירי רקטות וטילים,1,153
 באר שבע 289,29.07.2014,21:26:53,2014-07-29T21:27:00,1,ירי רקטות וטילים,1,153
 באר שבע 286,29.07.2014,21:26:53,2014-07-29T21:27:00,1,ירי רקטות וטילים,1,153
באר שבע 292,29.07.2014,21:26:53,2014-07-29T21:27:00,1,ירי רקטות וטילים,1,153
באר שבע 292,29.07.2014,21:26:57,2014-07-29T21:27:00,1,ירי רקטות וטילים,1,154
 באר שבע 286,29.07.2014,21:26:57,2014-07-29T21:27:00,1,ירי רקטות וטילים,1,154
 באר שבע 289,29.07.2014,21:26:57,2014-07-29T21:27:00,1,ירי רקטות וטילים,1,154
 פזורה 31,29.07.2014,21:26:57,2014-07-29T21:27:00,1,ירי רקטות וטילים,1,154
 נגב 296,29.07.2014,21:26:57,2014-07-29T21:27:00,1,ירי רקטות וטילים,1,154
 פזורה 25,29.07.2014,21:26:57,2014-07-29T21:27:00,1,ירי רקטות וטילים,1,154
 פזורה לקיה,29.07.2014,21:26:57,2014-07-29T21:27:00,1,ירי רקטות וטילים,1,154
 נגב 297,29.07.2014,21:26:57,2014-07-29T21:27:00,1,ירי רקטות וטילים,1,154
 נגב 296,29.07.2014,21:27:09,2014-07-29T21:27:00,1,ירי רקטות וטילים,1,155
באר שבע 292,29.07.2014,21:27:09,2014-07-29T21:27:00,1,ירי רקטות וטילים,1,155
 באר שבע 286,29.07.2014,21:27:09,2014-07-29T21:27:00,1,ירי רקטות וטילים,1,155
 באר שבע 289,29.07.2014,21:27:09,2014-07-29T21:27:00,1,ירי רקטות וטילים,1,155
 נגב 297,29.07.2014,21:27:09,2014-07-29T21:27:00,1,ירי רקטות וטילים,1,155
 פזורה 25,29.07.2014,21:27:09,2014-07-29T21:27:00,1,ירי רקטות וטילים,1,155
 פזורה לקיה,29.07.2014,21:27:09,2014-07-29T21:27:00,1,ירי רקטות וטילים,1,155
 פזורה 31,29.07.2014,21:27:09,2014-07-29T21:27:00,1,ירי רקטות וטילים,1,155
 באר שבע 291,29.07.2014,21:27:09,2014-07-29T21:27:00,1,ירי רקטות וטילים,1,155
באר שבע 292,29.07.2014,21:27:24,2014-07-29T21:27:00,1,ירי רקטות וטילים,1,156
 באר שבע 286,29.07.2014,21:27:24,2014-07-29T21:27:00,1,ירי רקטות וטילים,1,156
 באר שבע 289,29.07.2014,21:27:24,2014-07-29T21:27:00,1,ירי רקטות וטילים,1,156
 פזורה 31,29.07.2014,21:27:24,2014-07-29T21:27:00,1,ירי רקטות וטילים,1,156
 פזורה לקיה,29.07.2014,21:27:24,2014-07-29T21:27:00,1,ירי רקטות וטילים,1,156
 פזורה לקיה,29.07.2014,21:27:24,2014-07-29T21:27:00,1,ירי רקטות וטילים,1,156
 באר שבע 291,29.07.2014,21:27:24,2014-07-29T21:27:00,1,ירי רקטות וטילים,1,156
 נגב 296,29.07.2014,21:27:24,2014-07-29T21:27:00,1,ירי רקטות וטילים,1,156
 נגב 297,29.07.2014,21:27:24,2014-07-29T21:27:00,1,ירי רקטות וטילים,1,156
 פזורה 25,29.07.2014,21:27:24,2014-07-29T21:27:00,1,ירי רקטות וטילים,1,156
 באר שבע 289,29.07.2014,21:27:27,2014-07-29T21:27:00,1,ירי רקטות וטילים,1,157
 באר שבע 286,29.07.2014,21:27:27,2014-07-29T21:27:00,1,ירי רקטות וטילים,1,157
 פזורה 25,29.07.2014,21:27:27,2014-07-29T21:27:00,1,ירי רקטות וטילים,1,157
באר שבע 292,29.07.2014,21:27:27,2014-07-29T21:27:00,1,ירי רקטות וטילים,1,157
 פזורה לקיה,29.07.2014,21:27:27,2014-07-29T21:27:00,1,ירי רקטות וטילים,1,157
 נגב 302,29.07.2014,21:27:27,2014-07-29T21:27:00,1,ירי רקטות וטילים,1,157
 פזורה לקיה,29.07.2014,21:27:27,2014-07-29T21:27:00,1,ירי רקטות וטילים,1,157
 נגב 297,29.07.2014,21:27:27,2014-07-29T21:27:00,1,ירי רקטות וטילים,1,157
 פזורה 31,29.07.2014,21:27:27,2014-07-29T21:27:00,1,ירי רקטות וטילים,1,157
 נגב 296,29.07.2014,21:27:27,2014-07-29T21:27:00,1,ירי רקטות וטילים,1,157
 באר שבע 291,29.07.2014,21:27:27,2014-07-29T21:27:00,1,ירי רקטות וטילים,1,157
 נגב 302,29.07.2014,21:27:34,2014-07-29T21:28:00,1,ירי רקטות וטילים,1,158
 באר שבע 286,29.07.2014,21:27:34,2014-07-29T21:28:00,1,ירי רקטות וטילים,1,158
 פזורה 25,29.07.2014,21:27:34,2014-07-29T21:28:00,1,ירי רקטות וטילים,1,158
באר שבע 292,29.07.2014,21:27:34,2014-07-29T21:28:00,1,ירי רקטות וטילים,1,158
 פזורה לקיה,29.07.2014,21:27:34,2014-07-29T21:28:00,1,ירי רקטות וטילים,1,158
 באר שבע 291,29.07.2014,21:27:34,2014-07-29T21:28:00,1,ירי רקטות וטילים,1,158
 נגב 296,29.07.2014,21:27:34,2014-07-29T21:28:00,1,ירי רקטות וטילים,1,158
 נגב 297,29.07.2014,21:27:34,2014-07-29T21:28:00,1,ירי רקטות וטילים,1,158
 פזורה לקיה,29.07.2014,21:27:34,2014-07-29T21:28:00,1,ירי רקטות וטילים,1,158
באר שבע 292,29.07.2014,21:27:40,2014-07-29T21:28:00,1,ירי רקטות וטילים,1,159
 באר שבע 286,29.07.2014,21:27:40,2014-07-29T21:28:00,1,ירי רקטות וטילים,1,159
 פזורה לקיה,29.07.2014,21:27:40,2014-07-29T21:28:00,1,ירי רקטות וטילים,1,159
 פזורה לקיה,29.07.2014,21:27:40,2014-07-29T21:28:00,1,ירי רקטות וטילים,1,159
 נגב 296,29.07.2014,21:27:40,2014-07-29T21:28:00,1,ירי רקטות וטילים,1,159
 פזורה 25,29.07.2014,21:27:40,2014-07-29T21:28:00,1,ירי רקטות וטילים,1,159
 נגב 302,29.07.2014,21:27:40,2014-07-29T21:28:00,1,ירי רקטות וטילים,1,159
 באר שבע 291,29.07.2014,21:27:40,2014-07-29T21:28:00,1,ירי רקטות וטילים,1,159
 נגב 297,29.07.2014,21:27:40,2014-07-29T21:28:00,1,ירי רקטות וטילים,1,159
 פזורה לקיה,29.07.2014,21:27:41,2014-07-29T21:28:00,1,ירי רקטות וטילים,1,160
באר שבע 292,29.07.2014,21:27:41,2014-07-29T21:28:00,1,ירי רקטות וטילים,1,160
 באר שבע 286,29.07.2014,21:27:41,2014-07-29T21:28:00,1,ירי רקטות וטילים,1,160
 פזורה לקיה,29.07.2014,21:27:41,2014-07-29T21:28:00,1,ירי רקטות וטילים,1,160
 נגב 296,29.07.2014,21:27:41,2014-07-29T21:28:00,1,ירי רקטות וטילים,1,160
 נגב 297,29.07.2014,21:27:41,2014-07-29T21:28:00,1,ירי רקטות וטילים,1,160
 פזורה 25,29.07.2014,21:27:41,2014-07-29T21:28:00,1,ירי רקטות וטילים,1,160
 באר שבע 291,29.07.2014,21:27:41,2014-07-29T21:28:00,1,ירי רקטות וטילים,1,160
 נגב 302,29.07.2014,21:27:41,2014-07-29T21:28:00,1,ירי רקטות וטילים,1,160
 באר שבע 292,29.07.2014,21:27:45,2014-07-29T21:28:00,1,ירי רקטות וטילים,1,161
 באר שבע 286,29.07.2014,21:27:45,2014-07-29T21:28:00,1,ירי רקטות וטילים,1,161
 פזורה לקיה,29.07.2014,21:27:45,2014-07-29T21:28:00,1,ירי רקטות וטילים,1,161
 פזורה לקיה,29.07.2014,21:27:45,2014-07-29T21:28:00,1,ירי רקטות וטילים,1,161
באר שבע 292,29.07.2014,21:27:45,2014-07-29T21:28:00,1,ירי רקטות וטילים,1,161
 נגב 296,29.07.2014,21:27:45,2014-07-29T21:28:00,1,ירי רקטות וטילים,1,161
 נגב 297,29.07.2014,21:27:45,2014-07-29T21:28:00,1,ירי רקטות וטילים,1,161
 באר שבע 289,29.07.2014,21:27:45,2014-07-29T21:28:00,1,ירי רקטות וטילים,1,161
 נגב 302,29.07.2014,21:27:45,2014-07-29T21:28:00,1,ירי רקטות וטילים,1,161
 פזורה 25,29.07.2014,21:27:45,2014-07-29T21:28:00,1,ירי רקטות וטילים,1,161
 באר שבע 291,29.07.2014,21:27:45,2014-07-29T21:28:00,1,ירי רקטות וטילים,1,161
באר שבע 292,29.07.2014,21:27:46,2014-07-29T21:28:00,1,ירי רקטות וטילים,1,162
 פזורה לקיה,29.07.2014,21:27:46,2014-07-29T21:28:00,1,ירי רקטות וטילים,1,162
 פזורה לקיה,29.07.2014,21:27:46,2014-07-29T21:28:00,1,ירי רקטות וטילים,1,162
 נגב 296,29.07.2014,21:27:46,2014-07-29T21:28:00,1,ירי רקטות וטילים,1,162
 נגב 297,29.07.2014,21:27:46,2014-07-29T21:28:00,1,ירי רקטות וטילים,1,162
 באר שבע 289,29.07.2014,21:27:46,2014-07-29T21:28:00,1,ירי רקטות וטילים,1,162
 פזורה 25,29.07.2014,21:27:46,2014-07-29T21:28:00,1,ירי רקטות וטילים,1,162
 נגב 302,29.07.2014,21:27:46,2014-07-29T21:28:00,1,ירי רקטות וטילים,1,162
 באר שבע 291,29.07.2014,21:27:46,2014-07-29T21:28:00,1,ירי רקטות וטילים,1,162
באר שבע 292,29.07.2014,21:27:56,2014-07-29T21:28:00,1,ירי רקטות וטילים,1,163
 באר שבע 291,29.07.2014,21:27:56,2014-07-29T21:28:00,1,ירי רקטות וטילים,1,163
 נגב 296,29.07.2014,21:27:56,2014-07-29T21:28:00,1,ירי רקטות וטילים,1,163
 באר שבע 289,29.07.2014,21:27:56,2014-07-29T21:28:00,1,ירי רקטות וטילים,1,163
 פזורה לקיה,29.07.2014,21:27:56,2014-07-29T21:28:00,1,ירי רקטות וטילים,1,163
 פזורה 25,29.07.2014,21:27:56,2014-07-29T21:28:00,1,ירי רקטות וטילים,1,163
 נגב 302,29.07.2014,21:27:56,2014-07-29T21:28:00,1,ירי רקטות וטילים,1,163
 נגב 297,29.07.2014,21:27:56,2014-07-29T21:28:00,1,ירי רקטות וטילים,1,163
 נגב 302,29.07.2014,21:28:06,2014-07-29T21:28:00,1,ירי רקטות וטילים,1,164
 פזורה 25,29.07.2014,21:28:06,2014-07-29T21:28:00,1,ירי רקטות וטילים,1,164
 באר שבע 289,29.07.2014,21:28:06,2014-07-29T21:28:00,1,ירי רקטות וטילים,1,164
 פזורה לקיה,29.07.2014,21:28:06,2014-07-29T21:28:00,1,ירי רקטות וטילים,1,164
 נגב 297,29.07.2014,21:28:06,2014-07-29T21:28:00,1,ירי רקטות וטילים,1,164
 נגב 296,29.07.2014,21:28:06,2014-07-29T21:28:00,1,ירי רקטות וטילים,1,164
באר שבע 292,29.07.2014,21:28:06,2014-07-29T21:28:00,1,ירי רקטות וטילים,1,164
באר שבע 292,29.07.2014,21:28:13,2014-07-29T21:28:00,1,ירי רקטות וטילים,1,165
 נגב 297,29.07.2014,21:28:13,2014-07-29T21:28:00,1,ירי רקטות וטילים,1,165
 באר שבע 289,29.07.2014,21:28:13,2014-07-29T21:28:00,1,ירי רקטות וטילים,1,165
 פזורה 25,29.07.2014,21:28:13,2014-07-29T21:28:00,1,ירי רקטות וטילים,1,165
 נגב 302,29.07.2014,21:28:13,2014-07-29T21:28:00,1,ירי רקטות וטילים,1,165
 פזורה לקיה,29.07.2014,21:28:13,2014-07-29T21:28:00,1,ירי רקטות וטילים,1,165
 נגב 302,29.07.2014,21:28:20,2014-07-29T21:28:00,1,ירי רקטות וטילים,1,166
 פזורה 25,29.07.2014,21:28:20,2014-07-29T21:28:00,1,ירי רקטות וטילים,1,166
 באר שבע 289,29.07.2014,21:28:20,2014-07-29T21:28:00,1,ירי רקטות וטילים,1,166
 פזורה לקיה,29.07.2014,21:28:20,2014-07-29T21:28:00,1,ירי רקטות וטילים,1,166
באר שבע 292,29.07.2014,21:28:20,2014-07-29T21:28:00,1,ירי רקטות וטילים,1,166
באר שבע 292,29.07.2014,21:28:22,2014-07-29T21:28:00,1,ירי רקטות וטילים,1,167
 פזורה 25,29.07.2014,21:28:22,2014-07-29T21:28:00,1,ירי רקטות וטילים,1,167
 נגב 302,29.07.2014,21:28:22,2014-07-29T21:28:00,1,ירי רקטות וטילים,1,167
 באר שבע 289,29.07.2014,21:28:22,2014-07-29T21:28:00,1,ירי רקטות וטילים,1,167
 נגב 302,29.07.2014,21:28:28,2014-07-29T21:28:00,1,ירי רקטות וטילים,1,168
 פזורה 25,29.07.2014,21:28:28,2014-07-29T21:28:00,1,ירי רקטות וטילים,1,168
באר שבע 292,29.07.2014,21:28:28,2014-07-29T21:28:00,1,ירי רקטות וטילים,1,168
 נגב 302,29.07.2014,21:28:38,2014-07-29T21:29:00,1,ירי רקטות וטילים,1,169
באר שבע 292,29.07.2014,21:28:38,2014-07-29T21:29:00,1,ירי רקטות וטילים,1,169
נגב 302,29.07.2014,21:28:43,2014-07-29T21:29:00,1,ירי רקטות וטילים,1,170
אשקלון 247,29.07.2014,21:58:44,2014-07-29T21:59:00,1,ירי רקטות וטילים,1,171
 אשקלון 247,29.07.2014,21:58:55,2014-07-29T21:59:00,1,ירי רקטות וטילים,1,172
אשקלון 246,29.07.2014,21:58:55,2014-07-29T21:59:00,1,ירי רקטות וטילים,1,172
אשקלון 246,29.07.2014,21:59:11,2014-07-29T21:59:00,1,ירי רקטות וטילים,1,173
 דן 161,29.07.2014,22:11:19,2014-07-29T22:11:00,1,ירי רקטות וטילים,1,174
 דן 160,29.07.2014,22:11:19,2014-07-29T22:11:00,1,ירי רקטות וטילים,1,174
דן 162,29.07.2014,22:11:19,2014-07-29T22:11:00,1,ירי רקטות וטילים,1,174
דן 162,29.07.2014,22:12:20,2014-07-29T22:12:00,1,ירי רקטות וטילים,1,175
 דן 161,29.07.2014,22:12:20,2014-07-29T22:12:00,1,ירי רקטות וטילים,1,175
 דן 160,29.07.2014,22:12:20,2014-07-29T22:12:00,1,ירי רקטות וטילים,1,175
 שפלה 175,29.07.2014,22:12:20,2014-07-29T22:12:00,1,ירי רקטות וטילים,1,175
 שפלה 175,29.07.2014,22:12:20,2014-07-29T22:12:00,1,ירי רקטות וטילים,1,176
 דן 161,29.07.2014,22:12:20,2014-07-29T22:12:00,1,ירי רקטות וטילים,1,176
 דן 160,29.07.2014,22:12:20,2014-07-29T22:12:00,1,ירי רקטות וטילים,1,176
דן 162,29.07.2014,22:12:20,2014-07-29T22:12:00,1,ירי רקטות וטילים,1,176
 דן 160,29.07.2014,22:12:34,2014-07-29T22:13:00,1,ירי רקטות וטילים,1,177
דן 162,29.07.2014,22:12:34,2014-07-29T22:13:00,1,ירי רקטות וטילים,1,177
 שפלה 175,29.07.2014,22:12:34,2014-07-29T22:13:00,1,ירי רקטות וטילים,1,177
 אשדוד 271,29.07.2014,22:12:34,2014-07-29T22:13:00,1,ירי רקטות וטילים,1,177
 דן 161,29.07.2014,22:12:34,2014-07-29T22:13:00,1,ירי רקטות וטילים,1,177
 אשקלון 245,29.07.2014,22:12:34,2014-07-29T22:13:00,1,ירי רקטות וטילים,1,177
 אשדוד 272,29.07.2014,22:12:34,2014-07-29T22:13:00,1,ירי רקטות וטילים,1,177
 אשקלון 245,29.07.2014,22:12:43,2014-07-29T22:13:00,1,ירי רקטות וטילים,1,178
 אשדוד 272,29.07.2014,22:12:43,2014-07-29T22:13:00,1,ירי רקטות וטילים,1,178
 אשדוד 273,29.07.2014,22:12:43,2014-07-29T22:13:00,1,ירי רקטות וטילים,1,178
 שפלה 175,29.07.2014,22:12:43,2014-07-29T22:13:00,1,ירי רקטות וטילים,1,178
 אשדוד 271,29.07.2014,22:12:43,2014-07-29T22:13:00,1,ירי רקטות וטילים,1,178
 דן 161,29.07.2014,22:12:43,2014-07-29T22:13:00,1,ירי רקטות וטילים,1,178
 דן 160,29.07.2014,22:12:43,2014-07-29T22:13:00,1,ירי רקטות וטילים,1,178
דן 162,29.07.2014,22:12:43,2014-07-29T22:13:00,1,ירי רקטות וטילים,1,178
אשדוד 271,29.07.2014,22:12:46,2014-07-29T22:13:00,1,ירי רקטות וטילים,1,179
 שפלה 175,29.07.2014,22:12:46,2014-07-29T22:13:00,1,ירי רקטות וטילים,1,179
 אשקלון 245,29.07.2014,22:12:46,2014-07-29T22:13:00,1,ירי רקטות וטילים,1,179
 אשדוד 272,29.07.2014,22:12:46,2014-07-29T22:13:00,1,ירי רקטות וטילים,1,179
 אשדוד 273,29.07.2014,22:12:46,2014-07-29T22:13:00,1,ירי רקטות וטילים,1,179
 אשדוד 273,29.07.2014,22:13:16,2014-07-29T22:13:00,1,ירי רקטות וטילים,1,180
שפלה 175,29.07.2014,22:13:16,2014-07-29T22:13:00,1,ירי רקטות וטילים,1,180
שפלה 175,29.07.2014,22:13:41,2014-07-29T22:14:00,1,ירי רקטות וטילים,1,181
 עוטף עזה 219,29.07.2014,22:52:33,2014-07-29T22:53:00,1,ירי רקטות וטילים,1,182
עוטף עזה 218,29.07.2014,22:52:33,2014-07-29T22:53:00,1,ירי רקטות וטילים,1,182
עוטף עזה 224,30.07.2014,05:26:27,2014-07-30T05:26:00,1,ירי רקטות וטילים,1,183
 עוטף עזה 225,30.07.2014,05:26:38,2014-07-30T05:27:00,1,ירי רקטות וטילים,1,184
עוטף עזה 224,30.07.2014,05:26:38,2014-07-30T05:27:00,1,ירי רקטות וטילים,1,184
עוטף עזה 225,30.07.2014,05:26:46,2014-07-30T05:27:00,1,ירי רקטות וטילים,1,185
עוטף עזה 237,30.07.2014,07:03:41,2014-07-30T07:04:00,1,ירי רקטות וטילים,1,186
עוטף עזה 228,30.07.2014,08:39:41,2014-07-30T08:40:00,1,ירי רקטות וטילים,1,187
עוטף עזה 224,30.07.2014,09:12:58,2014-07-30T09:13:00,1,ירי רקטות וטילים,1,188
עוטף עזה 231,30.07.2014,11:18:31,2014-07-30T11:19:00,1,ירי רקטות וטילים,1,189
 עוטף עזה 230,30.07.2014,11:18:33,2014-07-30T11:19:00,1,ירי רקטות וטילים,1,190
עוטף עזה 231,30.07.2014,11:18:33,2014-07-30T11:19:00,1,ירי רקטות וטילים,1,190
עוטף עזה 230,30.07.2014,11:18:48,2014-07-30T11:19:00,1,ירי רקטות וטילים,1,191
 באר שבע 291,30.07.2014,12:56:54,2014-07-30T12:57:00,1,ירי רקטות וטילים,1,192
 באר שבע 289,30.07.2014,12:56:54,2014-07-30T12:57:00,1,ירי רקטות וטילים,1,192
 אשקלון 255,30.07.2014,12:56:54,2014-07-30T12:57:00,1,ירי רקטות וטילים,1,192
באר שבע 288,30.07.2014,12:56:54,2014-07-30T12:57:00,1,ירי רקטות וטילים,1,192
 באר שבע 291,30.07.2014,12:57:21,2014-07-30T12:57:00,1,ירי רקטות וטילים,1,193
 באר שבע 289,30.07.2014,12:57:21,2014-07-30T12:57:00,1,ירי רקטות וטילים,1,193
באר שבע 288,30.07.2014,12:57:21,2014-07-30T12:57:00,1,ירי רקטות וטילים,1,193
באר שבע 291,30.07.2014,12:57:36,2014-07-30T12:58:00,1,ירי רקטות וטילים,1,194
אשדוד 271,30.07.2014,13:28:22,2014-07-30T13:28:00,1,ירי רקטות וטילים,1,195
אשקלון 254,30.07.2014,14:04:53,2014-07-30T14:05:00,1,ירי רקטות וטילים,1,196
 עוטף עזה 223,30.07.2014,14:04:55,2014-07-30T14:05:00,1,ירי רקטות וטילים,1,197
 עוטף עזה 216,30.07.2014,14:04:55,2014-07-30T14:05:00,1,ירי רקטות וטילים,1,197
אשקלון 254,30.07.2014,14:04:55,2014-07-30T14:05:00,1,ירי רקטות וטילים,1,197
 עוטף עזה 225,30.07.2014,14:04:55,2014-07-30T14:05:00,1,ירי רקטות וטילים,1,197
אשקלון 254,30.07.2014,14:05:12,2014-07-30T14:05:00,1,ירי רקטות וטילים,1,198
עוטף עזה 225,30.07.2014,14:05:22,2014-07-30T14:05:00,1,ירי רקטות וטילים,1,199
 עוטף עזה 238,30.07.2014,14:39:48,2014-07-30T14:40:00,1,ירי רקטות וטילים,1,200
 אשקלון 238,30.07.2014,14:39:48,2014-07-30T14:40:00,1,ירי רקטות וטילים,1,200
עוטף עזה 236,30.07.2014,14:39:48,2014-07-30T14:40:00,1,ירי רקטות וטילים,1,200
אשקלון 238,30.07.2014,14:40:05,2014-07-30T14:40:00,1,ירי רקטות וטילים,1,201
 עוטף עזה 238,30.07.2014,14:40:05,2014-07-30T14:40:00,1,ירי רקטות וטילים,1,201
עוטף עזה 223,30.07.2014,14:56:58,2014-07-30T14:57:00,1,ירי רקטות וטילים,1,202
 אשקלון 245,30.07.2014,15:03:51,2014-07-30T15:04:00,1,ירי רקטות וטילים,1,203
אשדוד 271,30.07.2014,15:03:51,2014-07-30T15:04:00,1,ירי רקטות וטילים,1,203
 אשקלון 245,30.07.2014,15:03:57,2014-07-30T15:04:00,1,ירי רקטות וטילים,1,204
 אשקלון 246,30.07.2014,15:03:57,2014-07-30T15:04:00,1,ירי רקטות וטילים,1,204
אשדוד 271,30.07.2014,15:03:57,2014-07-30T15:04:00,1,ירי רקטות וטילים,1,204
 אשקלון 245,30.07.2014,15:04:24,2014-07-30T15:04:00,1,ירי רקטות וטילים,1,205
אשדוד 271,30.07.2014,15:04:24,2014-07-30T15:04:00,1,ירי רקטות וטילים,1,205
 עוטף עזה 238,30.07.2014,15:16:52,2014-07-30T15:17:00,1,ירי רקטות וטילים,1,206
 אשקלון 238,30.07.2014,15:16:52,2014-07-30T15:17:00,1,ירי רקטות וטילים,1,206
עוטף עזה 236,30.07.2014,15:16:52,2014-07-30T15:17:00,1,ירי רקטות וטילים,1,206
אשקלון 238,30.07.2014,15:17:09,2014-07-30T15:17:00,1,ירי רקטות וטילים,1,207
 עוטף עזה 238,30.07.2014,15:17:09,2014-07-30T15:17:00,1,ירי רקטות וטילים,1,207
אשקלון 238,30.07.2014,15:17:47,2014-07-30T15:18:00,1,ירי רקטות וטילים,1,208
 עוטף עזה 238,30.07.2014,15:17:47,2014-07-30T15:18:00,1,ירי רקטות וטילים,1,208
 אשקלון 238,30.07.2014,15:18:12,2014-07-30T15:18:00,1,ירי רקטות וטילים,1,209
 עוטף עזה 238,30.07.2014,15:18:12,2014-07-30T15:18:00,1,ירי רקטות וטילים,1,209
 עוטף עזה 238,30.07.2014,15:18:12,2014-07-30T15:18:00,1,ירי רקטות וטילים,1,209
אשקלון 238,30.07.2014,15:18:12,2014-07-30T15:18:00,1,ירי רקטות וטילים,1,209
 עוטף עזה 238,30.07.2014,15:18:21,2014-07-30T15:18:00,1,ירי רקטות וטילים,1,210
אשקלון 238,30.07.2014,15:18:21,2014-07-30T15:18:00,1,ירי רקטות וטילים,1,210
אשקלון 238,30.07.2014,15:18:34,2014-07-30T15:19:00,1,ירי רקטות וטילים,1,211
 עוטף עזה 238,30.07.2014,15:18:34,2014-07-30T15:19:00,1,ירי רקטות וטילים,1,211
 אשקלון 238,30.07.2014,15:18:34,2014-07-30T15:19:00,1,ירי רקטות וטילים,1,211
 עוטף עזה 238,30.07.2014,15:18:34,2014-07-30T15:19:00,1,ירי רקטות וטילים,1,211
 עוטף עזה 238,30.07.2014,15:18:45,2014-07-30T15:19:00,1,ירי רקטות וטילים,1,212
אשקלון 238,30.07.2014,15:18:45,2014-07-30T15:19:00,1,ירי רקטות וטילים,1,212
עוטף עזה 227,30.07.2014,16:06:44,2014-07-30T16:07:00,1,ירי רקטות וטילים,1,213
עוטף עזה 227,30.07.2014,16:07:25,2014-07-30T16:07:00,1,ירי רקטות וטילים,1,214
עוטף עזה 224,30.07.2014,16:27:56,2014-07-30T16:28:00,1,ירי רקטות וטילים,1,215
עוטף עזה 224,30.07.2014,16:43:53,2014-07-30T16:44:00,1,ירי רקטות וטילים,1,216
עוטף עזה 224,30.07.2014,16:46:24,2014-07-30T16:46:00,1,ירי רקטות וטילים,1,217
עוטף עזה 224,30.07.2014,16:46:46,2014-07-30T16:47:00,1,ירי רקטות וטילים,1,218
 עוטף עזה 216,30.07.2014,16:51:02,2014-07-30T16:51:00,1,ירי רקטות וטילים,1,219
 עוטף עזה 225,30.07.2014,16:51:02,2014-07-30T16:51:00,1,ירי רקטות וטילים,1,219
אשקלון 254,30.07.2014,16:51:02,2014-07-30T16:51:00,1,ירי רקטות וטילים,1,219
 עוטף עזה 225,30.07.2014,16:51:05,2014-07-30T16:51:00,1,ירי רקטות וטילים,1,220
 עוטף עזה 216,30.07.2014,16:51:05,2014-07-30T16:51:00,1,ירי רקטות וטילים,1,220
אשקלון 254,30.07.2014,16:51:05,2014-07-30T16:51:00,1,ירי רקטות וטילים,1,220
 אשקלון 255,30.07.2014,16:51:05,2014-07-30T16:51:00,1,ירי רקטות וטילים,1,220
 אשקלון 255,30.07.2014,16:51:19,2014-07-30T16:51:00,1,ירי רקטות וטילים,1,221
אשקלון 254,30.07.2014,16:51:19,2014-07-30T16:51:00,1,ירי רקטות וטילים,1,221
אשקלון 255,30.07.2014,16:51:29,2014-07-30T16:51:00,1,ירי רקטות וטילים,1,222
עוטף עזה 216,30.07.2014,16:51:32,2014-07-30T16:52:00,1,ירי רקטות וטילים,1,223
עוטף עזה 216,30.07.2014,16:51:32,2014-07-30T16:52:00,1,ירי רקטות וטילים,1,224
עוטף עזה 224,30.07.2014,16:54:16,2014-07-30T16:54:00,1,ירי רקטות וטילים,1,225
עוטף עזה 224,30.07.2014,16:56:53,2014-07-30T16:57:00,1,ירי רקטות וטילים,1,226
עוטף עזה 224,30.07.2014,17:15:44,2014-07-30T17:16:00,1,ירי רקטות וטילים,1,227
עוטף עזה 237,30.07.2014,17:42:25,2014-07-30T17:42:00,1,ירי רקטות וטילים,1,228
עוטף עזה 218,30.07.2014,18:29:38,2014-07-30T18:30:00,1,ירי רקטות וטילים,1,229
 עוטף עזה 219,30.07.2014,19:44:29,2014-07-30T19:44:00,1,ירי רקטות וטילים,1,230
עוטף עזה 218,30.07.2014,19:44:29,2014-07-30T19:44:00,1,ירי רקטות וטילים,1,230
עוטף עזה 224,30.07.2014,19:49:05,2014-07-30T19:49:00,1,ירי רקטות וטילים,1,231
עוטף עזה 237,30.07.2014,21:07:12,2014-07-30T21:07:00,1,ירי רקטות וטילים,1,232
עוטף עזה 237,30.07.2014,21:07:21,2014-07-30T21:07:00,1,ירי רקטות וטילים,1,233
 עוטף עזה 238,30.07.2014,21:07:21,2014-07-30T21:07:00,1,ירי רקטות וטילים,1,233
 אשקלון 238,30.07.2014,21:07:21,2014-07-30T21:07:00,1,ירי רקטות וטילים,1,233
אשקלון 238,30.07.2014,21:07:31,2014-07-30T21:08:00,1,ירי רקטות וטילים,1,234
 עוטף עזה 238,30.07.2014,21:07:31,2014-07-30T21:08:00,1,ירי רקטות וטילים,1,234
 אשקלון 247,30.07.2014,21:45:08,2014-07-30T21:45:00,1,ירי רקטות וטילים,1,235
 אשקלון 247,30.07.2014,21:45:08,2014-07-30T21:45:00,1,ירי רקטות וטילים,1,235
 עוטף עזה 217,30.07.2014,21:45:08,2014-07-30T21:45:00,1,ירי רקטות וטילים,1,235
עוטף עזה 217,30.07.2014,21:45:08,2014-07-30T21:45:00,1,ירי רקטות וטילים,1,235
אשקלון 246,30.07.2014,21:45:13,2014-07-30T21:45:00,1,ירי רקטות וטילים,1,236
 אשקלון 247,30.07.2014,21:45:13,2014-07-30T21:45:00,1,ירי רקטות וטילים,1,236
 אשקלון 247,30.07.2014,21:45:13,2014-07-30T21:45:00,1,ירי רקטות וטילים,1,236
 עוטף עזה 217,30.07.2014,21:45:13,2014-07-30T21:45:00,1,ירי רקטות וטילים,1,236
 עוטף עזה 217,30.07.2014,21:45:13,2014-07-30T21:45:00,1,ירי רקטות וטילים,1,236
 אשקלון 250,30.07.2014,21:45:25,2014-07-30T21:45:00,1,ירי רקטות וטילים,1,237
 אשקלון 247,30.07.2014,21:45:25,2014-07-30T21:45:00,1,ירי רקטות וטילים,1,237
 אשקלון 247,30.07.2014,21:45:25,2014-07-30T21:45:00,1,ירי רקטות וטילים,1,237
 עוטף עזה 217,30.07.2014,21:45:25,2014-07-30T21:45:00,1,ירי רקטות וטילים,1,237
 עוטף עזה 217,30.07.2014,21:45:25,2014-07-30T21:45:00,1,ירי רקטות וטילים,1,237
אשקלון 246,30.07.2014,21:45:25,2014-07-30T21:45:00,1,ירי רקטות וטילים,1,237
אשקלון 246,30.07.2014,21:45:35,2014-07-30T21:46:00,1,ירי רקטות וטילים,1,238
 אשקלון 247,30.07.2014,21:45:35,2014-07-30T21:46:00,1,ירי רקטות וטילים,1,238
 אשקלון 250,30.07.2014,21:45:35,2014-07-30T21:46:00,1,ירי רקטות וטילים,1,238
 אשקלון 247,30.07.2014,21:45:35,2014-07-30T21:46:00,1,ירי רקטות וטילים,1,238
 אשקלון 250,30.07.2014,21:45:35,2014-07-30T21:46:00,1,ירי רקטות וטילים,1,239
אשקלון 246,30.07.2014,21:45:35,2014-07-30T21:46:00,1,ירי רקטות וטילים,1,239
אשקלון 250,30.07.2014,21:45:40,2014-07-30T21:46:00,1,ירי רקטות וטילים,1,240
באר שבע 291,30.07.2014,22:13:47,2014-07-30T22:14:00,1,ירי רקטות וטילים,1,241
 באר שבע 291,30.07.2014,22:13:50,2014-07-30T22:14:00,1,ירי רקטות וטילים,1,242
באר שבע 288,30.07.2014,22:13:50,2014-07-30T22:14:00,1,ירי רקטות וטילים,1,242
 באר שבע 291,30.07.2014,22:13:54,2014-07-30T22:14:00,1,ירי רקטות וטילים,1,243
 באר שבע 289,30.07.2014,22:13:54,2014-07-30T22:14:00,1,ירי רקטות וטילים,1,243
באר שבע 288,30.07.2014,22:13:54,2014-07-30T22:14:00,1,ירי רקטות וטילים,1,243
 באר שבע 291,30.07.2014,22:14:32,2014-07-30T22:15:00,1,ירי רקטות וטילים,1,244
באר שבע 289,30.07.2014,22:14:32,2014-07-30T22:15:00,1,ירי רקטות וטילים,1,244
באר שבע 291,30.07.2014,22:14:36,2014-07-30T22:15:00,1,ירי רקטות וטילים,1,245
אשקלון 246,30.07.2014,22:19:52,2014-07-30T22:20:00,1,ירי רקטות וטילים,1,246
 אשקלון 247,30.07.2014,22:19:52,2014-07-30T22:20:00,1,ירי רקטות וטילים,1,246
 אשקלון 247,30.07.2014,22:20:04,2014-07-30T22:20:00,1,ירי רקטות וטילים,1,247
 שפלה 183,30.07.2014,22:20:04,2014-07-30T22:20:00,1,ירי רקטות וטילים,1,247
 אשקלון 246,30.07.2014,22:20:04,2014-07-30T22:20:00,1,ירי רקטות וטילים,1,247
 שפלה 182,30.07.2014,22:20:04,2014-07-30T22:20:00,1,ירי רקטות וטילים,1,247
שפלה 175,30.07.2014,22:20:04,2014-07-30T22:20:00,1,ירי רקטות וטילים,1,247
שפלה 175,30.07.2014,22:20:08,2014-07-30T22:20:00,1,ירי רקטות וטילים,1,248
 שפלה 182,30.07.2014,22:20:08,2014-07-30T22:20:00,1,ירי רקטות וטילים,1,248
 שפלה 183,30.07.2014,22:20:08,2014-07-30T22:20:00,1,ירי רקטות וטילים,1,248
 אשקלון 247,30.07.2014,22:20:08,2014-07-30T22:20:00,1,ירי רקטות וטילים,1,248
 אשקלון 245,30.07.2014,22:20:08,2014-07-30T22:20:00,1,ירי רקטות וטילים,1,248
 אשקלון 246,30.07.2014,22:20:08,2014-07-30T22:20:00,1,ירי רקטות וטילים,1,248
שפלה 175,30.07.2014,22:20:19,2014-07-30T22:20:00,1,ירי רקטות וטילים,1,249
 אשקלון 245,30.07.2014,22:20:19,2014-07-30T22:20:00,1,ירי רקטות וטילים,1,249
 שפלה 183,30.07.2014,22:20:19,2014-07-30T22:20:00,1,ירי רקטות וטילים,1,249
 שפלה 182,30.07.2014,22:20:19,2014-07-30T22:20:00,1,ירי רקטות וטילים,1,249
 שפלה 183,30.07.2014,22:20:50,2014-07-30T22:21:00,1,ירי רקטות וטילים,1,250
 שפלה 182,30.07.2014,22:20:50,2014-07-30T22:21:00,1,ירי רקטות וטילים,1,250
שפלה 175,30.07.2014,22:20:50,2014-07-30T22:21:00,1,ירי רקטות וטילים,1,250
עוטף עזה 237,30.07.2014,22:25:10,2014-07-30T22:25:00,1,ירי רקטות וטילים,1,251
עוטף עזה 223,30.07.2014,23:35:40,2014-07-30T23:36:00,1,ירי רקטות וטילים,1,252
עוטף עזה 224,30.07.2014,23:36:14,2014-07-30T23:36:00,1,ירי רקטות וטילים,1,253
אשדוד 275,31.07.2014,06:56:13,2014-07-31T06:56:00,1,ירי רקטות וטילים,1,254
 אשדוד 273,31.07.2014,06:56:13,2014-07-31T06:56:00,1,ירי רקטות וטילים,1,254
 אשקלון 248,31.07.2014,06:56:13,2014-07-31T06:56:00,1,ירי רקטות וטילים,1,254
 אשדוד 272,31.07.2014,06:56:13,2014-07-31T06:56:00,1,ירי רקטות וטילים,1,254
 אשדוד 276,31.07.2014,06:56:13,2014-07-31T06:56:00,1,ירי רקטות וטילים,1,254
 אשקלון 245,31.07.2014,06:56:13,2014-07-31T06:56:00,1,ירי רקטות וטילים,1,254
 אשקלון 245,31.07.2014,06:56:40,2014-07-31T06:57:00,1,ירי רקטות וטילים,1,255
 אשדוד 272,31.07.2014,06:56:40,2014-07-31T06:57:00,1,ירי רקטות וטילים,1,255
 אשדוד 276,31.07.2014,06:56:40,2014-07-31T06:57:00,1,ירי רקטות וטילים,1,255
 אשדוד 273,31.07.2014,06:56:40,2014-07-31T06:57:00,1,ירי רקטות וטילים,1,255
אשדוד 275,31.07.2014,06:56:40,2014-07-31T06:57:00,1,ירי רקטות וטילים,1,255
אשדוד 275,31.07.2014,06:56:40,2014-07-31T06:57:00,1,ירי רקטות וטילים,1,256
 אשדוד 272,31.07.2014,06:56:40,2014-07-31T06:57:00,1,ירי רקטות וטילים,1,256
 אשדוד 276,31.07.2014,06:56:40,2014-07-31T06:57:00,1,ירי רקטות וטילים,1,256
 אשדוד 273,31.07.2014,06:56:40,2014-07-31T06:57:00,1,ירי רקטות וטילים,1,256
 אשקלון 245,31.07.2014,06:56:40,2014-07-31T06:57:00,1,ירי רקטות וטילים,1,256
אשדוד 273,31.07.2014,06:56:55,2014-07-31T06:57:00,1,ירי רקטות וטילים,1,257
באר שבע 292,31.07.2014,08:29:50,2014-07-31T08:30:00,1,ירי רקטות וטילים,1,258
באר שבע 292,31.07.2014,08:29:50,2014-07-31T08:30:00,1,ירי רקטות וטילים,1,259
עוטף עזה 236,31.07.2014,09:25:28,2014-07-31T09:25:00,1,ירי רקטות וטילים,1,260
עוטף עזה 237,31.07.2014,10:31:37,2014-07-31T10:32:00,1,ירי רקטות וטילים,1,261
עוטף עזה 237,31.07.2014,11:01:57,2014-07-31T11:02:00,1,ירי רקטות וטילים,1,262
אשקלון 246,31.07.2014,11:16:25,2014-07-31T11:16:00,1,ירי רקטות וטילים,1,263
עוטף עזה 217,31.07.2014,11:37:18,2014-07-31T11:37:00,1,ירי רקטות וטילים,1,264
עוטף עזה 233,31.07.2014,11:50:43,2014-07-31T11:51:00,1,ירי רקטות וטילים,1,265
 עוטף עזה 221,31.07.2014,11:59:28,2014-07-31T11:59:00,1,ירי רקטות וטילים,1,266
עוטף עזה 220,31.07.2014,11:59:28,2014-07-31T11:59:00,1,ירי רקטות וטילים,1,266
עוטף עזה 220,31.07.2014,11:59:52,2014-07-31T12:00:00,1,ירי רקטות וטילים,1,267
עוטף עזה 220,31.07.2014,11:59:57,2014-07-31T12:00:00,1,ירי רקטות וטילים,1,268
 עוטף עזה 221,31.07.2014,11:59:57,2014-07-31T12:00:00,1,ירי רקטות וטילים,1,268
 עוטף עזה 221,31.07.2014,11:59:57,2014-07-31T12:00:00,1,ירי רקטות וטילים,1,268
 עוטף עזה 221,31.07.2014,12:00:09,2014-07-31T12:00:00,1,ירי רקטות וטילים,1,269
עוטף עזה 221,31.07.2014,12:00:09,2014-07-31T12:00:00,1,ירי רקטות וטילים,1,269
 עוטף עזה 221,31.07.2014,12:00:13,2014-07-31T12:00:00,1,ירי רקטות וטילים,1,270
 עוטף עזה 221,31.07.2014,12:00:13,2014-07-31T12:00:00,1,ירי רקטות וטילים,1,270
עוטף עזה 220,31.07.2014,12:00:13,2014-07-31T12:00:00,1,ירי רקטות וטילים,1,270
 עוטף עזה 221,31.07.2014,12:00:20,2014-07-31T12:00:00,1,ירי רקטות וטילים,1,271
 עוטף עזה 221,31.07.2014,12:00:20,2014-07-31T12:00:00,1,ירי רקטות וטילים,1,271
 עוטף עזה 221,31.07.2014,12:00:20,2014-07-31T12:00:00,1,ירי רקטות וטילים,1,271
עוטף עזה 220,31.07.2014,12:00:20,2014-07-31T12:00:00,1,ירי רקטות וטילים,1,271
עוטף עזה 220,31.07.2014,12:00:20,2014-07-31T12:00:00,1,ירי רקטות וטילים,1,272
 עוטף עזה 221,31.07.2014,12:00:20,2014-07-31T12:00:00,1,ירי רקטות וטילים,1,272
עוטף עזה 221,31.07.2014,12:00:32,2014-07-31T12:01:00,1,ירי רקטות וטילים,1,273
 עוטף עזה 221,31.07.2014,12:00:36,2014-07-31T12:01:00,1,ירי רקטות וטילים,1,274
עוטף עזה 220,31.07.2014,12:00:36,2014-07-31T12:01:00,1,ירי רקטות וטילים,1,274
עוטף עזה 220,31.07.2014,12:00:46,2014-07-31T12:01:00,1,ירי רקטות וטילים,1,275
 עוטף עזה 221,31.07.2014,12:00:50,2014-07-31T12:01:00,1,ירי רקטות וטילים,1,276
עוטף עזה 220,31.07.2014,12:00:50,2014-07-31T12:01:00,1,ירי רקטות וטילים,1,276
 עוטף עזה 221,31.07.2014,12:00:56,2014-07-31T12:01:00,1,ירי רקטות וטילים,1,277
 עוטף עזה 220,31.07.2014,12:00:56,2014-07-31T12:01:00,1,ירי רקטות וטילים,1,277
עוטף עזה 220,31.07.2014,12:00:56,2014-07-31T12:01:00,1,ירי רקטות וטילים,1,277
 עוטף עזה 221,31.07.2014,12:00:56,2014-07-31T12:01:00,1,ירי רקטות וטילים,1,278
עוטף עזה 220,31.07.2014,12:00:56,2014-07-31T12:01:00,1,ירי רקטות וטילים,1,278
עוטף עזה 220,31.07.2014,12:01:08,2014-07-31T12:01:00,1,ירי רקטות וטילים,1,279
עוטף עזה 220,31.07.2014,12:01:32,2014-07-31T12:02:00,1,ירי רקטות וטילים,1,280
עוטף עזה 225,31.07.2014,13:00:42,2014-07-31T13:01:00,1,ירי רקטות וטילים,1,281
עוטף עזה 217,31.07.2014,13:37:07,2014-07-31T13:37:00,1,ירי רקטות וטילים,1,282
עוטף עזה 236,31.07.2014,14:22:12,2014-07-31T14:22:00,1,ירי רקטות וטילים,1,283
עוטף עזה 218,31.07.2014,14:43:21,2014-07-31T14:43:00,1,ירי רקטות וטילים,1,284
 עוטף עזה 231,31.07.2014,14:49:45,2014-07-31T14:50:00,1,ירי רקטות וטילים,1,285
עוטף עזה 230,31.07.2014,14:49:45,2014-07-31T14:50:00,1,ירי רקטות וטילים,1,285
עוטף עזה 217,31.07.2014,15:23:35,2014-07-31T15:24:00,1,ירי רקטות וטילים,1,286
עוטף עזה 217,31.07.2014,15:23:35,2014-07-31T15:24:00,1,ירי רקטות וטילים,1,287
עוטף עזה 217,31.07.2014,15:33:00,2014-07-31T15:33:00,1,ירי רקטות וטילים,1,288
עוטף עזה 217,31.07.2014,15:33:00,2014-07-31T15:33:00,1,ירי רקטות וטילים,1,289
עוטף עזה 217,31.07.2014,15:33:11,2014-07-31T15:33:00,1,ירי רקטות וטילים,1,290
 אשקלון 247,31.07.2014,15:33:11,2014-07-31T15:33:00,1,ירי רקטות וטילים,1,290
 אשקלון 247,31.07.2014,15:33:18,2014-07-31T15:33:00,1,ירי רקטות וטילים,1,291
 עוטף עזה 218,31.07.2014,15:33:18,2014-07-31T15:33:00,1,ירי רקטות וטילים,1,291
עוטף עזה 217,31.07.2014,15:33:18,2014-07-31T15:33:00,1,ירי רקטות וטילים,1,291
עוטף עזה 218,31.07.2014,15:33:18,2014-07-31T15:33:00,1,ירי רקטות וטילים,1,292
 אשקלון 247,31.07.2014,15:33:18,2014-07-31T15:33:00,1,ירי רקטות וטילים,1,292
אשקלון 247,31.07.2014,15:33:35,2014-07-31T15:34:00,1,ירי רקטות וטילים,1,293
עוטף עזה 217,31.07.2014,15:37:34,2014-07-31T15:38:00,1,ירי רקטות וטילים,1,294
עוטף עזה 223,31.07.2014,16:12:49,2014-07-31T16:13:00,1,ירי רקטות וטילים,1,295
עוטף עזה 237,31.07.2014,16:49:31,2014-07-31T16:50:00,1,ירי רקטות וטילים,1,296
עוטף עזה 219,31.07.2014,16:57:40,2014-07-31T16:58:00,1,ירי רקטות וטילים,1,297
עוטף עזה 221,31.07.2014,17:01:50,2014-07-31T17:02:00,1,ירי רקטות וטילים,1,298
עוטף עזה 221,31.07.2014,17:02:15,2014-07-31T17:02:00,1,ירי רקטות וטילים,1,299
 עוטף עזה 231,31.07.2014,17:28:16,2014-07-31T17:28:00,1,ירי רקטות וטילים,1,300
עוטף עזה 230,31.07.2014,17:28:16,2014-07-31T17:28:00,1,ירי רקטות וטילים,1,300
עוטף עזה 230,31.07.2014,17:28:41,2014-07-31T17:29:00,1,ירי רקטות וטילים,1,301
 עוטף עזה 231,31.07.2014,17:28:41,2014-07-31T17:29:00,1,ירי רקטות וטילים,1,301
עוטף עזה 230,31.07.2014,17:28:41,2014-07-31T17:29:00,1,ירי רקטות וטילים,1,302
 עוטף עזה 231,31.07.2014,17:28:41,2014-07-31T17:29:00,1,ירי רקטות וטילים,1,302
 אשקלון 250,31.07.2014,17:30:51,2014-07-31T17:31:00,1,ירי רקטות וטילים,1,303
 אשקלון 247,31.07.2014,17:30:51,2014-07-31T17:31:00,1,ירי רקטות וטילים,1,303
אשקלון 246,31.07.2014,17:30:51,2014-07-31T17:31:00,1,ירי רקטות וטילים,1,303
 אשקלון 250,31.07.2014,17:30:51,2014-07-31T17:31:00,1,ירי רקטות וטילים,1,304
 אשקלון 247,31.07.2014,17:30:51,2014-07-31T17:31:00,1,ירי רקטות וטילים,1,304
אשקלון 246,31.07.2014,17:30:51,2014-07-31T17:31:00,1,ירי רקטות וטילים,1,304
אשקלון 246,31.07.2014,17:30:53,2014-07-31T17:31:00,1,ירי רקטות וטילים,1,305
 אשקלון 247,31.07.2014,17:30:53,2014-07-31T17:31:00,1,ירי רקטות וטילים,1,305
 אשקלון 250,31.07.2014,17:30:53,2014-07-31T17:31:00,1,ירי רקטות וטילים,1,305
 אשקלון 248,31.07.2014,17:30:53,2014-07-31T17:31:00,1,ירי רקטות וטילים,1,305
אשקלון 248,31.07.2014,17:31:17,2014-07-31T17:31:00,1,ירי רקטות וטילים,1,306
אשקלון 246,31.07.2014,17:31:25,2014-07-31T17:31:00,1,ירי רקטות וטילים,1,307
עוטף עזה 217,31.07.2014,17:32:10,2014-07-31T17:32:00,1,ירי רקטות וטילים,1,308
אשדוד 281,31.07.2014,17:54:35,2014-07-31T17:55:00,1,ירי רקטות וטילים,1,309
 אשקלון 249,31.07.2014,17:54:51,2014-07-31T17:55:00,1,ירי רקטות וטילים,1,310
אשדוד 281,31.07.2014,17:54:51,2014-07-31T17:55:00,1,ירי רקטות וטילים,1,310
אשקלון 249,31.07.2014,17:55:17,2014-07-31T17:55:00,1,ירי רקטות וטילים,1,311
אשדוד 281,31.07.2014,17:55:21,2014-07-31T17:55:00,1,ירי רקטות וטילים,1,312
 עוטף עזה 224,31.07.2014,17:55:41,2014-07-31T17:56:00,1,ירי רקטות וטילים,1,313
אשדוד 281,31.07.2014,17:55:41,2014-07-31T17:56:00,1,ירי רקטות וטילים,1,313
אשדוד 281,31.07.2014,17:55:43,2014-07-31T17:56:00,1,ירי רקטות וטילים,1,314
 עוטף עזה 224,31.07.2014,17:55:43,2014-07-31T17:56:00,1,ירי רקטות וטילים,1,314
 אשקלון 251,31.07.2014,17:55:43,2014-07-31T17:56:00,1,ירי רקטות וטילים,1,314
 עוטף עזה 251,31.07.2014,17:55:43,2014-07-31T17:56:00,1,ירי רקטות וטילים,1,314
 עוטף עזה 251,31.07.2014,17:55:58,2014-07-31T17:56:00,1,ירי רקטות וטילים,1,315
 אשקלון 251,31.07.2014,17:55:58,2014-07-31T17:56:00,1,ירי רקטות וטילים,1,315
אשדוד 281,31.07.2014,17:55:58,2014-07-31T17:56:00,1,ירי רקטות וטילים,1,315
 עוטף עזה 251,31.07.2014,17:56:03,2014-07-31T17:56:00,1,ירי רקטות וטילים,1,316
אשקלון 251,31.07.2014,17:56:03,2014-07-31T17:56:00,1,ירי רקטות וטילים,1,316
דן 157,31.07.2014,18:00:30,2014-07-31T18:01:00,1,ירי רקטות וטילים,1,317
דן 157,31.07.2014,18:01:37,2014-07-31T18:02:00,1,ירי רקטות וטילים,1,318
 דן 160,31.07.2014,18:01:37,2014-07-31T18:02:00,1,ירי רקטות וטילים,1,318
דן 160,31.07.2014,18:01:58,2014-07-31T18:02:00,1,ירי רקטות וטילים,1,319
 עוטף עזה 238,31.07.2014,18:11:51,2014-07-31T18:12:00,1,ירי רקטות וטילים,1,320
עוטף עזה 236,31.07.2014,18:11:51,2014-07-31T18:12:00,1,ירי רקטות וטילים,1,320
 אשקלון 238,31.07.2014,18:11:51,2014-07-31T18:12:00,1,ירי רקטות וטילים,1,320
 עוטף עזה 238,31.07.2014,18:12:08,2014-07-31T18:12:00,1,ירי רקטות וטילים,1,321
אשקלון 238,31.07.2014,18:12:08,2014-07-31T18:12:00,1,ירי רקטות וטילים,1,321
 עוטף עזה 217,31.07.2014,18:53:46,2014-07-31T18:54:00,1,ירי רקטות וטילים,1,322
עוטף עזה 218,31.07.2014,18:53:46,2014-07-31T18:54:00,1,ירי רקטות וטילים,1,322
עוטף עזה 218,31.07.2014,18:54:15,2014-07-31T18:54:00,1,ירי רקטות וטילים,1,323
 עוטף עזה 217,31.07.2014,18:54:15,2014-07-31T18:54:00,1,ירי רקטות וטילים,1,323
עוטף עזה 237,31.07.2014,19:02:09,2014-07-31T19:02:00,1,ירי רקטות וטילים,1,324
עוטף עזה 218,31.07.2014,19:21:40,2014-07-31T19:22:00,1,ירי רקטות וטילים,1,325
עוטף עזה 225,31.07.2014,19:25:33,2014-07-31T19:26:00,1,ירי רקטות וטילים,1,326
 עוטף עזה 223,31.07.2014,19:25:33,2014-07-31T19:26:00,1,ירי רקטות וטילים,1,326
עוטף עזה 218,31.07.2014,19:29:00,2014-07-31T19:29:00,1,ירי רקטות וטילים,1,327
 עוטף עזה 238,31.07.2014,19:45:58,2014-07-31T19:46:00,1,ירי רקטות וטילים,1,328
 אשקלון 238,31.07.2014,19:45:58,2014-07-31T19:46:00,1,ירי רקטות וטילים,1,328
עוטף עזה 236,31.07.2014,19:45:58,2014-07-31T19:46:00,1,ירי רקטות וטילים,1,328
 עוטף עזה 238,31.07.2014,19:46:15,2014-07-31T19:46:00,1,ירי רקטות וטילים,1,329
אשקלון 238,31.07.2014,19:46:15,2014-07-31T19:46:00,1,ירי רקטות וטילים,1,329
 עוטף עזה 236,31.07.2014,20:42:50,2014-07-31T20:43:00,1,ירי רקטות וטילים,1,330
עוטף עזה 237,31.07.2014,20:42:50,2014-07-31T20:43:00,1,ירי רקטות וטילים,1,330
עוטף עזה 237,31.07.2014,20:45:51,2014-07-31T20:46:00,1,ירי רקטות וטילים,1,331
עוטף עזה 237,31.07.2014,21:02:06,2014-07-31T21:02:00,1,ירי רקטות וטילים,1,332
עוטף עזה 237,31.07.2014,21:02:06,2014-07-31T21:02:00,1,ירי רקטות וטילים,1,333
עוטף עזה 237,31.07.2014,21:03:18,2014-07-31T21:03:00,1,ירי רקטות וטילים,1,334
עוטף עזה 237,31.07.2014,21:04:37,2014-07-31T21:05:00,1,ירי רקטות וטילים,1,335
אשדוד 271,31.07.2014,21:10:48,2014-07-31T21:11:00,1,ירי רקטות וטילים,1,336
 אשקלון 245,31.07.2014,21:10:48,2014-07-31T21:11:00,1,ירי רקטות וטילים,1,336
 אשדוד 272,31.07.2014,21:11:09,2014-07-31T21:11:00,1,ירי רקטות וטילים,1,337
 אשקלון 245,31.07.2014,21:11:09,2014-07-31T21:11:00,1,ירי רקטות וטילים,1,337
אשדוד 271,31.07.2014,21:11:09,2014-07-31T21:11:00,1,ירי רקטות וטילים,1,337
אשדוד 272,31.07.2014,21:11:30,2014-07-31T21:12:00,1,ירי רקטות וטילים,1,338
 אשקלון 247,31.07.2014,21:28:36,2014-07-31T21:29:00,1,ירי רקטות וטילים,1,339
 עוטף עזה 217,31.07.2014,21:28:36,2014-07-31T21:29:00,1,ירי רקטות וטילים,1,339
עוטף עזה 218,31.07.2014,21:28:36,2014-07-31T21:29:00,1,ירי רקטות וטילים,1,339
אשקלון 246,31.07.2014,21:28:41,2014-07-31T21:29:00,1,ירי רקטות וטילים,1,340
 עוטף עזה 217,31.07.2014,21:28:41,2014-07-31T21:29:00,1,ירי רקטות וטילים,1,340
 אשקלון 247,31.07.2014,21:28:41,2014-07-31T21:29:00,1,ירי רקטות וטילים,1,340
 עוטף עזה 218,31.07.2014,21:28:41,2014-07-31T21:29:00,1,ירי רקטות וטילים,1,340
 אשקלון 247,31.07.2014,21:28:54,2014-07-31T21:29:00,1,ירי רקטות וטילים,1,341
אשקלון 246,31.07.2014,21:28:54,2014-07-31T21:29:00,1,ירי רקטות וטילים,1,341
 אשקלון 250,31.07.2014,21:28:55,2014-07-31T21:29:00,1,ירי רקטות וטילים,1,342
 אשקלון 247,31.07.2014,21:28:55,2014-07-31T21:29:00,1,ירי רקטות וטילים,1,342
אשקלון 246,31.07.2014,21:28:55,2014-07-31T21:29:00,1,ירי רקטות וטילים,1,342
 עוטף עזה 217,31.07.2014,21:29:04,2014-07-31T21:29:00,1,ירי רקטות וטילים,1,343
 אשקלון 250,31.07.2014,21:29:04,2014-07-31T21:29:00,1,ירי רקטות וטילים,1,343
 אשקלון 247,31.07.2014,21:29:04,2014-07-31T21:29:00,1,ירי רקטות וטילים,1,343
אשקלון 246,31.07.2014,21:29:04,2014-07-31T21:29:00,1,ירי רקטות וטילים,1,343
אשקלון 246,31.07.2014,21:29:05,2014-07-31T21:29:00,1,ירי רקטות וטילים,1,344
 עוטף עזה 217,31.07.2014,21:29:05,2014-07-31T21:29:00,1,ירי רקטות וטילים,1,344
 אשקלון 250,31.07.2014,21:29:05,2014-07-31T21:29:00,1,ירי רקטות וטילים,1,344
 עוטף עזה 217,31.07.2014,21:29:17,2014-07-31T21:29:00,1,ירי רקטות וטילים,1,345
אשקלון 250,31.07.2014,21:29:17,2014-07-31T21:29:00,1,ירי רקטות וטילים,1,345
אשקלון 250,31.07.2014,21:29:21,2014-07-31T21:29:00,1,ירי רקטות וטילים,1,346
עוטף עזה 223,31.07.2014,22:17:50,2014-07-31T22:18:00,1,ירי רקטות וטילים,1,347
 עוטף עזה 217,01.08.2014,00:33:32,2014-08-01T00:34:00,1,ירי רקטות וטילים,1,348
עוטף עזה 218,01.08.2014,00:33:32,2014-08-01T00:34:00,1,ירי רקטות וטילים,1,348
 שפלה 179,01.08.2014,01:02:01,2014-08-01T01:02:00,1,ירי רקטות וטילים,1,349
שפלה 178,01.08.2014,01:02:01,2014-08-01T01:02:00,1,ירי רקטות וטילים,1,349
שפלה 182,01.08.2014,01:03:06,2014-08-01T01:03:00,1,ירי רקטות וטילים,1,350
 שפלה 183,01.08.2014,01:03:06,2014-08-01T01:03:00,1,ירי רקטות וטילים,1,350
 שפלה 179,01.08.2014,01:03:06,2014-08-01T01:03:00,1,ירי רקטות וטילים,1,350
 שפלה 178,01.08.2014,01:03:06,2014-08-01T01:03:00,1,ירי רקטות וטילים,1,350
 שפלה 184,01.08.2014,01:03:06,2014-08-01T01:03:00,1,ירי רקטות וטילים,1,350
שפלה 182,01.08.2014,01:03:28,2014-08-01T01:03:00,1,ירי רקטות וטילים,1,351
 שפלה 184,01.08.2014,01:03:28,2014-08-01T01:03:00,1,ירי רקטות וטילים,1,351
 שפלה 183,01.08.2014,01:03:28,2014-08-01T01:03:00,1,ירי רקטות וטילים,1,351
עוטף עזה 237,01.08.2014,03:30:13,2014-08-01T03:30:00,1,ירי רקטות וטילים,1,352
עוטף עזה 237,01.08.2014,03:31:23,2014-08-01T03:31:00,1,ירי רקטות וטילים,1,353
עוטף עזה 230,01.08.2014,05:02:35,2014-08-01T05:03:00,1,ירי רקטות וטילים,1,354
עוטף עזה 224,01.08.2014,06:46:10,2014-08-01T06:46:00,1,ירי רקטות וטילים,1,355
באר שבע 291,01.08.2014,06:51:57,2014-08-01T06:52:00,1,ירי רקטות וטילים,1,356
 באר שבע 291,01.08.2014,06:51:59,2014-08-01T06:52:00,1,ירי רקטות וטילים,1,357
 אשקלון 256,01.08.2014,06:51:59,2014-08-01T06:52:00,1,ירי רקטות וטילים,1,357
באר שבע 288,01.08.2014,06:51:59,2014-08-01T06:52:00,1,ירי רקטות וטילים,1,357
באר שבע 288,01.08.2014,06:52:26,2014-08-01T06:52:00,1,ירי רקטות וטילים,1,358
 באר שבע 291,01.08.2014,06:52:26,2014-08-01T06:52:00,1,ירי רקטות וטילים,1,358
באר שבע 291,01.08.2014,06:52:41,2014-08-01T06:53:00,1,ירי רקטות וטילים,1,359
באר שבע 291,01.08.2014,06:52:41,2014-08-01T06:53:00,1,ירי רקטות וטילים,1,360
 אשדוד 272,01.08.2014,07:30:39,2014-08-01T07:31:00,1,ירי רקטות וטילים,1,361
 אשדוד 273,01.08.2014,07:30:39,2014-08-01T07:31:00,1,ירי רקטות וטילים,1,361
אשדוד 271,01.08.2014,07:30:39,2014-08-01T07:31:00,1,ירי רקטות וטילים,1,361
 אשקלון 245,01.08.2014,07:31:13,2014-08-01T07:31:00,1,ירי רקטות וטילים,1,362
 אשדוד 272,01.08.2014,07:31:13,2014-08-01T07:31:00,1,ירי רקטות וטילים,1,362
 אשדוד 273,01.08.2014,07:31:13,2014-08-01T07:31:00,1,ירי רקטות וטילים,1,362
אשדוד 271,01.08.2014,07:31:13,2014-08-01T07:31:00,1,ירי רקטות וטילים,1,362
אשדוד 273,01.08.2014,07:31:25,2014-08-01T07:31:00,1,ירי רקטות וטילים,1,363
 אשקלון 245,01.08.2014,07:31:25,2014-08-01T07:31:00,1,ירי רקטות וטילים,1,363
 אשקלון 245,01.08.2014,07:31:27,2014-08-01T07:31:00,1,ירי רקטות וטילים,1,364
 אשדוד 273,01.08.2014,07:31:27,2014-08-01T07:31:00,1,ירי רקטות וטילים,1,364
אשדוד 271,01.08.2014,07:31:27,2014-08-01T07:31:00,1,ירי רקטות וטילים,1,364
אשדוד 271,01.08.2014,07:31:38,2014-08-01T07:32:00,1,ירי רקטות וטילים,1,365
 אשקלון 245,01.08.2014,07:31:38,2014-08-01T07:32:00,1,ירי רקטות וטילים,1,365
 אשדוד 272,01.08.2014,07:31:40,2014-08-01T07:32:00,1,ירי רקטות וטילים,1,366
 אשקלון 245,01.08.2014,07:31:40,2014-08-01T07:32:00,1,ירי רקטות וטילים,1,366
 אשדוד 273,01.08.2014,07:31:40,2014-08-01T07:32:00,1,ירי רקטות וטילים,1,366
אשדוד 271,01.08.2014,07:31:40,2014-08-01T07:32:00,1,ירי רקטות וטילים,1,366
אשדוד 271,01.08.2014,07:31:55,2014-08-01T07:32:00,1,ירי רקטות וטילים,1,367
 אשדוד 272,01.08.2014,07:31:55,2014-08-01T07:32:00,1,ירי רקטות וטילים,1,367
 אשדוד 273,01.08.2014,07:31:55,2014-08-01T07:32:00,1,ירי רקטות וטילים,1,367
אשדוד 273,01.08.2014,07:32:09,2014-08-01T07:32:00,1,ירי רקטות וטילים,1,368
 אשדוד 272,01.08.2014,07:32:09,2014-08-01T07:32:00,1,ירי רקטות וטילים,1,368
אשדוד 273,01.08.2014,07:32:23,2014-08-01T07:32:00,1,ירי רקטות וטילים,1,369
עוטף עזה 217,01.08.2014,07:56:13,2014-08-01T07:56:00,1,ירי רקטות וטילים,1,370
עוטף עזה 237,01.08.2014,10:03:46,2014-08-01T10:04:00,1,ירי רקטות וטילים,1,371
עוטף עזה 237,01.08.2014,10:50:08,2014-08-01T10:50:00,1,ירי רקטות וטילים,1,372
באר שבע 291,01.08.2014,12:30:01,2014-08-01T12:30:00,1,ירי רקטות וטילים,1,373
באר שבע 291,01.08.2014,12:30:01,2014-08-01T12:30:00,1,ירי רקטות וטילים,1,374
 באר שבע 291,01.08.2014,12:30:15,2014-08-01T12:30:00,1,ירי רקטות וטילים,1,375
באר שבע 288,01.08.2014,12:30:15,2014-08-01T12:30:00,1,ירי רקטות וטילים,1,375
באר שבע 291,01.08.2014,12:30:58,2014-08-01T12:31:00,1,ירי רקטות וטילים,1,376
עוטף עזה 237,01.08.2014,13:15:51,2014-08-01T13:16:00,1,ירי רקטות וטילים,1,377
 אשקלון 247,01.08.2014,13:45:06,2014-08-01T13:45:00,1,ירי רקטות וטילים,1,378
עוטף עזה 217,01.08.2014,13:45:06,2014-08-01T13:45:00,1,ירי רקטות וטילים,1,378
אשקלון 247,01.08.2014,13:45:23,2014-08-01T13:45:00,1,ירי רקטות וטילים,1,379
עוטף עזה 220,01.08.2014,13:53:31,2014-08-01T13:54:00,1,ירי רקטות וטילים,1,380
 עוטף עזה 251,01.08.2014,13:53:31,2014-08-01T13:54:00,1,ירי רקטות וטילים,1,380
 אשקלון 251,01.08.2014,13:53:31,2014-08-01T13:54:00,1,ירי רקטות וטילים,1,380
 עוטף עזה 251,01.08.2014,13:53:41,2014-08-01T13:54:00,1,ירי רקטות וטילים,1,381
 אשקלון 251,01.08.2014,13:53:41,2014-08-01T13:54:00,1,ירי רקטות וטילים,1,381
עוטף עזה 220,01.08.2014,13:53:41,2014-08-01T13:54:00,1,ירי רקטות וטילים,1,381
 עוטף עזה 221,01.08.2014,13:53:41,2014-08-01T13:54:00,1,ירי רקטות וטילים,1,381
 עוטף עזה 222,01.08.2014,13:53:41,2014-08-01T13:54:00,1,ירי רקטות וטילים,1,381
 עוטף עזה 221,01.08.2014,13:53:51,2014-08-01T13:54:00,1,ירי רקטות וטילים,1,382
 עוטף עזה 222,01.08.2014,13:53:51,2014-08-01T13:54:00,1,ירי רקטות וטילים,1,382
 עוטף עזה 251,01.08.2014,13:53:51,2014-08-01T13:54:00,1,ירי רקטות וטילים,1,382
אשקלון 251,01.08.2014,13:53:51,2014-08-01T13:54:00,1,ירי רקטות וטילים,1,382
עוטף עזה 220,01.08.2014,13:53:57,2014-08-01T13:54:00,1,ירי רקטות וטילים,1,383
 עוטף עזה 251,01.08.2014,13:53:57,2014-08-01T13:54:00,1,ירי רקטות וטילים,1,383
 עוטף עזה 222,01.08.2014,13:53:57,2014-08-01T13:54:00,1,ירי רקטות וטילים,1,383
 אשקלון 251,01.08.2014,13:53:57,2014-08-01T13:54:00,1,ירי רקטות וטילים,1,383
 עוטף עזה 221,01.08.2014,13:53:57,2014-08-01T13:54:00,1,ירי רקטות וטילים,1,383
עוטף עזה 220,01.08.2014,13:54:09,2014-08-01T13:54:00,1,ירי רקטות וטילים,1,384
עוטף עזה 220,01.08.2014,13:57:46,2014-08-01T13:58:00,1,ירי רקטות וטילים,1,385
 עוטף עזה 219,01.08.2014,13:57:50,2014-08-01T13:58:00,1,ירי רקטות וטילים,1,386
עוטף עזה 220,01.08.2014,13:57:50,2014-08-01T13:58:00,1,ירי רקטות וטילים,1,386
עוטף עזה 219,01.08.2014,13:58:03,2014-08-01T13:58:00,1,ירי רקטות וטילים,1,387
אשקלון 248,01.08.2014,13:58:51,2014-08-01T13:59:00,1,ירי רקטות וטילים,1,388
 אשקלון 245,01.08.2014,13:58:51,2014-08-01T13:59:00,1,ירי רקטות וטילים,1,388
אשקלון 245,01.08.2014,13:59:18,2014-08-01T13:59:00,1,ירי רקטות וטילים,1,389
עוטף עזה 237,01.08.2014,16:01:35,2014-08-01T16:02:00,1,ירי רקטות וטילים,1,390
 עוטף עזה 237,01.08.2014,17:42:03,2014-08-01T17:42:00,1,ירי רקטות וטילים,1,391
אשקלון 254,01.08.2014,17:42:03,2014-08-01T17:42:00,1,ירי רקטות וטילים,1,391
אשקלון 254,01.08.2014,17:42:20,2014-08-01T17:42:00,1,ירי רקטות וטילים,1,392
עוטף עזה 231,01.08.2014,18:21:05,2014-08-01T18:21:00,1,ירי רקטות וטילים,1,393
עוטף עזה 218,01.08.2014,19:08:27,2014-08-01T19:08:00,1,ירי רקטות וטילים,1,394
עוטף עזה 231,01.08.2014,19:12:47,2014-08-01T19:13:00,1,ירי רקטות וטילים,1,395
עוטף עזה 231,01.08.2014,19:27:11,2014-08-01T19:27:00,1,ירי רקטות וטילים,1,396
עוטף עזה 232,01.08.2014,19:36:06,2014-08-01T19:36:00,1,ירי רקטות וטילים,1,397
עוטף עזה 231,01.08.2014,20:08:44,2014-08-01T20:09:00,1,ירי רקטות וטילים,1,398
אשדוד 271,01.08.2014,21:38:38,2014-08-01T21:39:00,1,ירי רקטות וטילים,1,399
 אשקלון 245,01.08.2014,21:38:38,2014-08-01T21:39:00,1,ירי רקטות וטילים,1,399
 אשקלון 246,01.08.2014,21:38:40,2014-08-01T21:39:00,1,ירי רקטות וטילים,1,400
אשדוד 271,01.08.2014,21:38:40,2014-08-01T21:39:00,1,ירי רקטות וטילים,1,400
 אשקלון 245,01.08.2014,21:38:40,2014-08-01T21:39:00,1,ירי רקטות וטילים,1,400
 אשקלון 245,01.08.2014,21:39:07,2014-08-01T21:39:00,1,ירי רקטות וטילים,1,401
אשדוד 271,01.08.2014,21:39:07,2014-08-01T21:39:00,1,ירי רקטות וטילים,1,401
 שרון 143,02.08.2014,06:00:53,2014-08-02T06:01:00,1,ירי רקטות וטילים,1,402
דן 155,02.08.2014,06:00:53,2014-08-02T06:01:00,1,ירי רקטות וטילים,1,402
דן 155,02.08.2014,06:00:56,2014-08-02T06:01:00,1,ירי רקטות וטילים,1,403
 שרון 142,02.08.2014,06:00:56,2014-08-02T06:01:00,1,ירי רקטות וטילים,1,403
 עמק חפר 139,02.08.2014,06:00:56,2014-08-02T06:01:00,1,ירי רקטות וטילים,1,403
 שרון 143,02.08.2014,06:00:56,2014-08-02T06:01:00,1,ירי רקטות וטילים,1,403
 שרון 143,02.08.2014,06:02:14,2014-08-02T06:02:00,1,ירי רקטות וטילים,1,404
 עמק חפר 139,02.08.2014,06:02:14,2014-08-02T06:02:00,1,ירי רקטות וטילים,1,404
 שרון 142,02.08.2014,06:02:14,2014-08-02T06:02:00,1,ירי רקטות וטילים,1,404
 שרון 140,02.08.2014,06:02:14,2014-08-02T06:02:00,1,ירי רקטות וטילים,1,404
דן 155,02.08.2014,06:02:14,2014-08-02T06:02:00,1,ירי רקטות וטילים,1,404
 שרון 142,02.08.2014,06:02:20,2014-08-02T06:02:00,1,ירי רקטות וטילים,1,405
 עמק חפר 139,02.08.2014,06:02:20,2014-08-02T06:02:00,1,ירי רקטות וטילים,1,405
שרון 140,02.08.2014,06:02:20,2014-08-02T06:02:00,1,ירי רקטות וטילים,1,405
 שרון 142,02.08.2014,06:02:20,2014-08-02T06:02:00,1,ירי רקטות וטילים,1,406
 עמק חפר 139,02.08.2014,06:02:20,2014-08-02T06:02:00,1,ירי רקטות וטילים,1,406
שרון 140,02.08.2014,06:02:20,2014-08-02T06:02:00,1,ירי רקטות וטילים,1,406
דן 157,02.08.2014,06:02:21,2014-08-02T06:02:00,1,ירי רקטות וטילים,1,407
 שרון 140,02.08.2014,06:02:21,2014-08-02T06:02:00,1,ירי רקטות וטילים,1,407
 שפלה 168,02.08.2014,06:02:21,2014-08-02T06:02:00,1,ירי רקטות וטילים,1,407
 שרון 142,02.08.2014,06:02:21,2014-08-02T06:02:00,1,ירי רקטות וטילים,1,407
 דן 160,02.08.2014,06:02:21,2014-08-02T06:02:00,1,ירי רקטות וטילים,1,407
 עמק חפר 139,02.08.2014,06:02:21,2014-08-02T06:02:00,1,ירי רקטות וטילים,1,407
 שפלה 168,02.08.2014,06:02:33,2014-08-02T06:03:00,1,ירי רקטות וטילים,1,408
 דן 160,02.08.2014,06:02:33,2014-08-02T06:03:00,1,ירי רקטות וטילים,1,408
 שרון 140,02.08.2014,06:02:33,2014-08-02T06:03:00,1,ירי רקטות וטילים,1,408
דן 157,02.08.2014,06:02:33,2014-08-02T06:03:00,1,ירי רקטות וטילים,1,408
דן 157,02.08.2014,06:03:41,2014-08-02T06:04:00,1,ירי רקטות וטילים,1,409
 שפלה 168,02.08.2014,06:03:41,2014-08-02T06:04:00,1,ירי רקטות וטילים,1,409
 דן 160,02.08.2014,06:03:41,2014-08-02T06:04:00,1,ירי רקטות וטילים,1,409
באר שבע 292,02.08.2014,06:13:25,2014-08-02T06:13:00,1,ירי רקטות וטילים,1,410
 באר שבע 291,02.08.2014,06:13:54,2014-08-02T06:14:00,1,ירי רקטות וטילים,1,411
 באר שבע 289,02.08.2014,06:13:54,2014-08-02T06:14:00,1,ירי רקטות וטילים,1,411
באר שבע 292,02.08.2014,06:13:54,2014-08-02T06:14:00,1,ירי רקטות וטילים,1,411
 באר שבע 291,02.08.2014,06:14:22,2014-08-02T06:14:00,1,ירי רקטות וטילים,1,412
באר שבע 289,02.08.2014,06:14:22,2014-08-02T06:14:00,1,ירי רקטות וטילים,1,412
באר שבע 291,02.08.2014,06:14:37,2014-08-02T06:15:00,1,ירי רקטות וטילים,1,413
עוטף עזה 224,02.08.2014,12:18:28,2014-08-02T12:18:00,1,ירי רקטות וטילים,1,414
עוטף עזה 230,02.08.2014,12:33:48,2014-08-02T12:34:00,1,ירי רקטות וטילים,1,415
 עוטף עזה 231,02.08.2014,12:34:08,2014-08-02T12:34:00,1,ירי רקטות וטילים,1,416
עוטף עזה 230,02.08.2014,12:34:08,2014-08-02T12:34:00,1,ירי רקטות וטילים,1,416
עוטף עזה 230,02.08.2014,12:35:29,2014-08-02T12:35:00,1,ירי רקטות וטילים,1,417
עוטף עזה 227,02.08.2014,12:41:14,2014-08-02T12:41:00,1,ירי רקטות וטילים,1,418
עוטף עזה 224,02.08.2014,13:06:12,2014-08-02T13:06:00,1,ירי רקטות וטילים,1,419
עוטף עזה 230,02.08.2014,14:31:23,2014-08-02T14:31:00,1,ירי רקטות וטילים,1,420
עוטף עזה 230,02.08.2014,14:31:46,2014-08-02T14:32:00,1,ירי רקטות וטילים,1,421
 עוטף עזה 231,02.08.2014,14:32:02,2014-08-02T14:32:00,1,ירי רקטות וטילים,1,422
עוטף עזה 230,02.08.2014,14:32:02,2014-08-02T14:32:00,1,ירי רקטות וטילים,1,422
 עוטף עזה 231,02.08.2014,14:32:02,2014-08-02T14:32:00,1,ירי רקטות וטילים,1,423
עוטף עזה 230,02.08.2014,14:32:02,2014-08-02T14:32:00,1,ירי רקטות וטילים,1,423
עוטף עזה 231,02.08.2014,14:32:03,2014-08-02T14:32:00,1,ירי רקטות וטילים,1,424
עוטף עזה 237,02.08.2014,14:41:31,2014-08-02T14:42:00,1,ירי רקטות וטילים,1,425
עוטף עזה 224,02.08.2014,14:58:40,2014-08-02T14:59:00,1,ירי רקטות וטילים,1,426
עוטף עזה 236,02.08.2014,15:00:54,2014-08-02T15:01:00,1,ירי רקטות וטילים,1,427
 עוטף עזה 238,02.08.2014,15:00:54,2014-08-02T15:01:00,1,ירי רקטות וטילים,1,427
 אשקלון 238,02.08.2014,15:00:54,2014-08-02T15:01:00,1,ירי רקטות וטילים,1,427
 עוטף עזה 238,02.08.2014,15:00:54,2014-08-02T15:01:00,1,ירי רקטות וטילים,1,428
עוטף עזה 236,02.08.2014,15:00:54,2014-08-02T15:01:00,1,ירי רקטות וטילים,1,428
 אשקלון 238,02.08.2014,15:00:54,2014-08-02T15:01:00,1,ירי רקטות וטילים,1,428
 עוטף עזה 238,02.08.2014,15:01:11,2014-08-02T15:01:00,1,ירי רקטות וטילים,1,429
אשקלון 238,02.08.2014,15:01:11,2014-08-02T15:01:00,1,ירי רקטות וטילים,1,429
עוטף עזה 230,02.08.2014,15:42:07,2014-08-02T15:42:00,1,ירי רקטות וטילים,1,430
עוטף עזה 224,02.08.2014,16:12:55,2014-08-02T16:13:00,1,ירי רקטות וטילים,1,431
עוטף עזה 224,02.08.2014,16:28:19,2014-08-02T16:28:00,1,ירי רקטות וטילים,1,432
עוטף עזה 224,02.08.2014,16:28:23,2014-08-02T16:28:00,1,ירי רקטות וטילים,1,433
 עוטף עזה 223,02.08.2014,16:28:23,2014-08-02T16:28:00,1,ירי רקטות וטילים,1,433
עוטף עזה 223,02.08.2014,16:28:36,2014-08-02T16:29:00,1,ירי רקטות וטילים,1,434
באר שבע 289,02.08.2014,17:05:55,2014-08-02T17:06:00,1,ירי רקטות וטילים,1,435
 אשקלון 255,02.08.2014,17:06:15,2014-08-02T17:06:00,1,ירי רקטות וטילים,1,436
 באר שבע 289,02.08.2014,17:06:15,2014-08-02T17:06:00,1,ירי רקטות וטילים,1,436
באר שבע 288,02.08.2014,17:06:15,2014-08-02T17:06:00,1,ירי רקטות וטילים,1,436
 אשקלון 255,02.08.2014,17:06:15,2014-08-02T17:06:00,1,ירי רקטות וטילים,1,437
 באר שבע 289,02.08.2014,17:06:15,2014-08-02T17:06:00,1,ירי רקטות וטילים,1,437
באר שבע 288,02.08.2014,17:06:15,2014-08-02T17:06:00,1,ירי רקטות וטילים,1,437
 אשקלון 255,02.08.2014,17:06:37,2014-08-02T17:07:00,1,ירי רקטות וטילים,1,438
באר שבע 288,02.08.2014,17:06:37,2014-08-02T17:07:00,1,ירי רקטות וטילים,1,438
באר שבע 288,02.08.2014,17:06:42,2014-08-02T17:07:00,1,ירי רקטות וטילים,1,439
עוטף עזה 224,02.08.2014,17:09:10,2014-08-02T17:09:00,1,ירי רקטות וטילים,1,440
עוטף עזה 224,02.08.2014,17:17:00,2014-08-02T17:17:00,1,ירי רקטות וטילים,1,441
 עוטף עזה 221,02.08.2014,17:35:52,2014-08-02T17:36:00,1,ירי רקטות וטילים,1,442
עוטף עזה 220,02.08.2014,17:35:52,2014-08-02T17:36:00,1,ירי רקטות וטילים,1,442
 עוטף עזה 221,02.08.2014,17:35:52,2014-08-02T17:36:00,1,ירי רקטות וטילים,1,443
עוטף עזה 220,02.08.2014,17:35:52,2014-08-02T17:36:00,1,ירי רקטות וטילים,1,443
עוטף עזה 224,02.08.2014,17:39:12,2014-08-02T17:39:00,1,ירי רקטות וטילים,1,444
 עוטף עזה 223,02.08.2014,17:39:28,2014-08-02T17:39:00,1,ירי רקטות וטילים,1,445
עוטף עזה 224,02.08.2014,17:39:28,2014-08-02T17:39:00,1,ירי רקטות וטילים,1,445
עוטף עזה 223,02.08.2014,17:39:29,2014-08-02T17:39:00,1,ירי רקטות וטילים,1,446
עוטף עזה 221,02.08.2014,17:57:21,2014-08-02T17:57:00,1,ירי רקטות וטילים,1,447
 אשקלון 247,02.08.2014,18:00:38,2014-08-02T18:01:00,1,ירי רקטות וטילים,1,448
עוטף עזה 217,02.08.2014,18:00:38,2014-08-02T18:01:00,1,ירי רקטות וטילים,1,448
אשקלון 247,02.08.2014,18:00:55,2014-08-02T18:01:00,1,ירי רקטות וטילים,1,449
עוטף עזה 224,02.08.2014,18:04:41,2014-08-02T18:05:00,1,ירי רקטות וטילים,1,450
 אשקלון 247,02.08.2014,18:12:49,2014-08-02T18:13:00,1,ירי רקטות וטילים,1,451
עוטף עזה 217,02.08.2014,18:12:49,2014-08-02T18:13:00,1,ירי רקטות וטילים,1,451
 אשקלון 247,02.08.2014,18:12:53,2014-08-02T18:13:00,1,ירי רקטות וטילים,1,452
 עוטף עזה 218,02.08.2014,18:12:53,2014-08-02T18:13:00,1,ירי רקטות וטילים,1,452
עוטף עזה 217,02.08.2014,18:12:53,2014-08-02T18:13:00,1,ירי רקטות וטילים,1,452
 אשקלון 247,02.08.2014,18:13:06,2014-08-02T18:13:00,1,ירי רקטות וטילים,1,453
עוטף עזה 218,02.08.2014,18:13:06,2014-08-02T18:13:00,1,ירי רקטות וטילים,1,453
אשקלון 247,02.08.2014,18:13:10,2014-08-02T18:13:00,1,ירי רקטות וטילים,1,454
עוטף עזה 224,02.08.2014,18:27:30,2014-08-02T18:28:00,1,ירי רקטות וטילים,1,455
עוטף עזה 237,02.08.2014,18:30:26,2014-08-02T18:30:00,1,ירי רקטות וטילים,1,456
עוטף עזה 218,02.08.2014,18:34:15,2014-08-02T18:34:00,1,ירי רקטות וטילים,1,457
 עוטף עזה 217,02.08.2014,18:39:52,2014-08-02T18:40:00,1,ירי רקטות וטילים,1,458
עוטף עזה 218,02.08.2014,18:39:52,2014-08-02T18:40:00,1,ירי רקטות וטילים,1,458
עוטף עזה 217,02.08.2014,18:40:12,2014-08-02T18:40:00,1,ירי רקטות וטילים,1,459
 עוטף עזה 218,02.08.2014,18:40:21,2014-08-02T18:40:00,1,ירי רקטות וטילים,1,460
עוטף עזה 217,02.08.2014,18:40:21,2014-08-02T18:40:00,1,ירי רקטות וטילים,1,460
עוטף עזה 218,02.08.2014,18:40:34,2014-08-02T18:41:00,1,ירי רקטות וטילים,1,461
עוטף עזה 218,02.08.2014,18:40:37,2014-08-02T18:41:00,1,ירי רקטות וטילים,1,462
 עוטף עזה 217,02.08.2014,18:40:37,2014-08-02T18:41:00,1,ירי רקטות וטילים,1,462
עוטף עזה 217,02.08.2014,18:40:49,2014-08-02T18:41:00,1,ירי רקטות וטילים,1,463
עוטף עזה 217,02.08.2014,18:41:00,2014-08-02T18:41:00,1,ירי רקטות וטילים,1,464
 עוטף עזה 231,02.08.2014,18:41:13,2014-08-02T18:41:00,1,ירי רקטות וטילים,1,465
עוטף עזה 217,02.08.2014,18:41:13,2014-08-02T18:41:00,1,ירי רקטות וטילים,1,465
עוטף עזה 231,02.08.2014,18:41:24,2014-08-02T18:41:00,1,ירי רקטות וטילים,1,466
עוטף עזה 231,02.08.2014,18:41:48,2014-08-02T18:42:00,1,ירי רקטות וטילים,1,467
עוטף עזה 237,02.08.2014,18:45:47,2014-08-02T18:46:00,1,ירי רקטות וטילים,1,468
 עוטף עזה 238,02.08.2014,21:14:15,2014-08-02T21:14:00,1,ירי רקטות וטילים,1,469
 אשקלון 238,02.08.2014,21:14:15,2014-08-02T21:14:00,1,ירי רקטות וטילים,1,469
 עוטף עזה 236,02.08.2014,21:14:15,2014-08-02T21:14:00,1,ירי רקטות וטילים,1,469
עוטף עזה 237,02.08.2014,21:14:15,2014-08-02T21:14:00,1,ירי רקטות וטילים,1,469
 עוטף עזה 238,02.08.2014,21:14:33,2014-08-02T21:15:00,1,ירי רקטות וטילים,1,470
אשקלון 238,02.08.2014,21:14:33,2014-08-02T21:15:00,1,ירי רקטות וטילים,1,470
עוטף עזה 224,02.08.2014,21:31:13,2014-08-02T21:31:00,1,ירי רקטות וטילים,1,471
עוטף עזה 237,02.08.2014,21:57:59,2014-08-02T21:58:00,1,ירי רקטות וטילים,1,472
עוטף עזה 224,03.08.2014,04:13:16,2014-08-03T04:13:00,1,ירי רקטות וטילים,1,473
עוטף עזה 224,03.08.2014,04:35:49,2014-08-03T04:36:00,1,ירי רקטות וטילים,1,474
עוטף עזה 221,03.08.2014,07:23:48,2014-08-03T07:24:00,1,ירי רקטות וטילים,1,475
 עוטף עזה 221,03.08.2014,07:24:11,2014-08-03T07:24:00,1,ירי רקטות וטילים,1,476
עוטף עזה 216,03.08.2014,07:24:11,2014-08-03T07:24:00,1,ירי רקטות וטילים,1,476
עוטף עזה 220,03.08.2014,07:54:52,2014-08-03T07:55:00,1,ירי רקטות וטילים,1,477
 עוטף עזה 217,03.08.2014,08:50:51,2014-08-03T08:51:00,1,ירי רקטות וטילים,1,478
עוטף עזה 218,03.08.2014,08:50:51,2014-08-03T08:51:00,1,ירי רקטות וטילים,1,478
עוטף עזה 218,03.08.2014,09:18:19,2014-08-03T09:18:00,1,ירי רקטות וטילים,1,479
עוטף עזה 218,03.08.2014,09:18:21,2014-08-03T09:18:00,1,ירי רקטות וטילים,1,480
 עוטף עזה 217,03.08.2014,09:18:21,2014-08-03T09:18:00,1,ירי רקטות וטילים,1,480
עוטף עזה 217,03.08.2014,09:18:36,2014-08-03T09:19:00,1,ירי רקטות וטילים,1,481
 עוטף עזה 231,03.08.2014,10:01:33,2014-08-03T10:02:00,1,ירי רקטות וטילים,1,482
עוטף עזה 230,03.08.2014,10:01:33,2014-08-03T10:02:00,1,ירי רקטות וטילים,1,482
עוטף עזה 224,03.08.2014,10:34:10,2014-08-03T10:34:00,1,ירי רקטות וטילים,1,483
עוטף עזה 221,03.08.2014,10:48:15,2014-08-03T10:48:00,1,ירי רקטות וטילים,1,484
 עוטף עזה 217,03.08.2014,11:07:40,2014-08-03T11:08:00,1,ירי רקטות וטילים,1,485
עוטף עזה 218,03.08.2014,11:07:40,2014-08-03T11:08:00,1,ירי רקטות וטילים,1,485
עוטף עזה 224,03.08.2014,12:33:01,2014-08-03T12:33:00,1,ירי רקטות וטילים,1,486
עוטף עזה 224,03.08.2014,12:37:54,2014-08-03T12:38:00,1,ירי רקטות וטילים,1,487
עוטף עזה 231,03.08.2014,12:54:26,2014-08-03T12:54:00,1,ירי רקטות וטילים,1,488
עוטף עזה 231,03.08.2014,12:54:26,2014-08-03T12:54:00,1,ירי רקטות וטילים,1,489
עוטף עזה 231,03.08.2014,12:54:49,2014-08-03T12:55:00,1,ירי רקטות וטילים,1,490
עוטף עזה 224,03.08.2014,13:25:09,2014-08-03T13:25:00,1,ירי רקטות וטילים,1,491
עוטף עזה 224,03.08.2014,13:25:09,2014-08-03T13:25:00,1,ירי רקטות וטילים,1,492
עוטף עזה 237,03.08.2014,14:11:41,2014-08-03T14:12:00,1,ירי רקטות וטילים,1,493
 עוטף עזה 224,03.08.2014,14:32:49,2014-08-03T14:33:00,1,ירי רקטות וטילים,1,494
 עוטף עזה 223,03.08.2014,14:32:49,2014-08-03T14:33:00,1,ירי רקטות וטילים,1,494
 עוטף עזה 223,03.08.2014,14:32:49,2014-08-03T14:33:00,1,ירי רקטות וטילים,1,494
עוטף עזה 224,03.08.2014,14:32:49,2014-08-03T14:33:00,1,ירי רקטות וטילים,1,494
 עוטף עזה 223,03.08.2014,14:33:22,2014-08-03T14:33:00,1,ירי רקטות וטילים,1,495
עוטף עזה 224,03.08.2014,14:33:22,2014-08-03T14:33:00,1,ירי רקטות וטילים,1,495
עוטף עזה 237,03.08.2014,14:56:54,2014-08-03T14:57:00,1,ירי רקטות וטילים,1,496
עוטף עזה 220,03.08.2014,15:08:24,2014-08-03T15:08:00,1,ירי רקטות וטילים,1,497
עוטף עזה 231,03.08.2014,15:22:14,2014-08-03T15:22:00,1,ירי רקטות וטילים,1,498
עוטף עזה 231,03.08.2014,15:27:14,2014-08-03T15:27:00,1,ירי רקטות וטילים,1,499
 אשקלון 247,03.08.2014,15:29:35,2014-08-03T15:30:00,1,ירי רקטות וטילים,1,500
עוטף עזה 217,03.08.2014,15:29:35,2014-08-03T15:30:00,1,ירי רקטות וטילים,1,500
אשקלון 247,03.08.2014,15:29:52,2014-08-03T15:30:00,1,ירי רקטות וטילים,1,501
עוטף עזה 217,03.08.2014,15:30:05,2014-08-03T15:30:00,1,ירי רקטות וטילים,1,502
 אשקלון 247,03.08.2014,15:30:12,2014-08-03T15:30:00,1,ירי רקטות וטילים,1,503
עוטף עזה 217,03.08.2014,15:30:12,2014-08-03T15:30:00,1,ירי רקטות וטילים,1,503
אשקלון 247,03.08.2014,15:30:22,2014-08-03T15:30:00,1,ירי רקטות וטילים,1,504
עוטף עזה 218,03.08.2014,15:37:45,2014-08-03T15:38:00,1,ירי רקטות וטילים,1,505
באר שבע 292,03.08.2014,16:19:45,2014-08-03T16:20:00,1,ירי רקטות וטילים,1,506
 פזורה לקיה,03.08.2014,16:19:53,2014-08-03T16:20:00,1,ירי רקטות וטילים,1,507
 פזורה לקיה,03.08.2014,16:19:53,2014-08-03T16:20:00,1,ירי רקטות וטילים,1,507
באר שבע 292,03.08.2014,16:19:53,2014-08-03T16:20:00,1,ירי רקטות וטילים,1,507
באר שבע 292,03.08.2014,16:20:29,2014-08-03T16:20:00,1,ירי רקטות וטילים,1,508
 פזורה לקיה,03.08.2014,16:20:29,2014-08-03T16:20:00,1,ירי רקטות וטילים,1,508
 באר שבע 289,03.08.2014,16:20:29,2014-08-03T16:20:00,1,ירי רקטות וטילים,1,508
 פזורה לקיה,03.08.2014,16:20:29,2014-08-03T16:20:00,1,ירי רקטות וטילים,1,508
 באר שבע 289,03.08.2014,16:20:42,2014-08-03T16:21:00,1,ירי רקטות וטילים,1,509
פזורה לקיה,03.08.2014,16:20:42,2014-08-03T16:21:00,1,ירי רקטות וטילים,1,509
 פזורה לקיה,03.08.2014,16:20:42,2014-08-03T16:21:00,1,ירי רקטות וטילים,1,509
באר שבע 289,03.08.2014,16:20:51,2014-08-03T16:21:00,1,ירי רקטות וטילים,1,510
עוטף עזה 224,03.08.2014,16:27:23,2014-08-03T16:27:00,1,ירי רקטות וטילים,1,511
עוטף עזה 223,03.08.2014,16:29:42,2014-08-03T16:30:00,1,ירי רקטות וטילים,1,512
עוטף עזה 223,03.08.2014,16:30:05,2014-08-03T16:30:00,1,ירי רקטות וטילים,1,513
עוטף עזה 224,03.08.2014,16:30:43,2014-08-03T16:31:00,1,ירי רקטות וטילים,1,514
עוטף עזה 224,03.08.2014,16:34:52,2014-08-03T16:35:00,1,ירי רקטות וטילים,1,515
עוטף עזה 223,03.08.2014,16:35:32,2014-08-03T16:36:00,1,ירי רקטות וטילים,1,516
עוטף עזה 224,03.08.2014,16:39:06,2014-08-03T16:39:00,1,ירי רקטות וטילים,1,517
עוטף עזה 217,03.08.2014,16:59:55,2014-08-03T17:00:00,1,ירי רקטות וטילים,1,518
 דן 160,03.08.2014,17:00:11,2014-08-03T17:00:00,1,ירי רקטות וטילים,1,519
 שפלה 175,03.08.2014,17:00:11,2014-08-03T17:00:00,1,ירי רקטות וטילים,1,519
 דן 162,03.08.2014,17:00:11,2014-08-03T17:00:00,1,ירי רקטות וטילים,1,519
דן 157,03.08.2014,17:00:11,2014-08-03T17:00:00,1,ירי רקטות וטילים,1,519
 עוטף עזה 217,03.08.2014,17:00:11,2014-08-03T17:00:00,1,ירי רקטות וטילים,1,519
 דן 160,03.08.2014,17:00:20,2014-08-03T17:00:00,1,ירי רקטות וטילים,1,520
 שפלה 175,03.08.2014,17:00:20,2014-08-03T17:00:00,1,ירי רקטות וטילים,1,520
 דן 162,03.08.2014,17:00:20,2014-08-03T17:00:00,1,ירי רקטות וטילים,1,520
דן 157,03.08.2014,17:00:20,2014-08-03T17:00:00,1,ירי רקטות וטילים,1,520
דן 157,03.08.2014,17:00:27,2014-08-03T17:00:00,1,ירי רקטות וטילים,1,521
 דן 162,03.08.2014,17:00:27,2014-08-03T17:00:00,1,ירי רקטות וטילים,1,521
 שפלה 175,03.08.2014,17:00:27,2014-08-03T17:00:00,1,ירי רקטות וטילים,1,521
 אשדוד 276,03.08.2014,17:00:27,2014-08-03T17:00:00,1,ירי רקטות וטילים,1,521
 אשדוד 275,03.08.2014,17:00:27,2014-08-03T17:00:00,1,ירי רקטות וטילים,1,521
 אשדוד 268,03.08.2014,17:00:27,2014-08-03T17:00:00,1,ירי רקטות וטילים,1,521
 אשדוד 280,03.08.2014,17:00:27,2014-08-03T17:00:00,1,ירי רקטות וטילים,1,521
 דן 160,03.08.2014,17:00:27,2014-08-03T17:00:00,1,ירי רקטות וטילים,1,521
 דן 162,03.08.2014,17:01:01,2014-08-03T17:01:00,1,ירי רקטות וטילים,1,522
 דן 160,03.08.2014,17:01:01,2014-08-03T17:01:00,1,ירי רקטות וטילים,1,522
דן 157,03.08.2014,17:01:01,2014-08-03T17:01:00,1,ירי רקטות וטילים,1,522
 אשדוד 268,03.08.2014,17:01:01,2014-08-03T17:01:00,1,ירי רקטות וטילים,1,522
 אשדוד 275,03.08.2014,17:01:01,2014-08-03T17:01:00,1,ירי רקטות וטילים,1,522
 אשדוד 280,03.08.2014,17:01:01,2014-08-03T17:01:00,1,ירי רקטות וטילים,1,522
 שפלה 175,03.08.2014,17:01:01,2014-08-03T17:01:00,1,ירי רקטות וטילים,1,522
 אשדוד 276,03.08.2014,17:01:01,2014-08-03T17:01:00,1,ירי רקטות וטילים,1,522
 אשדוד 273,03.08.2014,17:01:01,2014-08-03T17:01:00,1,ירי רקטות וטילים,1,522
דן 157,03.08.2014,17:01:10,2014-08-03T17:01:00,1,ירי רקטות וטילים,1,523
 דן 162,03.08.2014,17:01:10,2014-08-03T17:01:00,1,ירי רקטות וטילים,1,523
 אשדוד 273,03.08.2014,17:01:10,2014-08-03T17:01:00,1,ירי רקטות וטילים,1,523
 דן 160,03.08.2014,17:01:10,2014-08-03T17:01:00,1,ירי רקטות וטילים,1,523
 אשדוד 268,03.08.2014,17:01:10,2014-08-03T17:01:00,1,ירי רקטות וטילים,1,523
 שפלה 175,03.08.2014,17:01:10,2014-08-03T17:01:00,1,ירי רקטות וטילים,1,523
 אשדוד 273,03.08.2014,17:01:25,2014-08-03T17:01:00,1,ירי רקטות וטילים,1,524
 דן 160,03.08.2014,17:01:25,2014-08-03T17:01:00,1,ירי רקטות וטילים,1,524
 שפלה 175,03.08.2014,17:01:25,2014-08-03T17:01:00,1,ירי רקטות וטילים,1,524
 דן 162,03.08.2014,17:01:25,2014-08-03T17:01:00,1,ירי רקטות וטילים,1,524
דן 157,03.08.2014,17:01:25,2014-08-03T17:01:00,1,ירי רקטות וטילים,1,524
דן 157,03.08.2014,17:01:25,2014-08-03T17:01:00,1,ירי רקטות וטילים,1,525
 דן 162,03.08.2014,17:01:25,2014-08-03T17:01:00,1,ירי רקטות וטילים,1,525
 דן 160,03.08.2014,17:01:25,2014-08-03T17:01:00,1,ירי רקטות וטילים,1,525
 שפלה 175,03.08.2014,17:01:25,2014-08-03T17:01:00,1,ירי רקטות וטילים,1,525
 אשדוד 273,03.08.2014,17:01:25,2014-08-03T17:01:00,1,ירי רקטות וטילים,1,525
אשדוד 273,03.08.2014,17:01:38,2014-08-03T17:02:00,1,ירי רקטות וטילים,1,526
עוטף עזה 217,03.08.2014,17:09:19,2014-08-03T17:09:00,1,ירי רקטות וטילים,1,527
 עוטף עזה 218,03.08.2014,17:09:23,2014-08-03T17:09:00,1,ירי רקטות וטילים,1,528
עוטף עזה 217,03.08.2014,17:09:23,2014-08-03T17:09:00,1,ירי רקטות וטילים,1,528
עוטף עזה 218,03.08.2014,17:09:36,2014-08-03T17:10:00,1,ירי רקטות וטילים,1,529
אשדוד 275,03.08.2014,17:38:37,2014-08-03T17:39:00,1,ירי רקטות וטילים,1,530
 אשדוד 276,03.08.2014,17:39:01,2014-08-03T17:39:00,1,ירי רקטות וטילים,1,531
אשדוד 275,03.08.2014,17:39:01,2014-08-03T17:39:00,1,ירי רקטות וטילים,1,531
אשדוד 276,03.08.2014,17:39:19,2014-08-03T17:39:00,1,ירי רקטות וטילים,1,532
עוטף עזה 224,03.08.2014,17:40:27,2014-08-03T17:40:00,1,ירי רקטות וטילים,1,533
 עוטף עזה 221,03.08.2014,17:40:39,2014-08-03T17:41:00,1,ירי רקטות וטילים,1,534
עוטף עזה 224,03.08.2014,17:40:39,2014-08-03T17:41:00,1,ירי רקטות וטילים,1,534
עוטף עזה 221,03.08.2014,17:40:44,2014-08-03T17:41:00,1,ירי רקטות וטילים,1,535
 עוטף עזה 224,03.08.2014,17:40:56,2014-08-03T17:41:00,1,ירי רקטות וטילים,1,536
עוטף עזה 221,03.08.2014,17:40:56,2014-08-03T17:41:00,1,ירי רקטות וטילים,1,536
 עוטף עזה 221,03.08.2014,17:41:01,2014-08-03T17:41:00,1,ירי רקטות וטילים,1,537
 עוטף עזה 224,03.08.2014,17:41:01,2014-08-03T17:41:00,1,ירי רקטות וטילים,1,537
עוטף עזה 221,03.08.2014,17:41:01,2014-08-03T17:41:00,1,ירי רקטות וטילים,1,537
 עוטף עזה 221,03.08.2014,17:41:01,2014-08-03T17:41:00,1,ירי רקטות וטילים,1,538
עוטף עזה 224,03.08.2014,17:41:01,2014-08-03T17:41:00,1,ירי רקטות וטילים,1,538
עוטף עזה 221,03.08.2014,17:41:13,2014-08-03T17:41:00,1,ירי רקטות וטילים,1,539
עוטף עזה 221,03.08.2014,17:41:24,2014-08-03T17:41:00,1,ירי רקטות וטילים,1,540
עוטף עזה 224,03.08.2014,17:52:08,2014-08-03T17:52:00,1,ירי רקטות וטילים,1,541
 עוטף עזה 224,03.08.2014,17:52:17,2014-08-03T17:52:00,1,ירי רקטות וטילים,1,542
אשדוד 271,03.08.2014,17:52:17,2014-08-03T17:52:00,1,ירי רקטות וטילים,1,542
אשדוד 271,03.08.2014,17:52:25,2014-08-03T17:52:00,1,ירי רקטות וטילים,1,543
אשדוד 271,03.08.2014,17:52:25,2014-08-03T17:52:00,1,ירי רקטות וטילים,1,544
 אשקלון 245,03.08.2014,17:52:38,2014-08-03T17:53:00,1,ירי רקטות וטילים,1,545
אשדוד 271,03.08.2014,17:52:38,2014-08-03T17:53:00,1,ירי רקטות וטילים,1,545
אשקלון 245,03.08.2014,17:52:59,2014-08-03T17:53:00,1,ירי רקטות וטילים,1,546
עוטף עזה 236,03.08.2014,18:21:07,2014-08-03T18:21:00,1,ירי רקטות וטילים,1,547
אשדוד 271,03.08.2014,18:27:11,2014-08-03T18:27:00,1,ירי רקטות וטילים,1,548
 אשקלון 245,03.08.2014,18:27:11,2014-08-03T18:27:00,1,ירי רקטות וטילים,1,548
 אשדוד 272,03.08.2014,18:27:35,2014-08-03T18:28:00,1,ירי רקטות וטילים,1,549
 אשקלון 245,03.08.2014,18:27:35,2014-08-03T18:28:00,1,ירי רקטות וטילים,1,549
אשדוד 271,03.08.2014,18:27:35,2014-08-03T18:28:00,1,ירי רקטות וטילים,1,549
אשדוד 272,03.08.2014,18:27:53,2014-08-03T18:28:00,1,ירי רקטות וטילים,1,550
עוטף עזה 230,03.08.2014,19:02:00,2014-08-03T19:02:00,1,ירי רקטות וטילים,1,551
עוטף עזה 236,03.08.2014,19:15:48,2014-08-03T19:16:00,1,ירי רקטות וטילים,1,552
עוטף עזה 218,03.08.2014,19:33:29,2014-08-03T19:33:00,1,ירי רקטות וטילים,1,553
 עוטף עזה 234,03.08.2014,19:43:56,2014-08-03T19:44:00,1,ירי רקטות וטילים,1,554
אשקלון 234,03.08.2014,19:43:56,2014-08-03T19:44:00,1,ירי רקטות וטילים,1,554
עוטף עזה 225,03.08.2014,19:44:39,2014-08-03T19:45:00,1,ירי רקטות וטילים,1,555
 עוטף עזה 223,03.08.2014,19:44:39,2014-08-03T19:45:00,1,ירי רקטות וטילים,1,555
עוטף עזה 217,03.08.2014,20:00:04,2014-08-03T20:00:00,1,ירי רקטות וטילים,1,556
אשדוד 271,03.08.2014,20:00:23,2014-08-03T20:00:00,1,ירי רקטות וטילים,1,557
 עוטף עזה 217,03.08.2014,20:00:28,2014-08-03T20:00:00,1,ירי רקטות וטילים,1,558
אשדוד 271,03.08.2014,20:00:28,2014-08-03T20:00:00,1,ירי רקטות וטילים,1,558
 אשקלון 245,03.08.2014,20:00:45,2014-08-03T20:01:00,1,ירי רקטות וטילים,1,559
 אשדוד 272,03.08.2014,20:00:45,2014-08-03T20:01:00,1,ירי רקטות וטילים,1,559
 עוטף עזה 217,03.08.2014,20:00:45,2014-08-03T20:01:00,1,ירי רקטות וטילים,1,559
אשדוד 271,03.08.2014,20:00:45,2014-08-03T20:01:00,1,ירי רקטות וטילים,1,559
אשדוד 271,03.08.2014,20:00:45,2014-08-03T20:01:00,1,ירי רקטות וטילים,1,560
 אשדוד 272,03.08.2014,20:00:45,2014-08-03T20:01:00,1,ירי רקטות וטילים,1,560
 אשקלון 245,03.08.2014,20:00:45,2014-08-03T20:01:00,1,ירי רקטות וטילים,1,560
 עוטף עזה 217,03.08.2014,20:00:45,2014-08-03T20:01:00,1,ירי רקטות וטילים,1,560
 אשדוד 272,03.08.2014,20:00:46,2014-08-03T20:01:00,1,ירי רקטות וטילים,1,561
אשדוד 271,03.08.2014,20:00:46,2014-08-03T20:01:00,1,ירי רקטות וטילים,1,561
 אשקלון 245,03.08.2014,20:00:46,2014-08-03T20:01:00,1,ירי רקטות וטילים,1,561
 אשקלון 245,03.08.2014,20:00:46,2014-08-03T20:01:00,1,ירי רקטות וטילים,1,562
 אשדוד 272,03.08.2014,20:00:46,2014-08-03T20:01:00,1,ירי רקטות וטילים,1,562
אשדוד 271,03.08.2014,20:00:46,2014-08-03T20:01:00,1,ירי רקטות וטילים,1,562
 אשקלון 245,03.08.2014,20:01:05,2014-08-03T20:01:00,1,ירי רקטות וטילים,1,563
אשדוד 272,03.08.2014,20:01:05,2014-08-03T20:01:00,1,ירי רקטות וטילים,1,563
עוטף עזה 228,03.08.2014,20:07:23,2014-08-03T20:07:00,1,ירי רקטות וטילים,1,564
עוטף עזה 236,03.08.2014,21:46:30,2014-08-03T21:47:00,1,ירי רקטות וטילים,1,565
עוטף עזה 225,03.08.2014,22:17:29,2014-08-03T22:17:00,1,ירי רקטות וטילים,1,566
 עוטף עזה 224,03.08.2014,22:17:29,2014-08-03T22:17:00,1,ירי רקטות וטילים,1,566
עוטף עזה 224,03.08.2014,22:22:03,2014-08-03T22:22:00,1,ירי רקטות וטילים,1,567
אשדוד 271,04.08.2014,06:09:37,2014-08-04T06:10:00,1,ירי רקטות וטילים,1,568
 אשקלון 245,04.08.2014,06:10:15,2014-08-04T06:10:00,1,ירי רקטות וטילים,1,569
