data,date,time,alertDate,category,category_desc,matrix_id,rid
נירים,13.06.2019,00:16:46,2019-06-13T00:17:00,1,ירי רקטות וטילים,1,5665
שדרות,13.06.2019,20:56:21,2019-06-13T20:56:00,1,ירי רקטות וטילים,1,5671
 איבים,13.06.2019,20:56:21,2019-06-13T20:56:00,1,ירי רקטות וטילים,1,5671
אשדוד - יא,18.06.2019,10:05:59,2019-06-18T10:06:00,1,ירי רקטות וטילים,1,5672
מרינה,18.06.2019,10:05:59,2019-06-18T10:06:00,1,ירי רקטות וטילים,1,5672
דישון,18.06.2019,11:54:54,2019-06-18T11:55:00,1,ירי רקטות וטילים,1,5673
נחל עוז,01.07.2019,09:18:57,2019-07-01T09:19:00,1,ירי רקטות וטילים,1,5674
 איבים,03.07.2019,07:20:20,2019-07-03T07:20:00,1,ירי רקטות וטילים,1,5675
שדרות,03.07.2019,07:20:20,2019-07-03T07:20:00,1,ירי רקטות וטילים,1,5675
ניר יצחק,12.07.2019,21:57:42,2019-07-12T21:58:00,1,ירי רקטות וטילים,1,5676
סופה,12.07.2019,21:57:42,2019-07-12T21:58:00,1,ירי רקטות וטילים,1,5677
כפר עזה,13.07.2019,10:31:03,2019-07-13T10:31:00,1,ירי רקטות וטילים,1,5678
נחל עוז,13.07.2019,10:31:03,2019-07-13T10:31:00,1,ירי רקטות וטילים,1,5679
אביאל,31.07.2019,10:06:53,2019-07-31T10:07:00,1,ירי רקטות וטילים,1,5680
אור עקיבא,31.07.2019,10:06:53,2019-07-31T10:07:00,1,ירי רקטות וטילים,1,5681
אזור תעשייה קיסריה,31.07.2019,10:06:53,2019-07-31T10:07:00,1,ירי רקטות וטילים,1,5682
אלוני יצחק,31.07.2019,10:06:53,2019-07-31T10:07:00,1,ירי רקטות וטילים,1,5683
באקה אל גרבייה,31.07.2019,10:06:53,2019-07-31T10:07:00,1,ירי רקטות וטילים,1,5684
בית חנניה,31.07.2019,10:06:53,2019-07-31T10:07:00,1,ירי רקטות וטילים,1,5685
בנימינה,31.07.2019,10:06:53,2019-07-31T10:07:00,1,ירי רקטות וטילים,1,5686
ג'סר א-זרקא,31.07.2019,10:06:53,2019-07-31T10:07:00,1,ירי רקטות וטילים,1,5687
ג'ת,31.07.2019,10:06:53,2019-07-31T10:07:00,1,ירי רקטות וטילים,1,5688
גבעת ניל''י,31.07.2019,10:06:53,2019-07-31T10:07:00,1,ירי רקטות וטילים,1,5689
גבעת עדה,31.07.2019,10:06:53,2019-07-31T10:07:00,1,ירי רקטות וטילים,1,5690
גן השומרון,31.07.2019,10:06:53,2019-07-31T10:07:00,1,ירי רקטות וטילים,1,5691
גן שמואל,31.07.2019,10:06:53,2019-07-31T10:07:00,1,ירי רקטות וטילים,1,5692
זכרון יעקב,31.07.2019,10:06:53,2019-07-31T10:07:00,1,ירי רקטות וטילים,1,5693
כפר גליקסון,31.07.2019,10:06:53,2019-07-31T10:07:00,1,ירי רקטות וטילים,1,5694
כפר פינס,31.07.2019,10:06:53,2019-07-31T10:07:00,1,ירי רקטות וטילים,1,5695
כרכור,31.07.2019,10:06:53,2019-07-31T10:07:00,1,ירי רקטות וטילים,1,5696
להבות חביבה,31.07.2019,10:06:53,2019-07-31T10:07:00,1,ירי רקטות וטילים,1,5697
מגל,31.07.2019,10:06:53,2019-07-31T10:07:00,1,ירי רקטות וטילים,1,5698
מייסר,31.07.2019,10:06:53,2019-07-31T10:07:00,1,ירי רקטות וטילים,1,5699
מעגן מיכאל,31.07.2019,10:06:53,2019-07-31T10:07:00,1,ירי רקטות וטילים,1,5700
מעיין צבי,31.07.2019,10:06:53,2019-07-31T10:07:00,1,ירי רקטות וטילים,1,5701
מצר,31.07.2019,10:06:53,2019-07-31T10:07:00,1,ירי רקטות וטילים,1,5702
משמרות,31.07.2019,10:06:53,2019-07-31T10:07:00,1,ירי רקטות וטילים,1,5703
עין עירון,31.07.2019,10:06:53,2019-07-31T10:07:00,1,ירי רקטות וטילים,1,5704
עין שמר,31.07.2019,10:06:53,2019-07-31T10:07:00,1,ירי רקטות וטילים,1,5705
עמיקם,31.07.2019,10:06:53,2019-07-31T10:07:00,1,ירי רקטות וטילים,1,5706
פרדס חנה,31.07.2019,10:06:53,2019-07-31T10:07:00,1,ירי רקטות וטילים,1,5707
קיסריה,31.07.2019,10:06:53,2019-07-31T10:07:00,1,ירי רקטות וטילים,1,5708
רגבים,31.07.2019,10:06:53,2019-07-31T10:07:00,1,ירי רקטות וטילים,1,5709
שדות ים,31.07.2019,10:06:53,2019-07-31T10:07:00,1,ירי רקטות וטילים,1,5710
אום אל פחם,31.07.2019,10:06:53,2019-07-31T10:07:00,1,ירי רקטות וטילים,1,5711
אום אל קוטוף,31.07.2019,10:06:53,2019-07-31T10:07:00,1,ירי רקטות וטילים,1,5712
אל עריאן,31.07.2019,10:06:53,2019-07-31T10:07:00,1,ירי רקטות וטילים,1,5713
ברטעה,31.07.2019,10:06:53,2019-07-31T10:07:00,1,ירי רקטות וטילים,1,5714
ברקאי,31.07.2019,10:06:53,2019-07-31T10:07:00,1,ירי רקטות וטילים,1,5715
גבעת חביבה,31.07.2019,10:06:53,2019-07-31T10:07:00,1,ירי רקטות וטילים,1,5716
חריש,31.07.2019,10:06:53,2019-07-31T10:07:00,1,ירי רקטות וטילים,1,5717
כפר קרע,31.07.2019,10:06:53,2019-07-31T10:07:00,1,ירי רקטות וטילים,1,5718
מאור,31.07.2019,10:06:53,2019-07-31T10:07:00,1,ירי רקטות וטילים,1,5719
מועאוויה,31.07.2019,10:06:53,2019-07-31T10:07:00,1,ירי רקטות וטילים,1,5720
מי עמי,31.07.2019,10:06:53,2019-07-31T10:07:00,1,ירי רקטות וטילים,1,5721
מעלה עירון,31.07.2019,10:06:53,2019-07-31T10:07:00,1,ירי רקטות וטילים,1,5722
מענית,31.07.2019,10:06:53,2019-07-31T10:07:00,1,ירי רקטות וטילים,1,5723
מצפה אילן,31.07.2019,10:06:53,2019-07-31T10:07:00,1,ירי רקטות וטילים,1,5724
עין אל-סהלה,31.07.2019,10:06:53,2019-07-31T10:07:00,1,ירי רקטות וטילים,1,5725
ערערה,31.07.2019,10:06:53,2019-07-31T10:07:00,1,ירי רקטות וטילים,1,5726
שדה יצחק,31.07.2019,10:06:53,2019-07-31T10:07:00,1,ירי רקטות וטילים,1,5727
שער מנשה,31.07.2019,10:06:53,2019-07-31T10:07:00,1,ירי רקטות וטילים,1,5728
תלמי אלעזר,31.07.2019,10:06:53,2019-07-31T10:07:00,1,ירי רקטות וטילים,1,5729
אזור תעשייה רגבים,31.07.2019,10:06:53,2019-07-31T10:07:00,1,ירי רקטות וטילים,1,5730
בית סוהר מגידו,31.07.2019,10:06:53,2019-07-31T10:07:00,1,ירי רקטות וטילים,1,5731
בית ספר אורט בנימינה,31.07.2019,10:06:53,2019-07-31T10:07:00,1,ירי רקטות וטילים,1,5732
מרכז ימי קיסריה,31.07.2019,10:06:53,2019-07-31T10:07:00,1,ירי רקטות וטילים,1,5733
קציר,31.07.2019,10:06:53,2019-07-31T10:07:00,1,ירי רקטות וטילים,1,5734
רמת הנדיב,31.07.2019,10:06:53,2019-07-31T10:07:00,1,ירי רקטות וטילים,1,5735
בית אורן,31.07.2019,10:06:53,2019-07-31T10:07:00,1,ירי רקטות וטילים,1,5736
גבעת וולפסון,31.07.2019,10:06:53,2019-07-31T10:07:00,1,ירי רקטות וטילים,1,5737
החותרים,31.07.2019,10:06:53,2019-07-31T10:07:00,1,ירי רקטות וטילים,1,5738
כפר גלים,31.07.2019,10:06:53,2019-07-31T10:07:00,1,ירי רקטות וטילים,1,5739
אזור תעשייה ניר עציון,31.07.2019,10:06:53,2019-07-31T10:07:00,1,ירי רקטות וטילים,1,5740
בית צבי,31.07.2019,10:06:53,2019-07-31T10:07:00,1,ירי רקטות וטילים,1,5741
בת שלמה,31.07.2019,10:06:53,2019-07-31T10:07:00,1,ירי רקטות וטילים,1,5742
גבע כרמל,31.07.2019,10:06:53,2019-07-31T10:07:00,1,ירי רקטות וטילים,1,5743
דור,31.07.2019,10:06:53,2019-07-31T10:07:00,1,ירי רקטות וטילים,1,5744
הבונים,31.07.2019,10:06:53,2019-07-31T10:07:00,1,ירי רקטות וטילים,1,5745
כפר הנוער ימין אורד,31.07.2019,10:06:53,2019-07-31T10:07:00,1,ירי רקטות וטילים,1,5746
כרם מהר''ל,31.07.2019,10:06:53,2019-07-31T10:07:00,1,ירי רקטות וטילים,1,5747
מאיר שפיה,31.07.2019,10:06:53,2019-07-31T10:07:00,1,ירי רקטות וטילים,1,5748
מגדים,31.07.2019,10:06:53,2019-07-31T10:07:00,1,ירי רקטות וטילים,1,5749
מרכז מיר''ב,31.07.2019,10:06:53,2019-07-31T10:07:00,1,ירי רקטות וטילים,1,5750
נווה ים,31.07.2019,10:06:53,2019-07-31T10:07:00,1,ירי רקטות וטילים,1,5751
נחשולים,31.07.2019,10:06:53,2019-07-31T10:07:00,1,ירי רקטות וטילים,1,5752
ניר עציון,31.07.2019,10:06:53,2019-07-31T10:07:00,1,ירי רקטות וטילים,1,5753
עופר,31.07.2019,10:06:53,2019-07-31T10:07:00,1,ירי רקטות וטילים,1,5754
עין איילה,31.07.2019,10:06:53,2019-07-31T10:07:00,1,ירי רקטות וטילים,1,5755
עין הוד,31.07.2019,10:06:53,2019-07-31T10:07:00,1,ירי רקטות וטילים,1,5756
עין חוד,31.07.2019,10:06:53,2019-07-31T10:07:00,1,ירי רקטות וטילים,1,5757
עין כרמל,31.07.2019,10:06:53,2019-07-31T10:07:00,1,ירי רקטות וטילים,1,5758
עתלית,31.07.2019,10:06:53,2019-07-31T10:07:00,1,ירי רקטות וטילים,1,5759
פוריידיס,31.07.2019,10:06:53,2019-07-31T10:07:00,1,ירי רקטות וטילים,1,5760
צרופה,31.07.2019,10:06:53,2019-07-31T10:07:00,1,ירי רקטות וטילים,1,5761
יערות הכרמל,31.07.2019,10:06:53,2019-07-31T10:07:00,1,ירי רקטות וטילים,1,5762
כלא דמון,31.07.2019,10:06:53,2019-07-31T10:07:00,1,ירי רקטות וטילים,1,5763
חדרה - מזרח,31.07.2019,10:11:32,2019-07-31T10:12:00,1,ירי רקטות וטילים,1,5764
חדרה - מרכז,31.07.2019,10:16:31,2019-07-31T10:17:00,1,ירי רקטות וטילים,1,5765
חדרה - נווה חיים,31.07.2019,10:21:31,2019-07-31T10:22:00,1,ירי רקטות וטילים,1,5766
חדרה - מערב,31.07.2019,10:26:31,2019-07-31T10:27:00,1,ירי רקטות וטילים,1,5767
 איבים,16.08.2019,21:02:21,2019-08-16T21:02:00,1,ירי רקטות וטילים,1,5768
שדרות,16.08.2019,21:02:21,2019-08-16T21:02:00,1,ירי רקטות וטילים,1,5768
ניר עם,16.08.2019,21:02:32,2019-08-16T21:03:00,1,ירי רקטות וטילים,1,5769
אור הנר,16.08.2019,21:02:32,2019-08-16T21:03:00,1,ירי רקטות וטילים,1,5770
ארז,16.08.2019,21:02:32,2019-08-16T21:03:00,1,ירי רקטות וטילים,1,5771
 מכללת ספיר,16.08.2019,21:03:05,2019-08-16T21:03:00,1,ירי רקטות וטילים,1,5772
גבים,16.08.2019,21:03:05,2019-08-16T21:03:00,1,ירי רקטות וטילים,1,5772
ניר עם,16.08.2019,21:03:05,2019-08-16T21:03:00,1,ירי רקטות וטילים,1,5773
 איבים,16.08.2019,21:03:05,2019-08-16T21:03:00,1,ירי רקטות וטילים,1,5774
שדרות,16.08.2019,21:03:05,2019-08-16T21:03:00,1,ירי רקטות וטילים,1,5774
דורות,17.08.2019,20:58:18,2019-08-17T20:58:00,1,ירי רקטות וטילים,1,5775
חוות שיקמים,17.08.2019,20:58:18,2019-08-17T20:58:00,1,ירי רקטות וטילים,1,5776
מפלסים,17.08.2019,20:58:23,2019-08-17T20:58:00,1,ירי רקטות וטילים,1,5777
מטווח ניר עם,17.08.2019,20:58:23,2019-08-17T20:58:00,1,ירי רקטות וטילים,1,5778
גבים,17.08.2019,20:58:23,2019-08-17T20:58:00,1,ירי רקטות וטילים,1,5779
 מכללת ספיר,17.08.2019,20:58:23,2019-08-17T20:58:00,1,ירי רקטות וטילים,1,5779
ניר עם,17.08.2019,20:58:23,2019-08-17T20:58:00,1,ירי רקטות וטילים,1,5780
שדרות,17.08.2019,20:58:23,2019-08-17T20:58:00,1,ירי רקטות וטילים,1,5781
 איבים,17.08.2019,20:58:23,2019-08-17T20:58:00,1,ירי רקטות וטילים,1,5781
גבים,17.08.2019,20:58:41,2019-08-17T20:59:00,1,ירי רקטות וטילים,1,5782
 מכללת ספיר,17.08.2019,20:58:41,2019-08-17T20:59:00,1,ירי רקטות וטילים,1,5782
שדרות,17.08.2019,20:58:41,2019-08-17T20:59:00,1,ירי רקטות וטילים,1,5783
 איבים,17.08.2019,20:58:41,2019-08-17T20:59:00,1,ירי רקטות וטילים,1,5783
שדרות,25.08.2019,21:04:16,2019-08-25T21:04:00,1,ירי רקטות וטילים,1,5784
 איבים,25.08.2019,21:04:16,2019-08-25T21:04:00,1,ירי רקטות וטילים,1,5784
אור הנר,25.08.2019,21:04:16,2019-08-25T21:04:00,1,ירי רקטות וטילים,1,5785
ניר עם,25.08.2019,21:04:22,2019-08-25T21:04:00,1,ירי רקטות וטילים,1,5786
אור הנר,25.08.2019,21:04:22,2019-08-25T21:04:00,1,ירי רקטות וטילים,1,5787
ארז,25.08.2019,21:04:22,2019-08-25T21:04:00,1,ירי רקטות וטילים,1,5788
 מכללת ספיר,25.08.2019,21:04:28,2019-08-25T21:04:00,1,ירי רקטות וטילים,1,5789
גבים,25.08.2019,21:04:28,2019-08-25T21:04:00,1,ירי רקטות וטילים,1,5789
ניר עם,25.08.2019,21:04:28,2019-08-25T21:04:00,1,ירי רקטות וטילים,1,5790
 איבים,25.08.2019,21:04:28,2019-08-25T21:04:00,1,ירי רקטות וטילים,1,5791
שדרות,25.08.2019,21:04:28,2019-08-25T21:04:00,1,ירי רקטות וטילים,1,5791
נתיב העשרה,28.08.2019,21:20:14,2019-08-28T21:20:00,1,ירי רקטות וטילים,1,5792
אור הנר,06.09.2019,23:30:12,2019-09-06T23:30:00,1,ירי רקטות וטילים,1,5793
שדרות,06.09.2019,23:30:12,2019-09-06T23:30:00,1,ירי רקטות וטילים,1,5794
 איבים,06.09.2019,23:30:12,2019-09-06T23:30:00,1,ירי רקטות וטילים,1,5794
אשקלון,10.09.2019,21:07:14,2019-09-10T21:07:00,1,ירי רקטות וטילים,1,5795
אזור תעשייה הדרומי אשקלון,10.09.2019,21:07:14,2019-09-10T21:07:00,1,ירי רקטות וטילים,1,5796
אשדוד - אזור תעשייה צפוני ונ,10.09.2019,21:07:46,2019-09-10T21:08:00,1,ירי רקטות וטילים,1,5797
אשדוד - א,10.09.2019,21:08:13,2019-09-10T21:08:00,1,ירי רקטות וטילים,1,5798
יד מרדכי,11.09.2019,13:15:42,2019-09-11T13:16:00,1,ירי רקטות וטילים,1,5799
נתיב העשרה,11.09.2019,13:15:42,2019-09-11T13:16:00,1,ירי רקטות וטילים,1,5800
אזור תעשייה הדרומי אשקלון,11.09.2019,19:03:19,2019-09-11T19:03:00,1,ירי רקטות וטילים,1,5801
מבקיעים,11.09.2019,19:03:25,2019-09-11T19:03:00,1,ירי רקטות וטילים,1,5802
זיקים,11.09.2019,23:36:57,2019-09-11T23:37:00,1,ירי רקטות וטילים,1,5803
מבקיעים,12.09.2019,00:06:00,2019-09-12T00:06:00,1,ירי רקטות וטילים,1,5804
ניר עם,19.09.2019,18:17:29,2019-09-19T18:17:00,1,ירי רקטות וטילים,1,5805
 מכללת ספיר,19.09.2019,18:17:35,2019-09-19T18:18:00,1,ירי רקטות וטילים,1,5806
גבים,19.09.2019,18:17:35,2019-09-19T18:18:00,1,ירי רקטות וטילים,1,5806
 איבים,19.09.2019,18:17:35,2019-09-19T18:18:00,1,ירי רקטות וטילים,1,5807
שדרות,19.09.2019,18:17:35,2019-09-19T18:18:00,1,ירי רקטות וטילים,1,5807
ארז,19.09.2019,18:17:35,2019-09-19T18:18:00,1,ירי רקטות וטילים,1,5808
מפלסים,19.09.2019,18:17:35,2019-09-19T18:18:00,1,ירי רקטות וטילים,1,5809
מטווח ניר עם,19.09.2019,18:17:35,2019-09-19T18:18:00,1,ירי רקטות וטילים,1,5810
כיסופים,04.10.2019,23:48:15,2019-10-04T23:48:00,1,ירי רקטות וטילים,1,5814
ארז,27.10.2019,09:38:03,2019-10-27T09:38:00,1,ירי רקטות וטילים,1,5815
בארי,31.10.2019,20:06:58,2019-10-31T20:07:00,1,ירי רקטות וטילים,1,5816
עלומים,31.10.2019,20:06:59,2019-10-31T20:07:00,1,ירי רקטות וטילים,1,5817
 איבים,01.11.2019,21:00:39,2019-11-01T21:01:00,1,ירי רקטות וטילים,1,5818
שדרות,01.11.2019,21:00:39,2019-11-01T21:01:00,1,ירי רקטות וטילים,1,5818
גבים,01.11.2019,21:00:50,2019-11-01T21:01:00,1,ירי רקטות וטילים,1,5819
 מכללת ספיר,01.11.2019,21:00:50,2019-11-01T21:01:00,1,ירי רקטות וטילים,1,5819
ניר עם,01.11.2019,21:00:50,2019-11-01T21:01:00,1,ירי רקטות וטילים,1,5820
אור הנר,01.11.2019,21:00:50,2019-11-01T21:01:00,1,ירי רקטות וטילים,1,5821
ארז,01.11.2019,21:00:50,2019-11-01T21:01:00,1,ירי רקטות וטילים,1,5822
מטווח ניר עם,01.11.2019,21:00:50,2019-11-01T21:01:00,1,ירי רקטות וטילים,1,5823
 איבים,01.11.2019,21:00:56,2019-11-01T21:01:00,1,ירי רקטות וטילים,1,5824
שדרות,01.11.2019,21:00:56,2019-11-01T21:01:00,1,ירי רקטות וטילים,1,5824
מטווח ניר עם,01.11.2019,21:01:08,2019-11-01T21:01:00,1,ירי רקטות וטילים,1,5825
גבים,01.11.2019,21:01:08,2019-11-01T21:01:00,1,ירי רקטות וטילים,1,5826
 מכללת ספיר,01.11.2019,21:01:08,2019-11-01T21:01:00,1,ירי רקטות וטילים,1,5826
ניר עם,01.11.2019,21:01:08,2019-11-01T21:01:00,1,ירי רקטות וטילים,1,5827
ארז,01.11.2019,21:01:08,2019-11-01T21:01:00,1,ירי רקטות וטילים,1,5828
שדרות,01.11.2019,21:01:15,2019-11-01T21:01:00,1,ירי רקטות וטילים,1,5829
 איבים,01.11.2019,21:01:15,2019-11-01T21:01:00,1,ירי רקטות וטילים,1,5829
ניר עם,01.11.2019,21:06:11,2019-11-01T21:06:00,1,ירי רקטות וטילים,1,5830
 איבים,01.11.2019,21:06:11,2019-11-01T21:06:00,1,ירי רקטות וטילים,1,5831
שדרות,01.11.2019,21:06:11,2019-11-01T21:06:00,1,ירי רקטות וטילים,1,5831
ניר עם,01.11.2019,21:06:54,2019-11-01T21:07:00,1,ירי רקטות וטילים,1,5832
שדרות,01.11.2019,21:06:54,2019-11-01T21:07:00,1,ירי רקטות וטילים,1,5833
 איבים,01.11.2019,21:06:54,2019-11-01T21:07:00,1,ירי רקטות וטילים,1,5833
ארז,01.11.2019,21:06:54,2019-11-01T21:07:00,1,ירי רקטות וטילים,1,5834
 איבים,01.11.2019,21:42:02,2019-11-01T21:42:00,1,ירי רקטות וטילים,1,5835
שדרות,01.11.2019,21:42:02,2019-11-01T21:42:00,1,ירי רקטות וטילים,1,5835
 מכללת ספיר,01.11.2019,21:42:13,2019-11-01T21:42:00,1,ירי רקטות וטילים,1,5836
גבים,01.11.2019,21:42:13,2019-11-01T21:42:00,1,ירי רקטות וטילים,1,5836
ניר עם,01.11.2019,21:42:13,2019-11-01T21:42:00,1,ירי רקטות וטילים,1,5837
ארז,01.11.2019,21:42:13,2019-11-01T21:42:00,1,ירי רקטות וטילים,1,5838
מטווח ניר עם,01.11.2019,21:42:13,2019-11-01T21:42:00,1,ירי רקטות וטילים,1,5839
שדרות,02.11.2019,01:57:53,2019-11-02T01:58:00,1,ירי רקטות וטילים,1,5840
 איבים,02.11.2019,01:57:53,2019-11-02T01:58:00,1,ירי רקטות וטילים,1,5840
 איבים,02.11.2019,01:59:05,2019-11-02T01:59:00,1,ירי רקטות וטילים,1,5841
שדרות,02.11.2019,01:59:05,2019-11-02T01:59:00,1,ירי רקטות וטילים,1,5841
אשדוד - א,12.11.2019,05:51:20,2019-11-12T05:51:00,1,ירי רקטות וטילים,1,5843
אשדוד - אזור תעשייה צפוני ונ,12.11.2019,05:51:20,2019-11-12T05:51:00,1,ירי רקטות וטילים,1,5844
מרינה,12.11.2019,05:51:20,2019-11-12T05:51:00,1,ירי רקטות וטילים,1,5845
אשדוד - יא,12.11.2019,05:51:20,2019-11-12T05:51:00,1,ירי רקטות וטילים,1,5845
בית אלעזרי,12.11.2019,05:51:40,2019-11-12T05:52:00,1,ירי רקטות וטילים,1,5846
גדרה,12.11.2019,05:51:40,2019-11-12T05:52:00,1,ירי רקטות וטילים,1,5847
קדרון,12.11.2019,05:51:40,2019-11-12T05:52:00,1,ירי רקטות וטילים,1,5848
אשקלון,12.11.2019,06:05:00,2019-11-12T06:05:00,1,ירי רקטות וטילים,1,5849
אזור תעשייה הדרומי אשקלון,12.11.2019,06:05:00,2019-11-12T06:05:00,1,ירי רקטות וטילים,1,5850
זיקים,12.11.2019,06:05:00,2019-11-12T06:05:00,1,ירי רקטות וטילים,1,5851
כרמיה,12.11.2019,06:05:15,2019-11-12T06:05:00,1,ירי רקטות וטילים,1,5852
ניצן,12.11.2019,06:05:46,2019-11-12T06:06:00,1,ירי רקטות וטילים,1,5853
ניצנים,12.11.2019,06:05:46,2019-11-12T06:06:00,1,ירי רקטות וטילים,1,5854
כפר עזה,12.11.2019,06:18:57,2019-11-12T06:19:00,1,ירי רקטות וטילים,1,5855
סעד,12.11.2019,06:19:02,2019-11-12T06:19:00,1,ירי רקטות וטילים,1,5856
נחל עוז,12.11.2019,06:19:18,2019-11-12T06:19:00,1,ירי רקטות וטילים,1,5857
כפר עזה,12.11.2019,06:19:28,2019-11-12T06:19:00,1,ירי רקטות וטילים,1,5858
סעד,12.11.2019,06:19:28,2019-11-12T06:19:00,1,ירי רקטות וטילים,1,5859
נחל עוז,12.11.2019,06:19:39,2019-11-12T06:20:00,1,ירי רקטות וטילים,1,5860
עלומים,12.11.2019,06:19:44,2019-11-12T06:20:00,1,ירי רקטות וטילים,1,5861
ניר עם,12.11.2019,06:29:54,2019-11-12T06:30:00,1,ירי רקטות וטילים,1,5862
 איבים,12.11.2019,06:29:54,2019-11-12T06:30:00,1,ירי רקטות וטילים,1,5863
שדרות,12.11.2019,06:29:54,2019-11-12T06:30:00,1,ירי רקטות וטילים,1,5863
 מכללת ספיר,12.11.2019,06:30:05,2019-11-12T06:30:00,1,ירי רקטות וטילים,1,5864
גבים,12.11.2019,06:30:05,2019-11-12T06:30:00,1,ירי רקטות וטילים,1,5864
מפלסים,12.11.2019,06:30:05,2019-11-12T06:30:00,1,ירי רקטות וטילים,1,5865
מטווח ניר עם,12.11.2019,06:30:05,2019-11-12T06:30:00,1,ירי רקטות וטילים,1,5866
ניר עם,12.11.2019,06:30:16,2019-11-12T06:30:00,1,ירי רקטות וטילים,1,5867
 איבים,12.11.2019,06:30:16,2019-11-12T06:30:00,1,ירי רקטות וטילים,1,5868
שדרות,12.11.2019,06:30:16,2019-11-12T06:30:00,1,ירי רקטות וטילים,1,5868
אשקלון,12.11.2019,06:35:17,2019-11-12T06:35:00,1,ירי רקטות וטילים,1,5869
אזור תעשייה הדרומי אשקלון,12.11.2019,06:35:17,2019-11-12T06:35:00,1,ירי רקטות וטילים,1,5870
אזור תעשייה צפוני אשקלון,12.11.2019,06:35:42,2019-11-12T06:36:00,1,ירי רקטות וטילים,1,5871
באר גנים,12.11.2019,06:35:42,2019-11-12T06:36:00,1,ירי רקטות וטילים,1,5872
נתיב העשרה,12.11.2019,06:39:06,2019-11-12T06:39:00,1,ירי רקטות וטילים,1,5873
זיקים,12.11.2019,06:39:11,2019-11-12T06:39:00,1,ירי רקטות וטילים,1,5874
כרמיה,12.11.2019,06:39:11,2019-11-12T06:39:00,1,ירי רקטות וטילים,1,5875
נתיב העשרה,12.11.2019,06:39:27,2019-11-12T06:39:00,1,ירי רקטות וטילים,1,5876
 איבים,12.11.2019,06:51:21,2019-11-12T06:51:00,1,ירי רקטות וטילים,1,5877
שדרות,12.11.2019,06:51:21,2019-11-12T06:51:00,1,ירי רקטות וטילים,1,5877
ארז,12.11.2019,06:51:31,2019-11-12T06:52:00,1,ירי רקטות וטילים,1,5878
מטווח ניר עם,12.11.2019,06:51:31,2019-11-12T06:52:00,1,ירי רקטות וטילים,1,5879
ניר עם,12.11.2019,06:51:31,2019-11-12T06:52:00,1,ירי רקטות וטילים,1,5880
 איבים,12.11.2019,06:51:41,2019-11-12T06:52:00,1,ירי רקטות וטילים,1,5881
שדרות,12.11.2019,06:51:41,2019-11-12T06:52:00,1,ירי רקטות וטילים,1,5881
חוות שיקמים,12.11.2019,06:51:41,2019-11-12T06:52:00,1,ירי רקטות וטילים,1,5882
ניר עם,12.11.2019,06:51:58,2019-11-12T06:52:00,1,ירי רקטות וטילים,1,5883
ארז,12.11.2019,06:51:58,2019-11-12T06:52:00,1,ירי רקטות וטילים,1,5884
מטווח ניר עם,12.11.2019,06:51:58,2019-11-12T06:52:00,1,ירי רקטות וטילים,1,5885
 איבים,12.11.2019,06:52:04,2019-11-12T06:52:00,1,ירי רקטות וטילים,1,5886
שדרות,12.11.2019,06:52:04,2019-11-12T06:52:00,1,ירי רקטות וטילים,1,5886
נתיב העשרה,12.11.2019,06:58:10,2019-11-12T06:58:00,1,ירי רקטות וטילים,1,5887
ניר עם,12.11.2019,06:59:53,2019-11-12T07:00:00,1,ירי רקטות וטילים,1,5888
 איבים,12.11.2019,06:59:53,2019-11-12T07:00:00,1,ירי רקטות וטילים,1,5889
שדרות,12.11.2019,06:59:53,2019-11-12T07:00:00,1,ירי רקטות וטילים,1,5889
ניר עם,12.11.2019,07:00:13,2019-11-12T07:00:00,1,ירי רקטות וטילים,1,5890
 איבים,12.11.2019,07:00:13,2019-11-12T07:00:00,1,ירי רקטות וטילים,1,5891
שדרות,12.11.2019,07:00:13,2019-11-12T07:00:00,1,ירי רקטות וטילים,1,5891
מפלסים,12.11.2019,07:00:13,2019-11-12T07:00:00,1,ירי רקטות וטילים,1,5892
מטווח ניר עם,12.11.2019,07:00:13,2019-11-12T07:00:00,1,ירי רקטות וטילים,1,5893
אזור תעשייה הדרומי אשקלון,12.11.2019,07:04:31,2019-11-12T07:05:00,1,ירי רקטות וטילים,1,5894
זיקים,12.11.2019,07:04:31,2019-11-12T07:05:00,1,ירי רקטות וטילים,1,5895
כרמיה,12.11.2019,07:04:31,2019-11-12T07:05:00,1,ירי רקטות וטילים,1,5896
מבקיעים,12.11.2019,07:04:31,2019-11-12T07:05:00,1,ירי רקטות וטילים,1,5897
אשקלון,12.11.2019,07:04:31,2019-11-12T07:05:00,1,ירי רקטות וטילים,1,5898
באר גנים,12.11.2019,07:04:31,2019-11-12T07:05:00,1,ירי רקטות וטילים,1,5899
ניצן,12.11.2019,07:04:31,2019-11-12T07:05:00,1,ירי רקטות וטילים,1,5900
אזור תעשייה צפוני אשקלון,12.11.2019,07:04:36,2019-11-12T07:05:00,1,ירי רקטות וטילים,1,5901
ניר עם,12.11.2019,07:05:38,2019-11-12T07:06:00,1,ירי רקטות וטילים,1,5902
 איבים,12.11.2019,07:05:38,2019-11-12T07:06:00,1,ירי רקטות וטילים,1,5903
שדרות,12.11.2019,07:05:38,2019-11-12T07:06:00,1,ירי רקטות וטילים,1,5903
חולון,12.11.2019,07:05:43,2019-11-12T07:06:00,1,ירי רקטות וטילים,1,5904
פלמחים,12.11.2019,07:05:43,2019-11-12T07:06:00,1,ירי רקטות וטילים,1,5905
ראשון לציון - מערב,12.11.2019,07:05:43,2019-11-12T07:06:00,1,ירי רקטות וטילים,1,5906
 מכללת ספיר,12.11.2019,07:05:44,2019-11-12T07:06:00,1,ירי רקטות וטילים,1,5907
גבים,12.11.2019,07:05:44,2019-11-12T07:06:00,1,ירי רקטות וטילים,1,5907
ארז,12.11.2019,07:05:44,2019-11-12T07:06:00,1,ירי רקטות וטילים,1,5908
מפלסים,12.11.2019,07:05:44,2019-11-12T07:06:00,1,ירי רקטות וטילים,1,5909
מטווח ניר עם,12.11.2019,07:05:44,2019-11-12T07:06:00,1,ירי רקטות וטילים,1,5910
פארק תעשיות פלמחים,12.11.2019,07:05:49,2019-11-12T07:06:00,1,ירי רקטות וטילים,1,5911
גן שורק,12.11.2019,07:05:49,2019-11-12T07:06:00,1,ירי רקטות וטילים,1,5912
 מכללת ספיר,12.11.2019,07:06:41,2019-11-12T07:07:00,1,ירי רקטות וטילים,1,5913
גבים,12.11.2019,07:06:41,2019-11-12T07:07:00,1,ירי רקטות וטילים,1,5913
ניר עם,12.11.2019,07:06:41,2019-11-12T07:07:00,1,ירי רקטות וטילים,1,5914
 איבים,12.11.2019,07:06:41,2019-11-12T07:07:00,1,ירי רקטות וטילים,1,5915
שדרות,12.11.2019,07:06:41,2019-11-12T07:07:00,1,ירי רקטות וטילים,1,5915
ארז,12.11.2019,07:06:51,2019-11-12T07:07:00,1,ירי רקטות וטילים,1,5916
מפלסים,12.11.2019,07:06:51,2019-11-12T07:07:00,1,ירי רקטות וטילים,1,5917
מטווח ניר עם,12.11.2019,07:06:51,2019-11-12T07:07:00,1,ירי רקטות וטילים,1,5918
אור הנר,12.11.2019,07:06:52,2019-11-12T07:07:00,1,ירי רקטות וטילים,1,5919
 איבים,12.11.2019,07:07:02,2019-11-12T07:07:00,1,ירי רקטות וטילים,1,5920
שדרות,12.11.2019,07:07:02,2019-11-12T07:07:00,1,ירי רקטות וטילים,1,5920
אזור תעשייה הדרומי אשקלון,12.11.2019,07:11:05,2019-11-12T07:11:00,1,ירי רקטות וטילים,1,5921
יד מרדכי,12.11.2019,07:11:05,2019-11-12T07:11:00,1,ירי רקטות וטילים,1,5922
כרמיה,12.11.2019,07:11:05,2019-11-12T07:11:00,1,ירי רקטות וטילים,1,5923
מבקיעים,12.11.2019,07:11:05,2019-11-12T07:11:00,1,ירי רקטות וטילים,1,5924
בית שקמה,12.11.2019,07:11:05,2019-11-12T07:11:00,1,ירי רקטות וטילים,1,5925
גיאה,12.11.2019,07:11:05,2019-11-12T07:11:00,1,ירי רקטות וטילים,1,5926
תלמי יפה,12.11.2019,07:11:26,2019-11-12T07:11:00,1,ירי רקטות וטילים,1,5927
אזור תעשייה הדרומי אשקלון,12.11.2019,07:28:32,2019-11-12T07:29:00,1,ירי רקטות וטילים,1,5928
זיקים,12.11.2019,07:28:32,2019-11-12T07:29:00,1,ירי רקטות וטילים,1,5929
כרמיה,12.11.2019,07:28:32,2019-11-12T07:29:00,1,ירי רקטות וטילים,1,5930
נתיב העשרה,12.11.2019,07:28:32,2019-11-12T07:29:00,1,ירי רקטות וטילים,1,5931
ארז,12.11.2019,07:41:11,2019-11-12T07:41:00,1,ירי רקטות וטילים,1,5932
כרמיה,12.11.2019,07:41:11,2019-11-12T07:41:00,1,ירי רקטות וטילים,1,5933
יד מרדכי,12.11.2019,07:41:11,2019-11-12T07:41:00,1,ירי רקטות וטילים,1,5934
נתיב העשרה,12.11.2019,07:41:11,2019-11-12T07:41:00,1,ירי רקטות וטילים,1,5935
נחל עוז,12.11.2019,07:42:23,2019-11-12T07:42:00,1,ירי רקטות וטילים,1,5936
סעד,12.11.2019,07:42:23,2019-11-12T07:42:00,1,ירי רקטות וטילים,1,5937
עלומים,12.11.2019,07:42:23,2019-11-12T07:42:00,1,ירי רקטות וטילים,1,5938
מבטחים עמיעוז ישע,12.11.2019,07:42:53,2019-11-12T07:43:00,1,ירי רקטות וטילים,1,5939
מבטחים עמיעוז ישע,12.11.2019,07:43:45,2019-11-12T07:44:00,1,ירי רקטות וטילים,1,5940
 איבים,12.11.2019,07:45:31,2019-11-12T07:46:00,1,ירי רקטות וטילים,1,5941
שדרות,12.11.2019,07:45:31,2019-11-12T07:46:00,1,ירי רקטות וטילים,1,5941
ניר עם,12.11.2019,07:45:42,2019-11-12T07:46:00,1,ירי רקטות וטילים,1,5942
 איבים,12.11.2019,07:45:53,2019-11-12T07:46:00,1,ירי רקטות וטילים,1,5943
שדרות,12.11.2019,07:45:53,2019-11-12T07:46:00,1,ירי רקטות וטילים,1,5943
מפלסים,12.11.2019,07:45:59,2019-11-12T07:46:00,1,ירי רקטות וטילים,1,5944
מטווח ניר עם,12.11.2019,07:45:59,2019-11-12T07:46:00,1,ירי רקטות וטילים,1,5945
ניר עם,12.11.2019,07:46:10,2019-11-12T07:46:00,1,ירי רקטות וטילים,1,5946
בית אלעזרי,12.11.2019,07:49:37,2019-11-12T07:50:00,1,ירי רקטות וטילים,1,5947
בית חלקיה,12.11.2019,07:49:37,2019-11-12T07:50:00,1,ירי רקטות וטילים,1,5948
גדרה,12.11.2019,07:49:37,2019-11-12T07:50:00,1,ירי רקטות וטילים,1,5949
גני טל,12.11.2019,07:49:37,2019-11-12T07:50:00,1,ירי רקטות וטילים,1,5950
חפץ חיים,12.11.2019,07:49:37,2019-11-12T07:50:00,1,ירי רקטות וטילים,1,5951
קדרון,12.11.2019,07:49:37,2019-11-12T07:50:00,1,ירי רקטות וטילים,1,5952
גני יוחנן,12.11.2019,07:49:37,2019-11-12T07:50:00,1,ירי רקטות וטילים,1,5953
חצב,12.11.2019,07:49:37,2019-11-12T07:50:00,1,ירי רקטות וטילים,1,5954
מזכרת בתיה,12.11.2019,07:49:37,2019-11-12T07:50:00,1,ירי רקטות וטילים,1,5955
קריית עקרון,12.11.2019,07:49:37,2019-11-12T07:50:00,1,ירי רקטות וטילים,1,5956
יד בנימין,12.11.2019,07:49:43,2019-11-12T07:50:00,1,ירי רקטות וטילים,1,5957
בני ראם,12.11.2019,07:50:39,2019-11-12T07:51:00,1,ירי רקטות וטילים,1,5958
תלמי יחיאל,12.11.2019,07:50:39,2019-11-12T07:51:00,1,ירי רקטות וטילים,1,5959
אזור תעשייה כנות,12.11.2019,07:50:39,2019-11-12T07:51:00,1,ירי רקטות וטילים,1,5960
ביצרון,12.11.2019,07:50:39,2019-11-12T07:51:00,1,ירי רקטות וטילים,1,5961
בני עי''ש,12.11.2019,07:50:39,2019-11-12T07:51:00,1,ירי רקטות וטילים,1,5962
גן יבנה,12.11.2019,07:50:39,2019-11-12T07:51:00,1,ירי רקטות וטילים,1,5963
כנות,12.11.2019,07:50:39,2019-11-12T07:51:00,1,ירי רקטות וטילים,1,5964
מישר,12.11.2019,07:50:39,2019-11-12T07:51:00,1,ירי רקטות וטילים,1,5965
משגב דב,12.11.2019,07:50:39,2019-11-12T07:51:00,1,ירי רקטות וטילים,1,5966
נווה מבטח,12.11.2019,07:50:39,2019-11-12T07:51:00,1,ירי רקטות וטילים,1,5967
פארק תעשייה ראם,12.11.2019,07:50:39,2019-11-12T07:51:00,1,ירי רקטות וטילים,1,5968
גדרה,12.11.2019,07:50:49,2019-11-12T07:51:00,1,ירי רקטות וטילים,1,5969
אחווה,12.11.2019,07:50:49,2019-11-12T07:51:00,1,ירי רקטות וטילים,1,5970
גני טל,12.11.2019,07:50:49,2019-11-12T07:51:00,1,ירי רקטות וטילים,1,5971
ינון,12.11.2019,07:50:49,2019-11-12T07:51:00,1,ירי רקטות וטילים,1,5972
כפר אחים,12.11.2019,07:50:49,2019-11-12T07:51:00,1,ירי רקטות וטילים,1,5973
כפר הרי''ף וצומת ראם,12.11.2019,07:50:49,2019-11-12T07:51:00,1,ירי רקטות וטילים,1,5974
חצב,12.11.2019,07:50:49,2019-11-12T07:51:00,1,ירי רקטות וטילים,1,5975
תל אביב - דרום העיר ויפו,12.11.2019,08:00:12,2019-11-12T08:00:00,1,ירי רקטות וטילים,1,5976
תל אביב - מרכז העיר,12.11.2019,08:00:12,2019-11-12T08:00:00,1,ירי רקטות וטילים,1,5977
בת-ים,12.11.2019,08:00:12,2019-11-12T08:00:00,1,ירי רקטות וטילים,1,5978
חולון,12.11.2019,08:00:12,2019-11-12T08:00:00,1,ירי רקטות וטילים,1,5979
ראשון לציון - מערב,12.11.2019,08:00:53,2019-11-12T08:01:00,1,ירי רקטות וטילים,1,5980
פלמחים,12.11.2019,08:01:03,2019-11-12T08:01:00,1,ירי רקטות וטילים,1,5981
כיסופים,12.11.2019,08:09:57,2019-11-12T08:10:00,1,ירי רקטות וטילים,1,5982
אשדוד - א,12.11.2019,08:12:19,2019-11-12T08:12:00,1,ירי רקטות וטילים,1,5983
אשדוד - אזור תעשייה צפוני ונ,12.11.2019,08:12:19,2019-11-12T08:12:00,1,ירי רקטות וטילים,1,5984
אשדוד - ג,12.11.2019,08:12:19,2019-11-12T08:12:00,1,ירי רקטות וטילים,1,5985
אשדוד - ח,12.11.2019,08:12:19,2019-11-12T08:12:00,1,ירי רקטות וטילים,1,5986
מרינה,12.11.2019,08:12:19,2019-11-12T08:12:00,1,ירי רקטות וטילים,1,5987
אשדוד - יא,12.11.2019,08:12:19,2019-11-12T08:12:00,1,ירי רקטות וטילים,1,5987
בני דרום,12.11.2019,08:12:19,2019-11-12T08:12:00,1,ירי רקטות וטילים,1,5988
ניר גלים,12.11.2019,08:12:19,2019-11-12T08:12:00,1,ירי רקטות וטילים,1,5989
יבנה,12.11.2019,08:12:19,2019-11-12T08:12:00,1,ירי רקטות וטילים,1,5990
כפר הנגיד,12.11.2019,08:12:19,2019-11-12T08:12:00,1,ירי רקטות וטילים,1,5991
בן זכאי,12.11.2019,08:12:19,2019-11-12T08:12:00,1,ירי רקטות וטילים,1,5992
גן הדרום,12.11.2019,08:12:19,2019-11-12T08:12:00,1,ירי רקטות וטילים,1,5993
גן יבנה,12.11.2019,08:12:19,2019-11-12T08:12:00,1,ירי רקטות וטילים,1,5994
כפר אביב,12.11.2019,08:12:19,2019-11-12T08:12:00,1,ירי רקטות וטילים,1,5995
כרם ביבנה,12.11.2019,08:12:19,2019-11-12T08:12:00,1,ירי רקטות וטילים,1,5996
מתחם בני דרום,12.11.2019,08:12:19,2019-11-12T08:12:00,1,ירי רקטות וטילים,1,5997
קבוצת יבנה,12.11.2019,08:12:19,2019-11-12T08:12:00,1,ירי רקטות וטילים,1,5998
מעון צופיה,12.11.2019,08:12:19,2019-11-12T08:12:00,1,ירי רקטות וטילים,1,5999
שתולים,12.11.2019,08:12:19,2019-11-12T08:12:00,1,ירי רקטות וטילים,1,6000
אזור תעשייה עד הלום,12.11.2019,08:12:34,2019-11-12T08:13:00,1,ירי רקטות וטילים,1,6001
בית עזרא,12.11.2019,08:12:34,2019-11-12T08:13:00,1,ירי רקטות וטילים,1,6002
ניצן,12.11.2019,08:12:46,2019-11-12T08:13:00,1,ירי רקטות וטילים,1,6003
נתיב העשרה,12.11.2019,08:14:27,2019-11-12T08:14:00,1,ירי רקטות וטילים,1,6004
יד מרדכי,12.11.2019,08:14:32,2019-11-12T08:15:00,1,ירי רקטות וטילים,1,6005
נחל עוז,12.11.2019,08:18:14,2019-11-12T08:18:00,1,ירי רקטות וטילים,1,6006
יושיביה,12.11.2019,08:23:12,2019-11-12T08:23:00,1,ירי רקטות וטילים,1,6007
תקומה וחוות יזרעם,12.11.2019,08:23:12,2019-11-12T08:23:00,1,ירי רקטות וטילים,1,6008
תקומה,12.11.2019,08:23:12,2019-11-12T08:23:00,1,ירי רקטות וטילים,1,6009
בית הגדי,12.11.2019,08:23:12,2019-11-12T08:23:00,1,ירי רקטות וטילים,1,6010
נתיבות,12.11.2019,08:23:12,2019-11-12T08:23:00,1,ירי רקטות וטילים,1,6011
שרשרת,12.11.2019,08:23:22,2019-11-12T08:23:00,1,ירי רקטות וטילים,1,6012
זמרת ושובה,12.11.2019,08:23:22,2019-11-12T08:23:00,1,ירי רקטות וטילים,1,6013
כפר מימון ותושיה,12.11.2019,08:23:22,2019-11-12T08:23:00,1,ירי רקטות וטילים,1,6014
סעד,12.11.2019,08:23:22,2019-11-12T08:23:00,1,ירי רקטות וטילים,1,6015
תקומה וחוות יזרעם,12.11.2019,08:23:33,2019-11-12T08:24:00,1,ירי רקטות וטילים,1,6016
תקומה,12.11.2019,08:23:33,2019-11-12T08:24:00,1,ירי רקטות וטילים,1,6017
רעים,12.11.2019,08:23:33,2019-11-12T08:24:00,1,ירי רקטות וטילים,1,6018
פלמחים,12.11.2019,08:23:38,2019-11-12T08:24:00,1,ירי רקטות וטילים,1,6019
בית הגדי,12.11.2019,08:23:49,2019-11-12T08:24:00,1,ירי רקטות וטילים,1,6020
נתיבות,12.11.2019,08:23:49,2019-11-12T08:24:00,1,ירי רקטות וטילים,1,6021
כפר מימון ותושיה,12.11.2019,08:25:22,2019-11-12T08:25:00,1,ירי רקטות וטילים,1,6022
נחל עוז,12.11.2019,08:25:22,2019-11-12T08:25:00,1,ירי רקטות וטילים,1,6023
עלומים,12.11.2019,08:25:22,2019-11-12T08:25:00,1,ירי רקטות וטילים,1,6024
נחל עוז,12.11.2019,08:25:42,2019-11-12T08:26:00,1,ירי רקטות וטילים,1,6025
עלומים,12.11.2019,08:25:42,2019-11-12T08:26:00,1,ירי רקטות וטילים,1,6026
זמרת ושובה,12.11.2019,08:25:42,2019-11-12T08:26:00,1,ירי רקטות וטילים,1,6027
כפר עזה,12.11.2019,08:25:42,2019-11-12T08:26:00,1,ירי רקטות וטילים,1,6028
סעד,12.11.2019,08:25:42,2019-11-12T08:26:00,1,ירי רקטות וטילים,1,6029
ניצן,12.11.2019,08:31:20,2019-11-12T08:31:00,1,ירי רקטות וטילים,1,6030
ניצנים,12.11.2019,08:31:20,2019-11-12T08:31:00,1,ירי רקטות וטילים,1,6031
אזור תעשייה עד הלום,12.11.2019,08:31:36,2019-11-12T08:32:00,1,ירי רקטות וטילים,1,6032
אשדוד - א,12.11.2019,08:31:36,2019-11-12T08:32:00,1,ירי רקטות וטילים,1,6033
אשדוד - אזור תעשייה צפוני ונ,12.11.2019,08:31:36,2019-11-12T08:32:00,1,ירי רקטות וטילים,1,6034
אשדוד - ג,12.11.2019,08:31:36,2019-11-12T08:32:00,1,ירי רקטות וטילים,1,6035
אשדוד - ח,12.11.2019,08:31:36,2019-11-12T08:32:00,1,ירי רקטות וטילים,1,6036
אשדוד - יא,12.11.2019,08:31:36,2019-11-12T08:32:00,1,ירי רקטות וטילים,1,6037
מרינה,12.11.2019,08:31:36,2019-11-12T08:32:00,1,ירי רקטות וטילים,1,6037
בני דרום,12.11.2019,08:31:36,2019-11-12T08:32:00,1,ירי רקטות וטילים,1,6038
ניר גלים,12.11.2019,08:31:36,2019-11-12T08:32:00,1,ירי רקטות וטילים,1,6039
גן הדרום,12.11.2019,08:31:36,2019-11-12T08:32:00,1,ירי רקטות וטילים,1,6040
גן יבנה,12.11.2019,08:31:36,2019-11-12T08:32:00,1,ירי רקטות וטילים,1,6041
מתחם בני דרום,12.11.2019,08:31:36,2019-11-12T08:32:00,1,ירי רקטות וטילים,1,6042
אמונים,12.11.2019,08:31:36,2019-11-12T08:32:00,1,ירי רקטות וטילים,1,6043
בית עזרא,12.11.2019,08:31:36,2019-11-12T08:32:00,1,ירי רקטות וטילים,1,6044
גבעתי,12.11.2019,08:31:36,2019-11-12T08:32:00,1,ירי רקטות וטילים,1,6045
עזר,12.11.2019,08:31:36,2019-11-12T08:32:00,1,ירי רקטות וטילים,1,6046
שדה עוזיהו,12.11.2019,08:31:36,2019-11-12T08:32:00,1,ירי רקטות וטילים,1,6047
שתולים,12.11.2019,08:31:36,2019-11-12T08:32:00,1,ירי רקטות וטילים,1,6048
אזור תעשייה צפוני אשקלון,12.11.2019,08:31:46,2019-11-12T08:32:00,1,ירי רקטות וטילים,1,6049
אשקלון,12.11.2019,08:31:46,2019-11-12T08:32:00,1,ירי רקטות וטילים,1,6050
באר גנים,12.11.2019,08:31:46,2019-11-12T08:32:00,1,ירי רקטות וטילים,1,6051
ניר ישראל,12.11.2019,08:31:46,2019-11-12T08:32:00,1,ירי רקטות וטילים,1,6052
כפר מימון ותושיה,12.11.2019,08:36:57,2019-11-12T08:37:00,1,ירי רקטות וטילים,1,6053
שוקדה,12.11.2019,08:36:57,2019-11-12T08:37:00,1,ירי רקטות וטילים,1,6054
נתיבות,12.11.2019,08:37:03,2019-11-12T08:37:00,1,ירי רקטות וטילים,1,6055
זמרת ושובה,12.11.2019,08:37:24,2019-11-12T08:37:00,1,ירי רקטות וטילים,1,6056
כפר מימון ותושיה,12.11.2019,08:37:24,2019-11-12T08:37:00,1,ירי רקטות וטילים,1,6057
שוקדה,12.11.2019,08:37:24,2019-11-12T08:37:00,1,ירי רקטות וטילים,1,6058
זמרת ושובה,12.11.2019,08:51:33,2019-11-12T08:52:00,1,ירי רקטות וטילים,1,6059
בית הגדי,12.11.2019,08:51:33,2019-11-12T08:52:00,1,ירי רקטות וטילים,1,6060
נתיבות,12.11.2019,08:51:33,2019-11-12T08:52:00,1,ירי רקטות וטילים,1,6061
כפר מימון ותושיה,12.11.2019,08:51:33,2019-11-12T08:52:00,1,ירי רקטות וטילים,1,6062
שוקדה,12.11.2019,08:51:33,2019-11-12T08:52:00,1,ירי רקטות וטילים,1,6063
זמרת ושובה,12.11.2019,08:51:59,2019-11-12T08:52:00,1,ירי רקטות וטילים,1,6064
כפר מימון ותושיה,12.11.2019,08:51:59,2019-11-12T08:52:00,1,ירי רקטות וטילים,1,6065
שוקדה,12.11.2019,08:51:59,2019-11-12T08:52:00,1,ירי רקטות וטילים,1,6066
תקומה וחוות יזרעם,12.11.2019,08:51:59,2019-11-12T08:52:00,1,ירי רקטות וטילים,1,6067
חולון,12.11.2019,09:09:59,2019-11-12T09:10:00,1,ירי רקטות וטילים,1,6068
בת-ים,12.11.2019,09:11:20,2019-11-12T09:11:00,1,ירי רקטות וטילים,1,6069
ראשון לציון - מזרח,12.11.2019,09:11:20,2019-11-12T09:11:00,1,ירי רקטות וטילים,1,6070
ראשון לציון - מערב,12.11.2019,09:11:20,2019-11-12T09:11:00,1,ירי רקטות וטילים,1,6071
ניצן,12.11.2019,09:12:22,2019-11-12T09:12:00,1,ירי רקטות וטילים,1,6072
ניצנים,12.11.2019,09:12:22,2019-11-12T09:12:00,1,ירי רקטות וטילים,1,6073
אשקלון,12.11.2019,09:12:32,2019-11-12T09:13:00,1,ירי רקטות וטילים,1,6074
אזור תעשייה הדרומי אשקלון,12.11.2019,09:12:32,2019-11-12T09:13:00,1,ירי רקטות וטילים,1,6075
בית הגדי,12.11.2019,09:20:15,2019-11-12T09:20:00,1,ירי רקטות וטילים,1,6076
שוקדה,12.11.2019,09:20:15,2019-11-12T09:20:00,1,ירי רקטות וטילים,1,6077
כפר מימון ותושיה,12.11.2019,09:20:15,2019-11-12T09:20:00,1,ירי רקטות וטילים,1,6078
נתיבות,12.11.2019,09:20:15,2019-11-12T09:20:00,1,ירי רקטות וטילים,1,6079
אשבול,12.11.2019,09:20:15,2019-11-12T09:20:00,1,ירי רקטות וטילים,1,6080
זמרת ושובה,12.11.2019,09:20:15,2019-11-12T09:20:00,1,ירי רקטות וטילים,1,6081
זרועה,12.11.2019,09:20:15,2019-11-12T09:20:00,1,ירי רקטות וטילים,1,6082
יושיביה,12.11.2019,09:20:15,2019-11-12T09:20:00,1,ירי רקטות וטילים,1,6083
מבועים,12.11.2019,09:20:15,2019-11-12T09:20:00,1,ירי רקטות וטילים,1,6084
נחל עוז,12.11.2019,09:20:15,2019-11-12T09:20:00,1,ירי רקטות וטילים,1,6085
סעד,12.11.2019,09:20:15,2019-11-12T09:20:00,1,ירי רקטות וטילים,1,6086
עלומים,12.11.2019,09:20:15,2019-11-12T09:20:00,1,ירי רקטות וטילים,1,6087
פעמי תש''ז,12.11.2019,09:20:15,2019-11-12T09:20:00,1,ירי רקטות וטילים,1,6088
קלחים,12.11.2019,09:20:15,2019-11-12T09:20:00,1,ירי רקטות וטילים,1,6089
תלמי ביל''ו,12.11.2019,09:20:15,2019-11-12T09:20:00,1,ירי רקטות וטילים,1,6090
תקומה וחוות יזרעם,12.11.2019,09:20:15,2019-11-12T09:20:00,1,ירי רקטות וטילים,1,6091
תקומה,12.11.2019,09:20:15,2019-11-12T09:20:00,1,ירי רקטות וטילים,1,6092
בארי,12.11.2019,09:20:15,2019-11-12T09:20:00,1,ירי רקטות וטילים,1,6093
דורות,12.11.2019,09:20:25,2019-11-12T09:20:00,1,ירי רקטות וטילים,1,6094
חוות שיקמים,12.11.2019,09:20:25,2019-11-12T09:20:00,1,ירי רקטות וטילים,1,6095
מפלסים,12.11.2019,09:20:25,2019-11-12T09:20:00,1,ירי רקטות וטילים,1,6096
 איבים,12.11.2019,09:20:25,2019-11-12T09:20:00,1,ירי רקטות וטילים,1,6097
שדרות,12.11.2019,09:20:25,2019-11-12T09:20:00,1,ירי רקטות וטילים,1,6097
 מכללת ספיר,12.11.2019,09:20:25,2019-11-12T09:20:00,1,ירי רקטות וטילים,1,6098
גבים,12.11.2019,09:20:25,2019-11-12T09:20:00,1,ירי רקטות וטילים,1,6098
כפר עזה,12.11.2019,09:20:31,2019-11-12T09:21:00,1,ירי רקטות וטילים,1,6099
ניר עם,12.11.2019,09:20:36,2019-11-12T09:21:00,1,ירי רקטות וטילים,1,6100
יכיני,12.11.2019,09:20:36,2019-11-12T09:21:00,1,ירי רקטות וטילים,1,6101
מטווח ניר עם,12.11.2019,09:20:36,2019-11-12T09:21:00,1,ירי רקטות וטילים,1,6102
שוקדה,12.11.2019,09:20:36,2019-11-12T09:21:00,1,ירי רקטות וטילים,1,6103
זמרת ושובה,12.11.2019,09:20:36,2019-11-12T09:21:00,1,ירי רקטות וטילים,1,6104
כפר מימון ותושיה,12.11.2019,09:20:36,2019-11-12T09:21:00,1,ירי רקטות וטילים,1,6105
נחל עוז,12.11.2019,09:20:42,2019-11-12T09:21:00,1,ירי רקטות וטילים,1,6106
סעד,12.11.2019,09:20:42,2019-11-12T09:21:00,1,ירי רקטות וטילים,1,6107
בארי,12.11.2019,09:20:42,2019-11-12T09:21:00,1,ירי רקטות וטילים,1,6108
עלומים,12.11.2019,09:20:42,2019-11-12T09:21:00,1,ירי רקטות וטילים,1,6109
 מכללת ספיר,12.11.2019,09:20:47,2019-11-12T09:21:00,1,ירי רקטות וטילים,1,6110
גבים,12.11.2019,09:20:47,2019-11-12T09:21:00,1,ירי רקטות וטילים,1,6110
שוקדה,12.11.2019,09:20:54,2019-11-12T09:21:00,1,ירי רקטות וטילים,1,6111
זמרת ושובה,12.11.2019,09:20:59,2019-11-12T09:21:00,1,ירי רקטות וטילים,1,6112
 איבים,12.11.2019,09:21:04,2019-11-12T09:21:00,1,ירי רקטות וטילים,1,6113
שדרות,12.11.2019,09:21:04,2019-11-12T09:21:00,1,ירי רקטות וטילים,1,6113
מבטחים עמיעוז ישע,12.11.2019,09:27:16,2019-11-12T09:27:00,1,ירי רקטות וטילים,1,6114
צוחר ואוהד,12.11.2019,09:27:16,2019-11-12T09:27:00,1,ירי רקטות וטילים,1,6115
 מכללת ספיר,12.11.2019,09:27:48,2019-11-12T09:28:00,1,ירי רקטות וטילים,1,6116
גבים,12.11.2019,09:27:48,2019-11-12T09:28:00,1,ירי רקטות וטילים,1,6116
ניר עם,12.11.2019,09:27:48,2019-11-12T09:28:00,1,ירי רקטות וטילים,1,6117
 איבים,12.11.2019,09:27:48,2019-11-12T09:28:00,1,ירי רקטות וטילים,1,6118
שדרות,12.11.2019,09:27:48,2019-11-12T09:28:00,1,ירי רקטות וטילים,1,6118
מפלסים,12.11.2019,09:27:48,2019-11-12T09:28:00,1,ירי רקטות וטילים,1,6119
מטווח ניר עם,12.11.2019,09:27:48,2019-11-12T09:28:00,1,ירי רקטות וטילים,1,6120
מפלסים,12.11.2019,09:27:53,2019-11-12T09:28:00,1,ירי רקטות וטילים,1,6121
 מכללת ספיר,12.11.2019,09:28:09,2019-11-12T09:28:00,1,ירי רקטות וטילים,1,6122
גבים,12.11.2019,09:28:09,2019-11-12T09:28:00,1,ירי רקטות וטילים,1,6122
גן הדרום,12.11.2019,09:28:24,2019-11-12T09:28:00,1,ירי רקטות וטילים,1,6123
גן יבנה,12.11.2019,09:28:24,2019-11-12T09:28:00,1,ירי רקטות וטילים,1,6124
שתולים,12.11.2019,09:28:24,2019-11-12T09:28:00,1,ירי רקטות וטילים,1,6125
שתולים,12.11.2019,09:29:15,2019-11-12T09:29:00,1,ירי רקטות וטילים,1,6126
אשקלון,12.11.2019,09:54:06,2019-11-12T09:54:00,1,ירי רקטות וטילים,1,6127
אזור תעשייה הדרומי אשקלון,12.11.2019,09:54:06,2019-11-12T09:54:00,1,ירי רקטות וטילים,1,6128
זיקים,12.11.2019,09:54:06,2019-11-12T09:54:00,1,ירי רקטות וטילים,1,6129
כרמיה,12.11.2019,09:54:16,2019-11-12T09:54:00,1,ירי רקטות וטילים,1,6130
נתיב העשרה,12.11.2019,09:54:16,2019-11-12T09:54:00,1,ירי רקטות וטילים,1,6131
זיקים,12.11.2019,09:54:27,2019-11-12T09:54:00,1,ירי רקטות וטילים,1,6132
כיסופים,12.11.2019,10:01:55,2019-11-12T10:02:00,1,ירי רקטות וטילים,1,6133
כיסופים,12.11.2019,10:02:11,2019-11-12T10:02:00,1,ירי רקטות וטילים,1,6134
כפר מימון ותושיה,12.11.2019,10:04:28,2019-11-12T10:04:00,1,ירי רקטות וטילים,1,6135
מעגלים גבעולים מלילות,12.11.2019,10:04:28,2019-11-12T10:04:00,1,ירי רקטות וטילים,1,6136
שוקדה,12.11.2019,10:04:28,2019-11-12T10:04:00,1,ירי רקטות וטילים,1,6137
תדהר,12.11.2019,10:04:28,2019-11-12T10:04:00,1,ירי רקטות וטילים,1,6138
שרשרת,12.11.2019,10:04:34,2019-11-12T10:05:00,1,ירי רקטות וטילים,1,6139
יושיביה,12.11.2019,10:04:34,2019-11-12T10:05:00,1,ירי רקטות וטילים,1,6140
נתיבות,12.11.2019,10:04:34,2019-11-12T10:05:00,1,ירי רקטות וטילים,1,6141
בית הגדי,12.11.2019,10:04:34,2019-11-12T10:05:00,1,ירי רקטות וטילים,1,6142
תקומה וחוות יזרעם,12.11.2019,10:04:34,2019-11-12T10:05:00,1,ירי רקטות וטילים,1,6143
תקומה,12.11.2019,10:04:34,2019-11-12T10:05:00,1,ירי רקטות וטילים,1,6144
ברוש,12.11.2019,10:04:40,2019-11-12T10:05:00,1,ירי רקטות וטילים,1,6145
זמרת ושובה,12.11.2019,10:04:50,2019-11-12T10:05:00,1,ירי רקטות וטילים,1,6146
עלומים,12.11.2019,10:04:50,2019-11-12T10:05:00,1,ירי רקטות וטילים,1,6147
כפר מימון ותושיה,12.11.2019,10:04:55,2019-11-12T10:05:00,1,ירי רקטות וטילים,1,6148
שוקדה,12.11.2019,10:04:55,2019-11-12T10:05:00,1,ירי רקטות וטילים,1,6149
תקומה וחוות יזרעם,12.11.2019,10:04:55,2019-11-12T10:05:00,1,ירי רקטות וטילים,1,6150
תקומה,12.11.2019,10:04:55,2019-11-12T10:05:00,1,ירי רקטות וטילים,1,6151
שיבולים,12.11.2019,10:05:01,2019-11-12T10:05:00,1,ירי רקטות וטילים,1,6152
בית הגדי,12.11.2019,10:05:06,2019-11-12T10:05:00,1,ירי רקטות וטילים,1,6153
נתיבות,12.11.2019,10:05:06,2019-11-12T10:05:00,1,ירי רקטות וטילים,1,6154
כפר עזה,12.11.2019,10:05:06,2019-11-12T10:05:00,1,ירי רקטות וטילים,1,6155
סעד,12.11.2019,10:05:06,2019-11-12T10:05:00,1,ירי רקטות וטילים,1,6156
שוקדה,12.11.2019,10:07:09,2019-11-12T10:07:00,1,ירי רקטות וטילים,1,6157
בארי,12.11.2019,10:07:29,2019-11-12T10:07:00,1,ירי רקטות וטילים,1,6158
עלומים,12.11.2019,10:07:29,2019-11-12T10:07:00,1,ירי רקטות וטילים,1,6159
שוקדה,12.11.2019,10:07:29,2019-11-12T10:07:00,1,ירי רקטות וטילים,1,6160
כפר מימון ותושיה,12.11.2019,10:07:29,2019-11-12T10:07:00,1,ירי רקטות וטילים,1,6161
מעגלים גבעולים מלילות,12.11.2019,10:07:29,2019-11-12T10:07:00,1,ירי רקטות וטילים,1,6162
זמרת ושובה,12.11.2019,10:07:35,2019-11-12T10:08:00,1,ירי רקטות וטילים,1,6163
נחל עוז,12.11.2019,10:07:35,2019-11-12T10:08:00,1,ירי רקטות וטילים,1,6164
כפר מימון ותושיה,12.11.2019,10:07:46,2019-11-12T10:08:00,1,ירי רקטות וטילים,1,6165
בארי,12.11.2019,10:08:23,2019-11-12T10:08:00,1,ירי רקטות וטילים,1,6166
זמרת ושובה,12.11.2019,10:08:33,2019-11-12T10:09:00,1,ירי רקטות וטילים,1,6167
כפר מימון ותושיה,12.11.2019,10:08:33,2019-11-12T10:09:00,1,ירי רקטות וטילים,1,6168
סעד,12.11.2019,10:08:43,2019-11-12T10:09:00,1,ירי רקטות וטילים,1,6169
עלומים,12.11.2019,10:08:43,2019-11-12T10:09:00,1,ירי רקטות וטילים,1,6170
שוקדה,12.11.2019,10:08:43,2019-11-12T10:09:00,1,ירי רקטות וטילים,1,6171
אשדוד - אזור תעשייה צפוני ונ,12.11.2019,10:16:33,2019-11-12T10:17:00,1,ירי רקטות וטילים,1,6172
מודיעין,12.11.2019,10:16:59,2019-11-12T10:17:00,1,ירי רקטות וטילים,1,6173
מודיעין - ישפרו סנטר,12.11.2019,10:16:59,2019-11-12T10:17:00,1,ירי רקטות וטילים,1,6174
בני דרום,12.11.2019,10:17:14,2019-11-12T10:17:00,1,ירי רקטות וטילים,1,6175
ניר גלים,12.11.2019,10:17:14,2019-11-12T10:17:00,1,ירי רקטות וטילים,1,6176
אשדוד - אזור תעשייה צפוני ונ,12.11.2019,10:17:24,2019-11-12T10:17:00,1,ירי רקטות וטילים,1,6177
בית חשמונאי,12.11.2019,10:18:11,2019-11-12T10:18:00,1,ירי רקטות וטילים,1,6178
בית עוזיאל,12.11.2019,10:18:11,2019-11-12T10:18:00,1,ירי רקטות וטילים,1,6179
גזר,12.11.2019,10:18:11,2019-11-12T10:18:00,1,ירי רקטות וטילים,1,6180
כפר בן נון,12.11.2019,10:18:11,2019-11-12T10:18:00,1,ירי רקטות וטילים,1,6181
כפר שמואל,12.11.2019,10:18:11,2019-11-12T10:18:00,1,ירי רקטות וטילים,1,6182
כרמי יוסף,12.11.2019,10:18:11,2019-11-12T10:18:00,1,ירי רקטות וטילים,1,6183
משמר איילון,12.11.2019,10:18:11,2019-11-12T10:18:00,1,ירי רקטות וטילים,1,6184
עזריה,12.11.2019,10:18:11,2019-11-12T10:18:00,1,ירי רקטות וטילים,1,6185
מודיעין - ישפרו סנטר,12.11.2019,10:18:42,2019-11-12T10:19:00,1,ירי רקטות וטילים,1,6186
יד מרדכי,12.11.2019,10:29:06,2019-11-12T10:29:00,1,ירי רקטות וטילים,1,6187
ארז,12.11.2019,10:29:21,2019-11-12T10:29:00,1,ירי רקטות וטילים,1,6188
כרמיה,12.11.2019,10:29:21,2019-11-12T10:29:00,1,ירי רקטות וטילים,1,6189
נתיב העשרה,12.11.2019,10:29:21,2019-11-12T10:29:00,1,ירי רקטות וטילים,1,6190
יד מרדכי,12.11.2019,10:29:27,2019-11-12T10:29:00,1,ירי רקטות וטילים,1,6191
נתיב העשרה,12.11.2019,10:29:48,2019-11-12T10:30:00,1,ירי רקטות וטילים,1,6192
עלומים,12.11.2019,10:56:55,2019-11-12T10:57:00,1,ירי רקטות וטילים,1,6193
כפר עזה,12.11.2019,10:57:06,2019-11-12T10:57:00,1,ירי רקטות וטילים,1,6194
נחל עוז,12.11.2019,10:57:06,2019-11-12T10:57:00,1,ירי רקטות וטילים,1,6195
סעד,12.11.2019,10:57:06,2019-11-12T10:57:00,1,ירי רקטות וטילים,1,6196
נחל עוז,12.11.2019,10:57:33,2019-11-12T10:58:00,1,ירי רקטות וטילים,1,6197
עלומים,12.11.2019,10:57:38,2019-11-12T10:58:00,1,ירי רקטות וטילים,1,6198
כפר עזה,12.11.2019,10:57:44,2019-11-12T10:58:00,1,ירי רקטות וטילים,1,6199
סעד,12.11.2019,10:57:44,2019-11-12T10:58:00,1,ירי רקטות וטילים,1,6200
עין השלושה,12.11.2019,11:18:29,2019-11-12T11:18:00,1,ירי רקטות וטילים,1,6201
נירים,12.11.2019,11:18:29,2019-11-12T11:18:00,1,ירי רקטות וטילים,1,6202
עין השלושה,12.11.2019,11:18:49,2019-11-12T11:19:00,1,ירי רקטות וטילים,1,6203
כיסופים,12.11.2019,11:18:55,2019-11-12T11:19:00,1,ירי רקטות וטילים,1,6204
נירים,12.11.2019,11:18:55,2019-11-12T11:19:00,1,ירי רקטות וטילים,1,6205
עין השלושה,12.11.2019,11:19:11,2019-11-12T11:19:00,1,ירי רקטות וטילים,1,6206
נחל עוז,12.11.2019,11:33:30,2019-11-12T11:34:00,1,ירי רקטות וטילים,1,6207
עלומים,12.11.2019,11:33:40,2019-11-12T11:34:00,1,ירי רקטות וטילים,1,6208
 מכללת ספיר,12.11.2019,11:45:15,2019-11-12T11:45:00,1,ירי רקטות וטילים,1,6209
גבים,12.11.2019,11:45:15,2019-11-12T11:45:00,1,ירי רקטות וטילים,1,6209
ניר עם,12.11.2019,11:45:15,2019-11-12T11:45:00,1,ירי רקטות וטילים,1,6210
מפלסים,12.11.2019,11:45:15,2019-11-12T11:45:00,1,ירי רקטות וטילים,1,6211
מטווח ניר עם,12.11.2019,11:45:15,2019-11-12T11:45:00,1,ירי רקטות וטילים,1,6212
 איבים,12.11.2019,11:45:15,2019-11-12T11:45:00,1,ירי רקטות וטילים,1,6213
שדרות,12.11.2019,11:45:15,2019-11-12T11:45:00,1,ירי רקטות וטילים,1,6213
יכיני,12.11.2019,11:45:25,2019-11-12T11:45:00,1,ירי רקטות וטילים,1,6214
עלומים,12.11.2019,11:46:42,2019-11-12T11:47:00,1,ירי רקטות וטילים,1,6215
נחל עוז,12.11.2019,11:46:48,2019-11-12T11:47:00,1,ירי רקטות וטילים,1,6216
סעד,12.11.2019,11:46:48,2019-11-12T11:47:00,1,ירי רקטות וטילים,1,6217
כפר עזה,12.11.2019,11:46:58,2019-11-12T11:47:00,1,ירי רקטות וטילים,1,6218
גבים,12.11.2019,11:53:16,2019-11-12T11:53:00,1,ירי רקטות וטילים,1,6219
 מכללת ספיר,12.11.2019,11:53:16,2019-11-12T11:53:00,1,ירי רקטות וטילים,1,6219
 איבים,12.11.2019,11:53:16,2019-11-12T11:53:00,1,ירי רקטות וטילים,1,6220
שדרות,12.11.2019,11:53:16,2019-11-12T11:53:00,1,ירי רקטות וטילים,1,6220
ניר עם,12.11.2019,11:53:21,2019-11-12T11:53:00,1,ירי רקטות וטילים,1,6221
מפלסים,12.11.2019,11:53:21,2019-11-12T11:53:00,1,ירי רקטות וטילים,1,6222
מטווח ניר עם,12.11.2019,11:53:21,2019-11-12T11:53:00,1,ירי רקטות וטילים,1,6223
 מכללת ספיר,12.11.2019,11:53:32,2019-11-12T11:54:00,1,ירי רקטות וטילים,1,6224
גבים,12.11.2019,11:53:32,2019-11-12T11:54:00,1,ירי רקטות וטילים,1,6224
 איבים,12.11.2019,11:53:37,2019-11-12T11:54:00,1,ירי רקטות וטילים,1,6225
שדרות,12.11.2019,11:53:37,2019-11-12T11:54:00,1,ירי רקטות וטילים,1,6225
אזור תעשייה צפוני אשקלון,12.11.2019,11:56:23,2019-11-12T11:56:00,1,ירי רקטות וטילים,1,6226
באר גנים,12.11.2019,11:56:23,2019-11-12T11:56:00,1,ירי רקטות וטילים,1,6227
ניצנים,12.11.2019,11:56:23,2019-11-12T11:56:00,1,ירי רקטות וטילים,1,6228
בית שקמה,12.11.2019,11:56:23,2019-11-12T11:56:00,1,ירי רקטות וטילים,1,6229
ברכיה,12.11.2019,11:56:23,2019-11-12T11:56:00,1,ירי רקטות וטילים,1,6230
בת הדר,12.11.2019,11:56:23,2019-11-12T11:56:00,1,ירי רקטות וטילים,1,6231
הודיה,12.11.2019,11:56:23,2019-11-12T11:56:00,1,ירי רקטות וטילים,1,6232
כפר סילבר,12.11.2019,11:56:23,2019-11-12T11:56:00,1,ירי רקטות וטילים,1,6233
משען,12.11.2019,11:56:23,2019-11-12T11:56:00,1,ירי רקטות וטילים,1,6234
ניר ישראל,12.11.2019,11:56:23,2019-11-12T11:56:00,1,ירי רקטות וטילים,1,6235
אשקלון,12.11.2019,11:56:23,2019-11-12T11:56:00,1,ירי רקטות וטילים,1,6236
אזור תעשייה הדרומי אשקלון,12.11.2019,11:56:54,2019-11-12T11:57:00,1,ירי רקטות וטילים,1,6237
נחל עוז,12.11.2019,12:21:55,2019-11-12T12:22:00,1,ירי רקטות וטילים,1,6238
נחל עוז,12.11.2019,12:22:16,2019-11-12T12:22:00,1,ירי רקטות וטילים,1,6239
נתיב העשרה,12.11.2019,12:43:26,2019-11-12T12:43:00,1,ירי רקטות וטילים,1,6240
נתיב העשרה,12.11.2019,12:43:51,2019-11-12T12:44:00,1,ירי רקטות וטילים,1,6241
נתיב העשרה,12.11.2019,12:45:43,2019-11-12T12:46:00,1,ירי רקטות וטילים,1,6242
נתיב העשרה,12.11.2019,12:46:03,2019-11-12T12:46:00,1,ירי רקטות וטילים,1,6243
ארז,12.11.2019,12:49:11,2019-11-12T12:49:00,1,ירי רקטות וטילים,1,6244
ארז,12.11.2019,12:49:26,2019-11-12T12:49:00,1,ירי רקטות וטילים,1,6245
יד מרדכי,12.11.2019,12:49:32,2019-11-12T12:50:00,1,ירי רקטות וטילים,1,6246
נתיב העשרה,12.11.2019,12:49:32,2019-11-12T12:50:00,1,ירי רקטות וטילים,1,6247
ארז,12.11.2019,12:49:53,2019-11-12T12:50:00,1,ירי רקטות וטילים,1,6248
ניר עם,12.11.2019,12:59:25,2019-11-12T12:59:00,1,ירי רקטות וטילים,1,6249
 איבים,12.11.2019,12:59:25,2019-11-12T12:59:00,1,ירי רקטות וטילים,1,6250
שדרות,12.11.2019,12:59:25,2019-11-12T12:59:00,1,ירי רקטות וטילים,1,6250
 מכללת ספיר,12.11.2019,12:59:31,2019-11-12T13:00:00,1,ירי רקטות וטילים,1,6251
גבים,12.11.2019,12:59:31,2019-11-12T13:00:00,1,ירי רקטות וטילים,1,6251
מפלסים,12.11.2019,12:59:31,2019-11-12T13:00:00,1,ירי רקטות וטילים,1,6252
מטווח ניר עם,12.11.2019,12:59:31,2019-11-12T13:00:00,1,ירי רקטות וטילים,1,6253
ניצן,12.11.2019,13:06:33,2019-11-12T13:07:00,1,ירי רקטות וטילים,1,6254
אשדוד - ח,12.11.2019,13:06:38,2019-11-12T13:07:00,1,ירי רקטות וטילים,1,6255
מרינה,12.11.2019,13:06:38,2019-11-12T13:07:00,1,ירי רקטות וטילים,1,6256
אשדוד - יא,12.11.2019,13:06:38,2019-11-12T13:07:00,1,ירי רקטות וטילים,1,6256
כפר מימון ותושיה,12.11.2019,13:57:08,2019-11-12T13:57:00,1,ירי רקטות וטילים,1,6257
בארי,12.11.2019,13:57:28,2019-11-12T13:57:00,1,ירי רקטות וטילים,1,6258
זמרת ושובה,12.11.2019,13:57:28,2019-11-12T13:57:00,1,ירי רקטות וטילים,1,6259
כפר מימון ותושיה,12.11.2019,13:57:28,2019-11-12T13:57:00,1,ירי רקטות וטילים,1,6260
נחל עוז,12.11.2019,13:57:28,2019-11-12T13:57:00,1,ירי רקטות וטילים,1,6261
סעד,12.11.2019,13:57:28,2019-11-12T13:57:00,1,ירי רקטות וטילים,1,6262
עלומים,12.11.2019,13:57:28,2019-11-12T13:57:00,1,ירי רקטות וטילים,1,6263
שוקדה,12.11.2019,13:57:28,2019-11-12T13:57:00,1,ירי רקטות וטילים,1,6264
נתיבות,12.11.2019,14:00:21,2019-11-12T14:00:00,1,ירי רקטות וטילים,1,6265
זמרת ושובה,12.11.2019,14:15:59,2019-11-12T14:16:00,1,ירי רקטות וטילים,1,6266
יושיביה,12.11.2019,14:15:59,2019-11-12T14:16:00,1,ירי רקטות וטילים,1,6267
תקומה,12.11.2019,14:15:59,2019-11-12T14:16:00,1,ירי רקטות וטילים,1,6268
תלמי ביל''ו,12.11.2019,14:15:59,2019-11-12T14:16:00,1,ירי רקטות וטילים,1,6269
סעד,12.11.2019,14:15:59,2019-11-12T14:16:00,1,ירי רקטות וטילים,1,6270
כפר מימון ותושיה,12.11.2019,14:16:11,2019-11-12T14:16:00,1,ירי רקטות וטילים,1,6271
כפר עזה,12.11.2019,14:16:11,2019-11-12T14:16:00,1,ירי רקטות וטילים,1,6272
עלומים,12.11.2019,14:16:11,2019-11-12T14:16:00,1,ירי רקטות וטילים,1,6273
תקומה וחוות יזרעם,12.11.2019,14:16:16,2019-11-12T14:16:00,1,ירי רקטות וטילים,1,6274
נתיבות,12.11.2019,14:16:21,2019-11-12T14:16:00,1,ירי רקטות וטילים,1,6275
תקומה,12.11.2019,14:16:21,2019-11-12T14:16:00,1,ירי רקטות וטילים,1,6276
זמרת ושובה,12.11.2019,14:16:22,2019-11-12T14:16:00,1,ירי רקטות וטילים,1,6277
כרם שלום,12.11.2019,14:29:10,2019-11-12T14:29:00,1,ירי רקטות וטילים,1,6278
כרם שלום,12.11.2019,14:29:31,2019-11-12T14:30:00,1,ירי רקטות וטילים,1,6279
כרם שלום,12.11.2019,14:29:51,2019-11-12T14:30:00,1,ירי רקטות וטילים,1,6280
נחל עוז,12.11.2019,14:31:58,2019-11-12T14:32:00,1,ירי רקטות וטילים,1,6281
סעד,12.11.2019,14:31:58,2019-11-12T14:32:00,1,ירי רקטות וטילים,1,6282
כפר עזה,12.11.2019,14:32:03,2019-11-12T14:32:00,1,ירי רקטות וטילים,1,6283
כרם שלום,12.11.2019,14:43:22,2019-11-12T14:43:00,1,ירי רקטות וטילים,1,6284
נחל עוז,12.11.2019,14:49:34,2019-11-12T14:50:00,1,ירי רקטות וטילים,1,6285
נחל עוז,12.11.2019,15:05:58,2019-11-12T15:06:00,1,ירי רקטות וטילים,1,6286
מבקיעים,12.11.2019,15:48:40,2019-11-12T15:49:00,1,ירי רקטות וטילים,1,6287
ארז,12.11.2019,16:13:00,2019-11-12T16:13:00,1,ירי רקטות וטילים,1,6288
נתיב העשרה,12.11.2019,16:54:00,2019-11-12T16:54:00,1,ירי רקטות וטילים,1,6289
נחל עוז,12.11.2019,16:58:49,2019-11-12T16:59:00,1,ירי רקטות וטילים,1,6290
נחל עוז,12.11.2019,16:59:10,2019-11-12T16:59:00,1,ירי רקטות וטילים,1,6291
ניר עם,12.11.2019,17:29:22,2019-11-12T17:29:00,1,ירי רקטות וטילים,1,6292
נירים,12.11.2019,17:38:44,2019-11-12T17:39:00,1,ירי רקטות וטילים,1,6293
ניר עם,12.11.2019,18:38:25,2019-11-12T18:38:00,1,ירי רקטות וטילים,1,6294
 איבים,12.11.2019,18:38:25,2019-11-12T18:38:00,1,ירי רקטות וטילים,1,6295
שדרות,12.11.2019,18:38:25,2019-11-12T18:38:00,1,ירי רקטות וטילים,1,6295
 מכללת ספיר,12.11.2019,18:38:35,2019-11-12T18:39:00,1,ירי רקטות וטילים,1,6296
גבים,12.11.2019,18:38:35,2019-11-12T18:39:00,1,ירי רקטות וטילים,1,6296
ארז,12.11.2019,18:38:35,2019-11-12T18:39:00,1,ירי רקטות וטילים,1,6297
מפלסים,12.11.2019,18:38:35,2019-11-12T18:39:00,1,ירי רקטות וטילים,1,6298
מטווח ניר עם,12.11.2019,18:38:35,2019-11-12T18:39:00,1,ירי רקטות וטילים,1,6299
ניר עם,12.11.2019,18:38:47,2019-11-12T18:39:00,1,ירי רקטות וטילים,1,6300
כיסופים,12.11.2019,18:49:20,2019-11-12T18:49:00,1,ירי רקטות וטילים,1,6301
נירים,12.11.2019,19:40:40,2019-11-12T19:41:00,1,ירי רקטות וטילים,1,6302
נתיב העשרה,12.11.2019,20:59:35,2019-11-12T21:00:00,1,ירי רקטות וטילים,1,6303
אשקלון,12.11.2019,21:14:38,2019-11-12T21:15:00,1,ירי רקטות וטילים,1,6304
אזור תעשייה הדרומי אשקלון,12.11.2019,21:14:43,2019-11-12T21:15:00,1,ירי רקטות וטילים,1,6305
זיקים,12.11.2019,21:14:43,2019-11-12T21:15:00,1,ירי רקטות וטילים,1,6306
כרמיה,12.11.2019,21:14:43,2019-11-12T21:15:00,1,ירי רקטות וטילים,1,6307
מבקיעים,12.11.2019,21:14:43,2019-11-12T21:15:00,1,ירי רקטות וטילים,1,6308
נתיב העשרה,12.11.2019,21:14:43,2019-11-12T21:15:00,1,ירי רקטות וטילים,1,6309
שדה ניצן,12.11.2019,22:30:09,2019-11-12T22:30:00,1,ירי רקטות וטילים,1,6310
ניר יצחק,12.11.2019,22:30:19,2019-11-12T22:30:00,1,ירי רקטות וטילים,1,6311
סופה,12.11.2019,22:30:25,2019-11-12T22:30:00,1,ירי רקטות וטילים,1,6312
חולית,12.11.2019,22:30:35,2019-11-12T22:31:00,1,ירי רקטות וטילים,1,6313
פרי גן,12.11.2019,22:30:35,2019-11-12T22:31:00,1,ירי רקטות וטילים,1,6314
נירים,12.11.2019,22:40:39,2019-11-12T22:41:00,1,ירי רקטות וטילים,1,6315
עין השלושה,12.11.2019,22:40:39,2019-11-12T22:41:00,1,ירי רקטות וטילים,1,6316
כפר עזה,12.11.2019,22:48:12,2019-11-12T22:48:00,1,ירי רקטות וטילים,1,6317
כפר עזה,12.11.2019,22:48:33,2019-11-12T22:49:00,1,ירי רקטות וטילים,1,6318
נחל עוז,12.11.2019,22:48:33,2019-11-12T22:49:00,1,ירי רקטות וטילים,1,6319
סעד,12.11.2019,22:48:33,2019-11-12T22:49:00,1,ירי רקטות וטילים,1,6320
כפר עזה,12.11.2019,22:49:00,2019-11-12T22:49:00,1,ירי רקטות וטילים,1,6321
סעד,12.11.2019,22:49:00,2019-11-12T22:49:00,1,ירי רקטות וטילים,1,6322
נחל עוז,12.11.2019,22:49:05,2019-11-12T22:49:00,1,ירי רקטות וטילים,1,6323
כפר עזה,12.11.2019,22:49:21,2019-11-12T22:49:00,1,ירי רקטות וטילים,1,6324
כרם שלום,13.11.2019,05:53:58,2019-11-13T05:54:00,1,ירי רקטות וטילים,1,6325
כרם שלום,13.11.2019,06:00:21,2019-11-13T06:00:00,1,ירי רקטות וטילים,1,6326
כפר מימון ותושיה,13.11.2019,06:03:57,2019-11-13T06:04:00,1,ירי רקטות וטילים,1,6327
שוקדה,13.11.2019,06:03:57,2019-11-13T06:04:00,1,ירי רקטות וטילים,1,6328
בארי,13.11.2019,06:04:07,2019-11-13T06:04:00,1,ירי רקטות וטילים,1,6329
זמרת ושובה,13.11.2019,06:04:07,2019-11-13T06:04:00,1,ירי רקטות וטילים,1,6330
עלומים,13.11.2019,06:04:07,2019-11-13T06:04:00,1,ירי רקטות וטילים,1,6331
כפר מימון ותושיה,13.11.2019,06:04:18,2019-11-13T06:04:00,1,ירי רקטות וטילים,1,6332
מבוא חורון,13.11.2019,06:28:42,2019-11-13T06:29:00,1,ירי רקטות וטילים,1,6333
הראל,13.11.2019,06:28:42,2019-11-13T06:29:00,1,ירי רקטות וטילים,1,6334
לטרון,13.11.2019,06:28:42,2019-11-13T06:29:00,1,ירי רקטות וטילים,1,6335
נווה שלום,13.11.2019,06:28:42,2019-11-13T06:29:00,1,ירי רקטות וטילים,1,6336
תעוז,13.11.2019,06:28:42,2019-11-13T06:29:00,1,ירי רקטות וטילים,1,6337
גיזו,13.11.2019,06:28:47,2019-11-13T06:29:00,1,ירי רקטות וטילים,1,6338
כפר אוריה,13.11.2019,06:28:47,2019-11-13T06:29:00,1,ירי רקטות וטילים,1,6339
נחשון,13.11.2019,06:28:47,2019-11-13T06:29:00,1,ירי רקטות וטילים,1,6340
בקוע,13.11.2019,06:29:43,2019-11-13T06:30:00,1,ירי רקטות וטילים,1,6341
טל שחר,13.11.2019,06:29:43,2019-11-13T06:30:00,1,ירי רקטות וטילים,1,6342
צלפון,13.11.2019,06:29:43,2019-11-13T06:30:00,1,ירי רקטות וטילים,1,6343
בית הגדי,13.11.2019,06:41:08,2019-11-13T06:41:00,1,ירי רקטות וטילים,1,6344
נתיבות,13.11.2019,06:41:08,2019-11-13T06:41:00,1,ירי רקטות וטילים,1,6345
זמרת ושובה,13.11.2019,06:41:18,2019-11-13T06:41:00,1,ירי רקטות וטילים,1,6346
כפר מימון ותושיה,13.11.2019,06:41:18,2019-11-13T06:41:00,1,ירי רקטות וטילים,1,6347
תקומה וחוות יזרעם,13.11.2019,06:41:18,2019-11-13T06:41:00,1,ירי רקטות וטילים,1,6348
תקומה,13.11.2019,06:41:18,2019-11-13T06:41:00,1,ירי רקטות וטילים,1,6349
יושיביה,13.11.2019,06:41:36,2019-11-13T06:42:00,1,ירי רקטות וטילים,1,6350
שרשרת,13.11.2019,06:41:36,2019-11-13T06:42:00,1,ירי רקטות וטילים,1,6351
נתיבות,13.11.2019,06:43:02,2019-11-13T06:43:00,1,ירי רקטות וטילים,1,6352
שרשרת,13.11.2019,06:43:12,2019-11-13T06:43:00,1,ירי רקטות וטילים,1,6353
מעגלים גבעולים מלילות,13.11.2019,06:43:23,2019-11-13T06:43:00,1,ירי רקטות וטילים,1,6354
בית הגדי,13.11.2019,06:43:28,2019-11-13T06:43:00,1,ירי רקטות וטילים,1,6355
זמרת ושובה,13.11.2019,06:43:28,2019-11-13T06:43:00,1,ירי רקטות וטילים,1,6356
כפר מימון ותושיה,13.11.2019,06:43:28,2019-11-13T06:43:00,1,ירי רקטות וטילים,1,6357
תקומה וחוות יזרעם,13.11.2019,06:43:28,2019-11-13T06:43:00,1,ירי רקטות וטילים,1,6358
תקומה,13.11.2019,06:43:28,2019-11-13T06:43:00,1,ירי רקטות וטילים,1,6359
נתיבות,13.11.2019,06:43:39,2019-11-13T06:44:00,1,ירי רקטות וטילים,1,6360
בית שקמה,13.11.2019,07:05:21,2019-11-13T07:05:00,1,ירי רקטות וטילים,1,6361
גיאה,13.11.2019,07:05:21,2019-11-13T07:05:00,1,ירי רקטות וטילים,1,6362
אזור תעשייה הדרומי אשקלון,13.11.2019,07:05:21,2019-11-13T07:05:00,1,ירי רקטות וטילים,1,6363
זיקים,13.11.2019,07:05:31,2019-11-13T07:06:00,1,ירי רקטות וטילים,1,6364
נתיב העשרה,13.11.2019,07:05:31,2019-11-13T07:06:00,1,ירי רקטות וטילים,1,6365
יד מרדכי,13.11.2019,07:05:31,2019-11-13T07:06:00,1,ירי רקטות וטילים,1,6366
כרמיה,13.11.2019,07:05:31,2019-11-13T07:06:00,1,ירי רקטות וטילים,1,6367
מבקיעים,13.11.2019,07:05:31,2019-11-13T07:06:00,1,ירי רקטות וטילים,1,6368
נחל עוז,13.11.2019,07:28:22,2019-11-13T07:28:00,1,ירי רקטות וטילים,1,6369
בית עזרא,13.11.2019,07:29:13,2019-11-13T07:29:00,1,ירי רקטות וטילים,1,6370
ניצן,13.11.2019,07:29:13,2019-11-13T07:29:00,1,ירי רקטות וטילים,1,6371
ניצנים,13.11.2019,07:29:13,2019-11-13T07:29:00,1,ירי רקטות וטילים,1,6372
אזור תעשייה הדרומי אשקלון,13.11.2019,07:29:24,2019-11-13T07:29:00,1,ירי רקטות וטילים,1,6373
זיקים,13.11.2019,07:29:24,2019-11-13T07:29:00,1,ירי רקטות וטילים,1,6374
יד מרדכי,13.11.2019,07:29:24,2019-11-13T07:29:00,1,ירי רקטות וטילים,1,6375
כרמיה,13.11.2019,07:29:24,2019-11-13T07:29:00,1,ירי רקטות וטילים,1,6376
מבקיעים,13.11.2019,07:29:24,2019-11-13T07:29:00,1,ירי רקטות וטילים,1,6377
נתיב העשרה,13.11.2019,07:29:24,2019-11-13T07:29:00,1,ירי רקטות וטילים,1,6378
באר גנים,13.11.2019,07:29:29,2019-11-13T07:29:00,1,ירי רקטות וטילים,1,6379
אשקלון,13.11.2019,07:29:40,2019-11-13T07:30:00,1,ירי רקטות וטילים,1,6380
ניר ישראל,13.11.2019,07:29:40,2019-11-13T07:30:00,1,ירי רקטות וטילים,1,6381
נחל עוז,13.11.2019,07:30:01,2019-11-13T07:30:00,1,ירי רקטות וטילים,1,6382
 איבים,13.11.2019,07:54:52,2019-11-13T07:55:00,1,ירי רקטות וטילים,1,6383
שדרות,13.11.2019,07:54:52,2019-11-13T07:55:00,1,ירי רקטות וטילים,1,6383
ניר עם,13.11.2019,07:55:07,2019-11-13T07:55:00,1,ירי רקטות וטילים,1,6384
ארז,13.11.2019,07:55:07,2019-11-13T07:55:00,1,ירי רקטות וטילים,1,6385
מטווח ניר עם,13.11.2019,07:55:07,2019-11-13T07:55:00,1,ירי רקטות וטילים,1,6386
מפלסים,13.11.2019,07:55:13,2019-11-13T07:55:00,1,ירי רקטות וטילים,1,6387
שדרות,13.11.2019,07:55:18,2019-11-13T07:55:00,1,ירי רקטות וטילים,1,6388
 איבים,13.11.2019,07:55:18,2019-11-13T07:55:00,1,ירי רקטות וטילים,1,6388
נחל עוז,13.11.2019,07:59:01,2019-11-13T07:59:00,1,ירי רקטות וטילים,1,6389
נחל עוז,13.11.2019,08:01:22,2019-11-13T08:01:00,1,ירי רקטות וטילים,1,6390
נחל עוז,13.11.2019,08:01:42,2019-11-13T08:02:00,1,ירי רקטות וטילים,1,6391
כיסופים,13.11.2019,08:04:59,2019-11-13T08:05:00,1,ירי רקטות וטילים,1,6392
עין השלושה,13.11.2019,08:05:09,2019-11-13T08:05:00,1,ירי רקטות וטילים,1,6393
כיסופים,13.11.2019,08:05:26,2019-11-13T08:05:00,1,ירי רקטות וטילים,1,6394
כיסופים,13.11.2019,08:07:32,2019-11-13T08:08:00,1,ירי רקטות וטילים,1,6395
עין השלושה,13.11.2019,08:07:37,2019-11-13T08:08:00,1,ירי רקטות וטילים,1,6396
כיסופים,13.11.2019,08:07:58,2019-11-13T08:08:00,1,ירי רקטות וטילים,1,6397
חולדה,13.11.2019,08:10:31,2019-11-13T08:11:00,1,ירי רקטות וטילים,1,6398
יסודות,13.11.2019,08:10:31,2019-11-13T08:11:00,1,ירי רקטות וטילים,1,6399
כפר בן נון,13.11.2019,08:10:31,2019-11-13T08:11:00,1,ירי רקטות וטילים,1,6400
כרמי יוסף,13.11.2019,08:10:31,2019-11-13T08:11:00,1,ירי רקטות וטילים,1,6401
משמר איילון,13.11.2019,08:10:31,2019-11-13T08:11:00,1,ירי רקטות וטילים,1,6402
משמר דוד,13.11.2019,08:10:31,2019-11-13T08:11:00,1,ירי רקטות וטילים,1,6403
נצר חזני,13.11.2019,08:10:31,2019-11-13T08:11:00,1,ירי רקטות וטילים,1,6404
בית חלקיה,13.11.2019,08:11:37,2019-11-13T08:12:00,1,ירי רקטות וטילים,1,6405
חפץ חיים,13.11.2019,08:11:37,2019-11-13T08:12:00,1,ירי רקטות וטילים,1,6406
יד בנימין,13.11.2019,08:11:37,2019-11-13T08:12:00,1,ירי רקטות וטילים,1,6407
רבדים,13.11.2019,08:11:37,2019-11-13T08:12:00,1,ירי רקטות וטילים,1,6408
 מכללת ספיר,13.11.2019,09:22:44,2019-11-13T09:23:00,1,ירי רקטות וטילים,1,6409
גבים,13.11.2019,09:22:44,2019-11-13T09:23:00,1,ירי רקטות וטילים,1,6409
ניר עם,13.11.2019,09:22:44,2019-11-13T09:23:00,1,ירי רקטות וטילים,1,6410
 איבים,13.11.2019,09:22:44,2019-11-13T09:23:00,1,ירי רקטות וטילים,1,6411
שדרות,13.11.2019,09:22:44,2019-11-13T09:23:00,1,ירי רקטות וטילים,1,6411
מפלסים,13.11.2019,09:22:44,2019-11-13T09:23:00,1,ירי רקטות וטילים,1,6412
מטווח ניר עם,13.11.2019,09:22:49,2019-11-13T09:23:00,1,ירי רקטות וטילים,1,6413
יכיני,13.11.2019,09:22:49,2019-11-13T09:23:00,1,ירי רקטות וטילים,1,6414
ניר משה,13.11.2019,09:22:49,2019-11-13T09:23:00,1,ירי רקטות וטילים,1,6415
ניר עקיבא,13.11.2019,09:22:49,2019-11-13T09:23:00,1,ירי רקטות וטילים,1,6416
 מכללת ספיר,13.11.2019,09:23:05,2019-11-13T09:23:00,1,ירי רקטות וטילים,1,6417
גבים,13.11.2019,09:23:05,2019-11-13T09:23:00,1,ירי רקטות וטילים,1,6417
ניר עם,13.11.2019,09:23:05,2019-11-13T09:23:00,1,ירי רקטות וטילים,1,6418
אשקלון,13.11.2019,09:37:55,2019-11-13T09:38:00,1,ירי רקטות וטילים,1,6419
זיקים,13.11.2019,09:42:58,2019-11-13T09:43:00,1,ירי רקטות וטילים,1,6420
נתיב העשרה,13.11.2019,09:42:58,2019-11-13T09:43:00,1,ירי רקטות וטילים,1,6421
אשקלון,13.11.2019,09:42:58,2019-11-13T09:43:00,1,ירי רקטות וטילים,1,6422
אזור תעשייה הדרומי אשקלון,13.11.2019,09:42:58,2019-11-13T09:43:00,1,ירי רקטות וטילים,1,6423
מבקיעים,13.11.2019,09:43:04,2019-11-13T09:43:00,1,ירי רקטות וטילים,1,6424
זיקים,13.11.2019,09:43:19,2019-11-13T09:43:00,1,ירי רקטות וטילים,1,6425
יד מרדכי,13.11.2019,09:43:19,2019-11-13T09:43:00,1,ירי רקטות וטילים,1,6426
כרמיה,13.11.2019,09:43:19,2019-11-13T09:43:00,1,ירי רקטות וטילים,1,6427
נתיב העשרה,13.11.2019,09:43:19,2019-11-13T09:43:00,1,ירי רקטות וטילים,1,6428
אזור תעשייה הדרומי אשקלון,13.11.2019,09:43:29,2019-11-13T09:43:00,1,ירי רקטות וטילים,1,6429
זיקים,13.11.2019,09:43:40,2019-11-13T09:44:00,1,ירי רקטות וטילים,1,6430
זיקים,13.11.2019,09:44:12,2019-11-13T09:44:00,1,ירי רקטות וטילים,1,6431
כיסופים,13.11.2019,10:20:49,2019-11-13T10:21:00,1,ירי רקטות וטילים,1,6432
נחל עוז,13.11.2019,10:21:04,2019-11-13T10:21:00,1,ירי רקטות וטילים,1,6433
מבטחים עמיעוז ישע,13.11.2019,10:30:38,2019-11-13T10:31:00,1,ירי רקטות וטילים,1,6434
צוחר ואוהד,13.11.2019,10:30:38,2019-11-13T10:31:00,1,ירי רקטות וטילים,1,6435
שדה ניצן,13.11.2019,10:30:43,2019-11-13T10:31:00,1,ירי רקטות וטילים,1,6436
תלמי אליהו,13.11.2019,10:30:44,2019-11-13T10:31:00,1,ירי רקטות וטילים,1,6437
מבטחים עמיעוז ישע,13.11.2019,10:40:31,2019-11-13T10:41:00,1,ירי רקטות וטילים,1,6438
כרם שלום,13.11.2019,10:57:31,2019-11-13T10:58:00,1,ירי רקטות וטילים,1,6439
 איבים,13.11.2019,10:57:36,2019-11-13T10:58:00,1,ירי רקטות וטילים,1,6440
שדרות,13.11.2019,10:57:36,2019-11-13T10:58:00,1,ירי רקטות וטילים,1,6440
שדרות,13.11.2019,10:57:58,2019-11-13T10:58:00,1,ירי רקטות וטילים,1,6441
 איבים,13.11.2019,10:57:58,2019-11-13T10:58:00,1,ירי רקטות וטילים,1,6441
ניר עם,13.11.2019,10:58:04,2019-11-13T10:58:00,1,ירי רקטות וטילים,1,6442
ארז,13.11.2019,10:58:04,2019-11-13T10:58:00,1,ירי רקטות וטילים,1,6443
מטווח ניר עם,13.11.2019,10:58:04,2019-11-13T10:58:00,1,ירי רקטות וטילים,1,6444
 איבים,13.11.2019,11:01:31,2019-11-13T11:02:00,1,ירי רקטות וטילים,1,6445
שדרות,13.11.2019,11:01:31,2019-11-13T11:02:00,1,ירי רקטות וטילים,1,6445
ניר עם,13.11.2019,11:01:41,2019-11-13T11:02:00,1,ירי רקטות וטילים,1,6446
ארז,13.11.2019,11:01:41,2019-11-13T11:02:00,1,ירי רקטות וטילים,1,6447
מטווח ניר עם,13.11.2019,11:01:41,2019-11-13T11:02:00,1,ירי רקטות וטילים,1,6448
 איבים,13.11.2019,11:01:52,2019-11-13T11:02:00,1,ירי רקטות וטילים,1,6449
שדרות,13.11.2019,11:01:52,2019-11-13T11:02:00,1,ירי רקטות וטילים,1,6449
 איבים,13.11.2019,11:02:13,2019-11-13T11:02:00,1,ירי רקטות וטילים,1,6450
שדרות,13.11.2019,11:02:13,2019-11-13T11:02:00,1,ירי רקטות וטילים,1,6450
ניר עם,13.11.2019,11:02:20,2019-11-13T11:02:00,1,ירי רקטות וטילים,1,6451
ארז,13.11.2019,11:02:20,2019-11-13T11:02:00,1,ירי רקטות וטילים,1,6452
מטווח ניר עם,13.11.2019,11:02:20,2019-11-13T11:02:00,1,ירי רקטות וטילים,1,6453
 איבים,13.11.2019,11:02:35,2019-11-13T11:03:00,1,ירי רקטות וטילים,1,6454
שדרות,13.11.2019,11:02:35,2019-11-13T11:03:00,1,ירי רקטות וטילים,1,6454
כרמיה,13.11.2019,11:04:22,2019-11-13T11:04:00,1,ירי רקטות וטילים,1,6455
אשקלון,13.11.2019,11:04:22,2019-11-13T11:04:00,1,ירי רקטות וטילים,1,6456
אזור תעשייה הדרומי אשקלון,13.11.2019,11:04:22,2019-11-13T11:04:00,1,ירי רקטות וטילים,1,6457
כיסופים,13.11.2019,11:04:38,2019-11-13T11:05:00,1,ירי רקטות וטילים,1,6458
זיקים,13.11.2019,11:04:38,2019-11-13T11:05:00,1,ירי רקטות וטילים,1,6459
מבקיעים,13.11.2019,11:04:38,2019-11-13T11:05:00,1,ירי רקטות וטילים,1,6460
עין השלושה,13.11.2019,11:04:44,2019-11-13T11:05:00,1,ירי רקטות וטילים,1,6461
נירים,13.11.2019,11:05:47,2019-11-13T11:06:00,1,ירי רקטות וטילים,1,6462
עין השלושה,13.11.2019,11:05:47,2019-11-13T11:06:00,1,ירי רקטות וטילים,1,6463
כיסופים,13.11.2019,11:05:57,2019-11-13T11:06:00,1,ירי רקטות וטילים,1,6464
עין השלושה,13.11.2019,11:06:08,2019-11-13T11:06:00,1,ירי רקטות וטילים,1,6465
נירים,13.11.2019,11:06:08,2019-11-13T11:06:00,1,ירי רקטות וטילים,1,6466
כרם שלום,13.11.2019,11:17:04,2019-11-13T11:17:00,1,ירי רקטות וטילים,1,6467
צוחר ואוהד,13.11.2019,11:17:14,2019-11-13T11:17:00,1,ירי רקטות וטילים,1,6468
שדה ניצן,13.11.2019,11:17:14,2019-11-13T11:17:00,1,ירי רקטות וטילים,1,6469
תלמי אליהו,13.11.2019,11:17:14,2019-11-13T11:17:00,1,ירי רקטות וטילים,1,6470
כרם שלום,13.11.2019,11:17:25,2019-11-13T11:17:00,1,ירי רקטות וטילים,1,6471
מבטחים עמיעוז ישע,13.11.2019,11:17:25,2019-11-13T11:17:00,1,ירי רקטות וטילים,1,6472
נירים,13.11.2019,11:24:03,2019-11-13T11:24:00,1,ירי רקטות וטילים,1,6473
יתד,13.11.2019,11:30:51,2019-11-13T11:31:00,1,ירי רקטות וטילים,1,6474
שדה אברהם,13.11.2019,11:30:51,2019-11-13T11:31:00,1,ירי רקטות וטילים,1,6475
חולית,13.11.2019,11:30:56,2019-11-13T11:31:00,1,ירי רקטות וטילים,1,6476
כרם שלום,13.11.2019,11:30:56,2019-11-13T11:31:00,1,ירי רקטות וטילים,1,6477
סופה,13.11.2019,11:30:56,2019-11-13T11:31:00,1,ירי רקטות וטילים,1,6478
סופה,13.11.2019,11:43:01,2019-11-13T11:43:00,1,ירי רקטות וטילים,1,6479
כרם שלום,13.11.2019,12:05:00,2019-11-13T12:05:00,1,ירי רקטות וטילים,1,6480
כרם שלום,13.11.2019,12:05:20,2019-11-13T12:05:00,1,ירי רקטות וטילים,1,6481
חולית,13.11.2019,12:28:15,2019-11-13T12:28:00,1,ירי רקטות וטילים,1,6482
סופה,13.11.2019,12:28:21,2019-11-13T12:28:00,1,ירי רקטות וטילים,1,6483
חולית,13.11.2019,12:28:32,2019-11-13T12:29:00,1,ירי רקטות וטילים,1,6484
צוחר ואוהד,13.11.2019,12:49:35,2019-11-13T12:50:00,1,ירי רקטות וטילים,1,6485
שדה ניצן,13.11.2019,12:49:35,2019-11-13T12:50:00,1,ירי רקטות וטילים,1,6486
מבטחים עמיעוז ישע,13.11.2019,12:49:35,2019-11-13T12:50:00,1,ירי רקטות וטילים,1,6487
כיסופים,13.11.2019,13:02:19,2019-11-13T13:02:00,1,ירי רקטות וטילים,1,6488
עין השלושה,13.11.2019,13:02:24,2019-11-13T13:02:00,1,ירי רקטות וטילים,1,6489
כיסופים,13.11.2019,13:03:11,2019-11-13T13:03:00,1,ירי רקטות וטילים,1,6490
עין השלושה,13.11.2019,13:03:17,2019-11-13T13:03:00,1,ירי רקטות וטילים,1,6491
עין השלושה,13.11.2019,13:04:54,2019-11-13T13:05:00,1,ירי רקטות וטילים,1,6492
כיסופים,13.11.2019,13:04:54,2019-11-13T13:05:00,1,ירי רקטות וטילים,1,6493
עין השלושה,13.11.2019,13:06:00,2019-11-13T13:06:00,1,ירי רקטות וטילים,1,6494
נחל עוז,13.11.2019,13:13:29,2019-11-13T13:13:00,1,ירי רקטות וטילים,1,6495
גבים,13.11.2019,13:13:35,2019-11-13T13:14:00,1,ירי רקטות וטילים,1,6496
 מכללת ספיר,13.11.2019,13:13:35,2019-11-13T13:14:00,1,ירי רקטות וטילים,1,6496
ניר עם,13.11.2019,13:13:35,2019-11-13T13:14:00,1,ירי רקטות וטילים,1,6497
 איבים,13.11.2019,13:13:35,2019-11-13T13:14:00,1,ירי רקטות וטילים,1,6498
שדרות,13.11.2019,13:13:35,2019-11-13T13:14:00,1,ירי רקטות וטילים,1,6498
מפלסים,13.11.2019,13:13:35,2019-11-13T13:14:00,1,ירי רקטות וטילים,1,6499
מטווח ניר עם,13.11.2019,13:13:35,2019-11-13T13:14:00,1,ירי רקטות וטילים,1,6500
יכיני,13.11.2019,13:13:50,2019-11-13T13:14:00,1,ירי רקטות וטילים,1,6501
ניר משה,13.11.2019,13:13:50,2019-11-13T13:14:00,1,ירי רקטות וטילים,1,6502
 מכללת ספיר,13.11.2019,13:13:55,2019-11-13T13:14:00,1,ירי רקטות וטילים,1,6503
גבים,13.11.2019,13:13:55,2019-11-13T13:14:00,1,ירי רקטות וטילים,1,6503
 איבים,13.11.2019,13:13:55,2019-11-13T13:14:00,1,ירי רקטות וטילים,1,6504
שדרות,13.11.2019,13:13:55,2019-11-13T13:14:00,1,ירי רקטות וטילים,1,6504
ניר עם,13.11.2019,13:14:01,2019-11-13T13:14:00,1,ירי רקטות וטילים,1,6505
כפר עזה,13.11.2019,13:14:01,2019-11-13T13:14:00,1,ירי רקטות וטילים,1,6506
מפלסים,13.11.2019,13:14:01,2019-11-13T13:14:00,1,ירי רקטות וטילים,1,6507
מטווח ניר עם,13.11.2019,13:14:01,2019-11-13T13:14:00,1,ירי רקטות וטילים,1,6508
נירים,13.11.2019,13:18:04,2019-11-13T13:18:00,1,ירי רקטות וטילים,1,6509
עין השלושה,13.11.2019,13:18:04,2019-11-13T13:18:00,1,ירי רקטות וטילים,1,6510
ניר עוז,13.11.2019,13:18:09,2019-11-13T13:18:00,1,ירי רקטות וטילים,1,6511
נירים,13.11.2019,13:18:25,2019-11-13T13:18:00,1,ירי רקטות וטילים,1,6512
עין השלושה,13.11.2019,13:18:25,2019-11-13T13:18:00,1,ירי רקטות וטילים,1,6513
ניר עוז,13.11.2019,13:18:30,2019-11-13T13:19:00,1,ירי רקטות וטילים,1,6514
חולית,13.11.2019,13:27:59,2019-11-13T13:28:00,1,ירי רקטות וטילים,1,6515
אשקלון,13.11.2019,13:37:06,2019-11-13T13:37:00,1,ירי רקטות וטילים,1,6516
אזור תעשייה הדרומי אשקלון,13.11.2019,13:37:06,2019-11-13T13:37:00,1,ירי רקטות וטילים,1,6517
זיקים,13.11.2019,13:37:06,2019-11-13T13:37:00,1,ירי רקטות וטילים,1,6518
כיסופים,13.11.2019,13:42:33,2019-11-13T13:43:00,1,ירי רקטות וטילים,1,6519
עין השלושה,13.11.2019,13:42:38,2019-11-13T13:43:00,1,ירי רקטות וטילים,1,6520
ניר עם,13.11.2019,13:54:52,2019-11-13T13:55:00,1,ירי רקטות וטילים,1,6521
שדרות,13.11.2019,13:54:52,2019-11-13T13:55:00,1,ירי רקטות וטילים,1,6522
 איבים,13.11.2019,13:54:52,2019-11-13T13:55:00,1,ירי רקטות וטילים,1,6522
 מכללת ספיר,13.11.2019,13:55:02,2019-11-13T13:55:00,1,ירי רקטות וטילים,1,6523
גבים,13.11.2019,13:55:02,2019-11-13T13:55:00,1,ירי רקטות וטילים,1,6523
מפלסים,13.11.2019,13:55:02,2019-11-13T13:55:00,1,ירי רקטות וטילים,1,6524
מטווח ניר עם,13.11.2019,13:55:02,2019-11-13T13:55:00,1,ירי רקטות וטילים,1,6525
כיסופים,13.11.2019,14:19:30,2019-11-13T14:20:00,1,ירי רקטות וטילים,1,6526
עין השלושה,13.11.2019,14:19:30,2019-11-13T14:20:00,1,ירי רקטות וטילים,1,6527
כרם שלום,13.11.2019,14:32:25,2019-11-13T14:32:00,1,ירי רקטות וטילים,1,6528
כרם שלום,13.11.2019,14:33:11,2019-11-13T14:33:00,1,ירי רקטות וטילים,1,6529
נחל עוז,13.11.2019,14:35:38,2019-11-13T14:36:00,1,ירי רקטות וטילים,1,6530
נחל עוז,13.11.2019,14:35:59,2019-11-13T14:36:00,1,ירי רקטות וטילים,1,6531
יד מרדכי,13.11.2019,14:40:27,2019-11-13T14:40:00,1,ירי רקטות וטילים,1,6532
נתיב העשרה,13.11.2019,14:40:27,2019-11-13T14:40:00,1,ירי רקטות וטילים,1,6533
כרם שלום,13.11.2019,14:40:27,2019-11-13T14:40:00,1,ירי רקטות וטילים,1,6534
כרם שלום,13.11.2019,14:40:47,2019-11-13T14:41:00,1,ירי רקטות וטילים,1,6535
סעד,13.11.2019,14:59:24,2019-11-13T14:59:00,1,ירי רקטות וטילים,1,6536
כפר עזה,13.11.2019,15:27:02,2019-11-13T15:27:00,1,ירי רקטות וטילים,1,6537
סעד,13.11.2019,15:27:02,2019-11-13T15:27:00,1,ירי רקטות וטילים,1,6538
סעד,13.11.2019,15:27:22,2019-11-13T15:27:00,1,ירי רקטות וטילים,1,6539
אשקלון,13.11.2019,15:33:45,2019-11-13T15:34:00,1,ירי רקטות וטילים,1,6540
אזור תעשייה הדרומי אשקלון,13.11.2019,15:33:45,2019-11-13T15:34:00,1,ירי רקטות וטילים,1,6541
סעד,13.11.2019,15:36:48,2019-11-13T15:37:00,1,ירי רקטות וטילים,1,6542
כפר מימון ותושיה,13.11.2019,15:43:40,2019-11-13T15:44:00,1,ירי רקטות וטילים,1,6543
כפר עזה,13.11.2019,15:43:40,2019-11-13T15:44:00,1,ירי רקטות וטילים,1,6544
נחל עוז,13.11.2019,15:43:40,2019-11-13T15:44:00,1,ירי רקטות וטילים,1,6545
עלומים,13.11.2019,15:43:40,2019-11-13T15:44:00,1,ירי רקטות וטילים,1,6546
זמרת ושובה,13.11.2019,15:43:40,2019-11-13T15:44:00,1,ירי רקטות וטילים,1,6547
סעד,13.11.2019,15:43:40,2019-11-13T15:44:00,1,ירי רקטות וטילים,1,6548
תקומה וחוות יזרעם,13.11.2019,15:43:51,2019-11-13T15:44:00,1,ירי רקטות וטילים,1,6549
תקומה,13.11.2019,15:43:51,2019-11-13T15:44:00,1,ירי רקטות וטילים,1,6550
נתיבות,13.11.2019,15:43:51,2019-11-13T15:44:00,1,ירי רקטות וטילים,1,6551
זמרת ושובה,13.11.2019,15:44:01,2019-11-13T15:44:00,1,ירי רקטות וטילים,1,6552
ניר יצחק,13.11.2019,15:56:51,2019-11-13T15:57:00,1,ירי רקטות וטילים,1,6553
סופה,13.11.2019,15:56:51,2019-11-13T15:57:00,1,ירי רקטות וטילים,1,6554
פרי גן,13.11.2019,15:56:51,2019-11-13T15:57:00,1,ירי רקטות וטילים,1,6555
כרם שלום,13.11.2019,15:56:57,2019-11-13T15:57:00,1,ירי רקטות וטילים,1,6556
חולית,13.11.2019,15:57:02,2019-11-13T15:57:00,1,ירי רקטות וטילים,1,6557
יתד,13.11.2019,15:57:02,2019-11-13T15:57:00,1,ירי רקטות וטילים,1,6558
שדה אברהם,13.11.2019,15:57:02,2019-11-13T15:57:00,1,ירי רקטות וטילים,1,6559
פרי גן,13.11.2019,15:57:13,2019-11-13T15:57:00,1,ירי רקטות וטילים,1,6560
סופה,13.11.2019,16:00:05,2019-11-13T16:00:00,1,ירי רקטות וטילים,1,6561
ניר יצחק,13.11.2019,16:00:10,2019-11-13T16:00:00,1,ירי רקטות וטילים,1,6562
פרי גן,13.11.2019,16:00:10,2019-11-13T16:00:00,1,ירי רקטות וטילים,1,6563
שדה אברהם,13.11.2019,16:00:21,2019-11-13T16:00:00,1,ירי רקטות וטילים,1,6564
נחל עוז,13.11.2019,16:13:30,2019-11-13T16:14:00,1,ירי רקטות וטילים,1,6565
נחל עוז,13.11.2019,16:13:55,2019-11-13T16:14:00,1,ירי רקטות וטילים,1,6566
נחל עוז,13.11.2019,16:14:11,2019-11-13T16:14:00,1,ירי רקטות וטילים,1,6567
נחל עוז,13.11.2019,16:14:33,2019-11-13T16:15:00,1,ירי רקטות וטילים,1,6568
חולית,13.11.2019,16:24:01,2019-11-13T16:24:00,1,ירי רקטות וטילים,1,6569
ניר יצחק,13.11.2019,16:24:01,2019-11-13T16:24:00,1,ירי רקטות וטילים,1,6570
סופה,13.11.2019,16:24:01,2019-11-13T16:24:00,1,ירי רקטות וטילים,1,6571
פרי גן,13.11.2019,16:24:01,2019-11-13T16:24:00,1,ירי רקטות וטילים,1,6572
זמרת ושובה,13.11.2019,16:31:40,2019-11-13T16:32:00,1,ירי רקטות וטילים,1,6573
בארי,13.11.2019,16:31:45,2019-11-13T16:32:00,1,ירי רקטות וטילים,1,6574
נחל עוז,13.11.2019,16:31:45,2019-11-13T16:32:00,1,ירי רקטות וטילים,1,6575
עלומים,13.11.2019,16:31:45,2019-11-13T16:32:00,1,ירי רקטות וטילים,1,6576
שוקדה,13.11.2019,16:31:45,2019-11-13T16:32:00,1,ירי רקטות וטילים,1,6577
זמרת ושובה,13.11.2019,16:32:00,2019-11-13T16:32:00,1,ירי רקטות וטילים,1,6578
כפר מימון ותושיה,13.11.2019,16:32:06,2019-11-13T16:32:00,1,ירי רקטות וטילים,1,6579
חולית,13.11.2019,16:41:00,2019-11-13T16:41:00,1,ירי רקטות וטילים,1,6580
ניר יצחק,13.11.2019,16:41:00,2019-11-13T16:41:00,1,ירי רקטות וטילים,1,6581
סופה,13.11.2019,16:41:00,2019-11-13T16:41:00,1,ירי רקטות וטילים,1,6582
פרי גן,13.11.2019,16:41:00,2019-11-13T16:41:00,1,ירי רקטות וטילים,1,6583
נתיב העשרה,13.11.2019,16:52:05,2019-11-13T16:52:00,1,ירי רקטות וטילים,1,6584
נתיב העשרה,13.11.2019,16:52:25,2019-11-13T16:52:00,1,ירי רקטות וטילים,1,6585
 איבים,13.11.2019,16:54:27,2019-11-13T16:54:00,1,ירי רקטות וטילים,1,6586
שדרות,13.11.2019,16:54:27,2019-11-13T16:54:00,1,ירי רקטות וטילים,1,6586
ניר עוז,13.11.2019,16:58:23,2019-11-13T16:58:00,1,ירי רקטות וטילים,1,6587
ניר עוז,13.11.2019,17:00:25,2019-11-13T17:00:00,1,ירי רקטות וטילים,1,6588
נירים,13.11.2019,17:00:35,2019-11-13T17:01:00,1,ירי רקטות וטילים,1,6589
עין השלושה,13.11.2019,17:00:35,2019-11-13T17:01:00,1,ירי רקטות וטילים,1,6590
ניר עוז,13.11.2019,17:00:52,2019-11-13T17:01:00,1,ירי רקטות וטילים,1,6591
נחל עוז,13.11.2019,17:01:54,2019-11-13T17:02:00,1,ירי רקטות וטילים,1,6592
נחל עוז,13.11.2019,17:02:15,2019-11-13T17:02:00,1,ירי רקטות וטילים,1,6593
נחל עוז,13.11.2019,17:02:36,2019-11-13T17:03:00,1,ירי רקטות וטילים,1,6594
נחל עוז,13.11.2019,17:03:02,2019-11-13T17:03:00,1,ירי רקטות וטילים,1,6595
נתיב העשרה,13.11.2019,17:13:05,2019-11-13T17:13:00,1,ירי רקטות וטילים,1,6596
זיקים,13.11.2019,18:06:57,2019-11-13T18:07:00,1,ירי רקטות וטילים,1,6597
נתיב העשרה,13.11.2019,18:07:07,2019-11-13T18:07:00,1,ירי רקטות וטילים,1,6598
זיקים,13.11.2019,18:09:10,2019-11-13T18:09:00,1,ירי רקטות וטילים,1,6599
אזור תעשייה הדרומי אשקלון,13.11.2019,18:09:15,2019-11-13T18:09:00,1,ירי רקטות וטילים,1,6600
זיקים,13.11.2019,18:09:26,2019-11-13T18:09:00,1,ירי רקטות וטילים,1,6601
נתיב העשרה,13.11.2019,18:09:26,2019-11-13T18:09:00,1,ירי רקטות וטילים,1,6602
נחל עוז,13.11.2019,18:21:11,2019-11-13T18:21:00,1,ירי רקטות וטילים,1,6603
מבטחים עמיעוז ישע,13.11.2019,18:29:49,2019-11-13T18:30:00,1,ירי רקטות וטילים,1,6604
נחל עוז,13.11.2019,18:35:37,2019-11-13T18:36:00,1,ירי רקטות וטילים,1,6605
עלומים,13.11.2019,18:35:37,2019-11-13T18:36:00,1,ירי רקטות וטילים,1,6606
נתיב העשרה,13.11.2019,18:43:56,2019-11-13T18:44:00,1,ירי רקטות וטילים,1,6607
זיקים,13.11.2019,18:44:06,2019-11-13T18:44:00,1,ירי רקטות וטילים,1,6608
חולית,13.11.2019,18:52:14,2019-11-13T18:52:00,1,ירי רקטות וטילים,1,6609
יתד,13.11.2019,18:52:14,2019-11-13T18:52:00,1,ירי רקטות וטילים,1,6610
כרם שלום,13.11.2019,18:52:14,2019-11-13T18:52:00,1,ירי רקטות וטילים,1,6611
סופה,13.11.2019,18:52:14,2019-11-13T18:52:00,1,ירי רקטות וטילים,1,6612
דקל,13.11.2019,18:52:14,2019-11-13T18:52:00,1,ירי רקטות וטילים,1,6613
שדה אברהם,13.11.2019,18:52:14,2019-11-13T18:52:00,1,ירי רקטות וטילים,1,6614
אבשלום,13.11.2019,18:52:19,2019-11-13T18:52:00,1,ירי רקטות וטילים,1,6615
יבול,13.11.2019,18:52:25,2019-11-13T18:52:00,1,ירי רקטות וטילים,1,6616
תלמי יוסף,13.11.2019,18:52:25,2019-11-13T18:52:00,1,ירי רקטות וטילים,1,6617
כרם שלום,13.11.2019,19:21:00,2019-11-13T19:21:00,1,ירי רקטות וטילים,1,6618
כרם שלום,13.11.2019,19:21:21,2019-11-13T19:21:00,1,ירי רקטות וטילים,1,6619
זמרת ושובה,13.11.2019,19:40:31,2019-11-13T19:41:00,1,ירי רקטות וטילים,1,6620
נחל עוז,13.11.2019,19:40:31,2019-11-13T19:41:00,1,ירי רקטות וטילים,1,6621
עלומים,13.11.2019,19:40:31,2019-11-13T19:41:00,1,ירי רקטות וטילים,1,6622
כפר עזה,13.11.2019,19:40:36,2019-11-13T19:41:00,1,ירי רקטות וטילים,1,6623
סעד,13.11.2019,19:40:36,2019-11-13T19:41:00,1,ירי רקטות וטילים,1,6624
ניצן,13.11.2019,20:43:54,2019-11-13T20:44:00,1,ירי רקטות וטילים,1,6625
אשדוד - אזור תעשייה צפוני ונ,13.11.2019,20:43:54,2019-11-13T20:44:00,1,ירי רקטות וטילים,1,6626
אשדוד - ח,13.11.2019,20:44:04,2019-11-13T20:44:00,1,ירי רקטות וטילים,1,6627
מרינה,13.11.2019,20:44:04,2019-11-13T20:44:00,1,ירי רקטות וטילים,1,6628
אשדוד - יא,13.11.2019,20:44:04,2019-11-13T20:44:00,1,ירי רקטות וטילים,1,6628
אזור תעשייה הדרומי אשקלון,13.11.2019,20:54:22,2019-11-13T20:54:00,1,ירי רקטות וטילים,1,6629
זיקים,13.11.2019,20:54:22,2019-11-13T20:54:00,1,ירי רקטות וטילים,1,6630
כרמיה,13.11.2019,20:54:22,2019-11-13T20:54:00,1,ירי רקטות וטילים,1,6631
נתיב העשרה,13.11.2019,20:54:22,2019-11-13T20:54:00,1,ירי רקטות וטילים,1,6632
אשקלון,13.11.2019,20:54:27,2019-11-13T20:54:00,1,ירי רקטות וטילים,1,6633
מבקיעים,13.11.2019,20:54:33,2019-11-13T20:55:00,1,ירי רקטות וטילים,1,6634
יד מרדכי,13.11.2019,20:54:33,2019-11-13T20:55:00,1,ירי רקטות וטילים,1,6635
אשקלון,13.11.2019,20:58:36,2019-11-13T20:59:00,1,ירי רקטות וטילים,1,6636
אזור תעשייה הדרומי אשקלון,13.11.2019,20:58:36,2019-11-13T20:59:00,1,ירי רקטות וטילים,1,6637
זיקים,13.11.2019,20:58:46,2019-11-13T20:59:00,1,ירי רקטות וטילים,1,6638
כרמיה,13.11.2019,20:58:46,2019-11-13T20:59:00,1,ירי רקטות וטילים,1,6639
נתיב העשרה,13.11.2019,20:58:46,2019-11-13T20:59:00,1,ירי רקטות וטילים,1,6640
אשקלון,13.11.2019,20:59:17,2019-11-13T20:59:00,1,ירי רקטות וטילים,1,6641
אשדוד - א,13.11.2019,21:10:51,2019-11-13T21:11:00,1,ירי רקטות וטילים,1,6642
אשדוד - ח,13.11.2019,21:10:51,2019-11-13T21:11:00,1,ירי רקטות וטילים,1,6643
מרינה,13.11.2019,21:10:51,2019-11-13T21:11:00,1,ירי רקטות וטילים,1,6644
אשדוד - יא,13.11.2019,21:10:51,2019-11-13T21:11:00,1,ירי רקטות וטילים,1,6644
ניר עם,13.11.2019,21:30:52,2019-11-13T21:31:00,1,ירי רקטות וטילים,1,6645
נתיב העשרה,13.11.2019,21:37:54,2019-11-13T21:38:00,1,ירי רקטות וטילים,1,6646
מרינה,13.11.2019,22:13:56,2019-11-13T22:14:00,1,ירי רקטות וטילים,1,6647
אשדוד - יא,13.11.2019,22:13:56,2019-11-13T22:14:00,1,ירי רקטות וטילים,1,6647
 איבים,13.11.2019,22:38:17,2019-11-13T22:38:00,1,ירי רקטות וטילים,1,6648
שדרות,13.11.2019,22:38:17,2019-11-13T22:38:00,1,ירי רקטות וטילים,1,6648
עשרת,13.11.2019,23:13:55,2019-11-13T23:14:00,1,ירי רקטות וטילים,1,6649
קבוצת יבנה,13.11.2019,23:13:55,2019-11-13T23:14:00,1,ירי רקטות וטילים,1,6650
שדמה,13.11.2019,23:13:55,2019-11-13T23:14:00,1,ירי רקטות וטילים,1,6651
אמונים,13.11.2019,23:13:55,2019-11-13T23:14:00,1,ירי רקטות וטילים,1,6652
בית עזרא,13.11.2019,23:13:55,2019-11-13T23:14:00,1,ירי רקטות וטילים,1,6653
גבעתי,13.11.2019,23:13:55,2019-11-13T23:14:00,1,ירי רקטות וטילים,1,6654
מעון צופיה,13.11.2019,23:13:55,2019-11-13T23:14:00,1,ירי רקטות וטילים,1,6655
עזר,13.11.2019,23:13:55,2019-11-13T23:14:00,1,ירי רקטות וטילים,1,6656
עזריקם,13.11.2019,23:13:55,2019-11-13T23:14:00,1,ירי רקטות וטילים,1,6657
שדה עוזיהו,13.11.2019,23:13:55,2019-11-13T23:14:00,1,ירי רקטות וטילים,1,6658
שתולים,13.11.2019,23:13:55,2019-11-13T23:14:00,1,ירי רקטות וטילים,1,6659
פארק תעשייה ראם,13.11.2019,23:13:55,2019-11-13T23:14:00,1,ירי רקטות וטילים,1,6660
אזור תעשייה עד הלום,13.11.2019,23:13:55,2019-11-13T23:14:00,1,ירי רקטות וטילים,1,6661
אשדוד - א,13.11.2019,23:13:55,2019-11-13T23:14:00,1,ירי רקטות וטילים,1,6662
אשדוד - אזור תעשייה צפוני ונ,13.11.2019,23:13:55,2019-11-13T23:14:00,1,ירי רקטות וטילים,1,6663
אשדוד - ג,13.11.2019,23:13:55,2019-11-13T23:14:00,1,ירי רקטות וטילים,1,6664
אשדוד - ח,13.11.2019,23:13:55,2019-11-13T23:14:00,1,ירי רקטות וטילים,1,6665
מרינה,13.11.2019,23:13:55,2019-11-13T23:14:00,1,ירי רקטות וטילים,1,6666
אשדוד - יא,13.11.2019,23:13:55,2019-11-13T23:14:00,1,ירי רקטות וטילים,1,6666
בני דרום,13.11.2019,23:13:55,2019-11-13T23:14:00,1,ירי רקטות וטילים,1,6667
גן שלמה,13.11.2019,23:13:55,2019-11-13T23:14:00,1,ירי רקטות וטילים,1,6668
ניר גלים,13.11.2019,23:13:55,2019-11-13T23:14:00,1,ירי רקטות וטילים,1,6669
רחובות,13.11.2019,23:13:55,2019-11-13T23:14:00,1,ירי רקטות וטילים,1,6670
בית אלעזרי,13.11.2019,23:13:55,2019-11-13T23:14:00,1,ירי רקטות וטילים,1,6671
גאליה,13.11.2019,23:13:55,2019-11-13T23:14:00,1,ירי רקטות וטילים,1,6672
גדרה,13.11.2019,23:13:55,2019-11-13T23:14:00,1,ירי רקטות וטילים,1,6673
יבנה,13.11.2019,23:13:55,2019-11-13T23:14:00,1,ירי רקטות וטילים,1,6674
כפר הנגיד,13.11.2019,23:13:55,2019-11-13T23:14:00,1,ירי רקטות וטילים,1,6675
קדרון,13.11.2019,23:13:55,2019-11-13T23:14:00,1,ירי רקטות וטילים,1,6676
אזור תעשייה כנות,13.11.2019,23:13:55,2019-11-13T23:14:00,1,ירי רקטות וטילים,1,6677
ביצרון,13.11.2019,23:13:55,2019-11-13T23:14:00,1,ירי רקטות וטילים,1,6678
בית גמליאל,13.11.2019,23:13:55,2019-11-13T23:14:00,1,ירי רקטות וטילים,1,6679
בן זכאי,13.11.2019,23:13:55,2019-11-13T23:14:00,1,ירי רקטות וטילים,1,6680
בני עי''ש,13.11.2019,23:13:55,2019-11-13T23:14:00,1,ירי רקטות וטילים,1,6681
בניה,13.11.2019,23:13:55,2019-11-13T23:14:00,1,ירי רקטות וטילים,1,6682
גבעת ברנר,13.11.2019,23:13:55,2019-11-13T23:14:00,1,ירי רקטות וטילים,1,6683
גבעת וושינגטון,13.11.2019,23:13:55,2019-11-13T23:14:00,1,ירי רקטות וטילים,1,6684
ניצן,13.11.2019,23:14:34,2019-11-13T23:15:00,1,ירי רקטות וטילים,1,6685
בני דרום,13.11.2019,23:14:56,2019-11-13T23:15:00,1,ירי רקטות וטילים,1,6686
ביצרון,13.11.2019,23:14:56,2019-11-13T23:15:00,1,ירי רקטות וטילים,1,6687
בניה,13.11.2019,23:14:56,2019-11-13T23:15:00,1,ירי רקטות וטילים,1,6688
גבעת וושינגטון,13.11.2019,23:14:56,2019-11-13T23:15:00,1,ירי רקטות וטילים,1,6689
גן הדרום,13.11.2019,23:14:56,2019-11-13T23:15:00,1,ירי רקטות וטילים,1,6690
גן יבנה,13.11.2019,23:14:56,2019-11-13T23:15:00,1,ירי רקטות וטילים,1,6691
כנות,13.11.2019,23:14:56,2019-11-13T23:15:00,1,ירי רקטות וטילים,1,6692
כפר אביב,13.11.2019,23:14:56,2019-11-13T23:15:00,1,ירי רקטות וטילים,1,6693
כפר מרדכי,13.11.2019,23:14:56,2019-11-13T23:15:00,1,ירי רקטות וטילים,1,6694
כרם ביבנה,13.11.2019,23:14:56,2019-11-13T23:15:00,1,ירי רקטות וטילים,1,6695
מישר,13.11.2019,23:14:56,2019-11-13T23:15:00,1,ירי רקטות וטילים,1,6696
משגב דב,13.11.2019,23:14:56,2019-11-13T23:15:00,1,ירי רקטות וטילים,1,6697
מתחם בני דרום,13.11.2019,23:14:56,2019-11-13T23:15:00,1,ירי רקטות וטילים,1,6698
נווה מבטח,13.11.2019,23:14:56,2019-11-13T23:15:00,1,ירי רקטות וטילים,1,6699
עשרת,13.11.2019,23:14:56,2019-11-13T23:15:00,1,ירי רקטות וטילים,1,6700
קבוצת יבנה,13.11.2019,23:14:56,2019-11-13T23:15:00,1,ירי רקטות וטילים,1,6701
שדמה,13.11.2019,23:14:56,2019-11-13T23:15:00,1,ירי רקטות וטילים,1,6702
נחל עוז,13.11.2019,23:31:33,2019-11-13T23:32:00,1,ירי רקטות וטילים,1,6703
נחל עוז,13.11.2019,23:31:59,2019-11-13T23:32:00,1,ירי רקטות וטילים,1,6704
נחל עוז,13.11.2019,23:47:54,2019-11-13T23:48:00,1,ירי רקטות וטילים,1,6705
נחל עוז,14.11.2019,00:23:21,2019-11-14T00:23:00,1,ירי רקטות וטילים,1,6706
אשקלון,14.11.2019,00:25:33,2019-11-14T00:26:00,1,ירי רקטות וטילים,1,6707
מרכז שפירא,14.11.2019,00:40:27,2019-11-14T00:40:00,1,ירי רקטות וטילים,1,6708
משואות יצחק,14.11.2019,00:40:27,2019-11-14T00:40:00,1,ירי רקטות וטילים,1,6709
עין צורים,14.11.2019,00:40:27,2019-11-14T00:40:00,1,ירי רקטות וטילים,1,6710
שפיר,14.11.2019,00:40:27,2019-11-14T00:40:00,1,ירי רקטות וטילים,1,6711
אשדוד - ח,14.11.2019,00:40:27,2019-11-14T00:40:00,1,ירי רקטות וטילים,1,6712
גן יבנה,14.11.2019,00:40:27,2019-11-14T00:40:00,1,ירי רקטות וטילים,1,6713
אזור תעשייה עד הלום,14.11.2019,00:40:27,2019-11-14T00:40:00,1,ירי רקטות וטילים,1,6714
שדה עוזיהו,14.11.2019,00:40:27,2019-11-14T00:40:00,1,ירי רקטות וטילים,1,6715
שתולים,14.11.2019,00:40:27,2019-11-14T00:40:00,1,ירי רקטות וטילים,1,6716
כפר ורבורג,14.11.2019,00:40:37,2019-11-14T00:41:00,1,ירי רקטות וטילים,1,6717
אמונים,14.11.2019,00:40:42,2019-11-14T00:41:00,1,ירי רקטות וטילים,1,6718
גבעתי,14.11.2019,00:40:42,2019-11-14T00:41:00,1,ירי רקטות וטילים,1,6719
עזר,14.11.2019,00:40:42,2019-11-14T00:41:00,1,ירי רקטות וטילים,1,6720
עזריקם,14.11.2019,00:40:42,2019-11-14T00:41:00,1,ירי רקטות וטילים,1,6721
בית עזרא,14.11.2019,00:41:17,2019-11-14T00:41:00,1,ירי רקטות וטילים,1,6722
שדה עוזיהו,14.11.2019,00:41:17,2019-11-14T00:41:00,1,ירי רקטות וטילים,1,6723
אשקלון,14.11.2019,01:35:33,2019-11-14T01:36:00,1,ירי רקטות וטילים,1,6724
באר גנים,14.11.2019,01:35:33,2019-11-14T01:36:00,1,ירי רקטות וטילים,1,6725
מבטחים עמיעוז ישע,14.11.2019,01:59:04,2019-11-14T01:59:00,1,ירי רקטות וטילים,1,6726
 מכללת ספיר,14.11.2019,02:35:48,2019-11-14T02:36:00,1,ירי רקטות וטילים,1,6727
גבים,14.11.2019,02:35:48,2019-11-14T02:36:00,1,ירי רקטות וטילים,1,6727
 איבים,14.11.2019,02:35:48,2019-11-14T02:36:00,1,ירי רקטות וטילים,1,6728
שדרות,14.11.2019,02:35:48,2019-11-14T02:36:00,1,ירי רקטות וטילים,1,6728
בארי,14.11.2019,02:35:48,2019-11-14T02:36:00,1,ירי רקטות וטילים,1,6729
סעד,14.11.2019,02:35:48,2019-11-14T02:36:00,1,ירי רקטות וטילים,1,6730
עלומים,14.11.2019,02:35:48,2019-11-14T02:36:00,1,ירי רקטות וטילים,1,6731
שדה דוד,14.11.2019,02:35:48,2019-11-14T02:36:00,1,ירי רקטות וטילים,1,6732
שחר,14.11.2019,02:35:48,2019-11-14T02:36:00,1,ירי רקטות וטילים,1,6733
תלמים,14.11.2019,02:35:48,2019-11-14T02:36:00,1,ירי רקטות וטילים,1,6734
ארז,14.11.2019,06:11:38,2019-11-14T06:12:00,1,ירי רקטות וטילים,1,6735
יד מרדכי,14.11.2019,06:11:38,2019-11-14T06:12:00,1,ירי רקטות וטילים,1,6736
נתיב העשרה,14.11.2019,06:11:38,2019-11-14T06:12:00,1,ירי רקטות וטילים,1,6737
יד מרדכי,14.11.2019,06:58:54,2019-11-14T06:59:00,1,ירי רקטות וטילים,1,6738
נתיב העשרה,14.11.2019,06:58:54,2019-11-14T06:59:00,1,ירי רקטות וטילים,1,6739
יד מרדכי,14.11.2019,06:59:20,2019-11-14T06:59:00,1,ירי רקטות וטילים,1,6740
נתיב העשרה,14.11.2019,06:59:20,2019-11-14T06:59:00,1,ירי רקטות וטילים,1,6741
ארז,14.11.2019,06:59:31,2019-11-14T07:00:00,1,ירי רקטות וטילים,1,6742
כרמיה,14.11.2019,06:59:31,2019-11-14T07:00:00,1,ירי רקטות וטילים,1,6743
נתיב העשרה,14.11.2019,07:19:41,2019-11-14T07:20:00,1,ירי רקטות וטילים,1,6744
שוקדה,14.11.2019,10:54:52,2019-11-14T10:55:00,1,ירי רקטות וטילים,1,6745
בית הגדי,14.11.2019,10:55:02,2019-11-14T10:55:00,1,ירי רקטות וטילים,1,6746
נתיבות,14.11.2019,10:55:02,2019-11-14T10:55:00,1,ירי רקטות וטילים,1,6747
זמרת ושובה,14.11.2019,10:55:02,2019-11-14T10:55:00,1,ירי רקטות וטילים,1,6748
שרשרת,14.11.2019,10:55:02,2019-11-14T10:55:00,1,ירי רקטות וטילים,1,6749
תקומה וחוות יזרעם,14.11.2019,10:55:02,2019-11-14T10:55:00,1,ירי רקטות וטילים,1,6750
תקומה,14.11.2019,10:55:02,2019-11-14T10:55:00,1,ירי רקטות וטילים,1,6751
בארי,14.11.2019,10:55:08,2019-11-14T10:55:00,1,ירי רקטות וטילים,1,6752
כפר מימון ותושיה,14.11.2019,10:55:08,2019-11-14T10:55:00,1,ירי רקטות וטילים,1,6753
עלומים,14.11.2019,10:55:08,2019-11-14T10:55:00,1,ירי רקטות וטילים,1,6754
שוקדה,14.11.2019,10:55:13,2019-11-14T10:55:00,1,ירי רקטות וטילים,1,6755
יכיני,14.11.2019,10:55:19,2019-11-14T10:55:00,1,ירי רקטות וטילים,1,6756
מפלסים,14.11.2019,10:55:19,2019-11-14T10:55:00,1,ירי רקטות וטילים,1,6757
כפר מימון ותושיה,14.11.2019,17:23:44,2019-11-14T17:24:00,1,ירי רקטות וטילים,1,6758
עלומים,14.11.2019,17:23:44,2019-11-14T17:24:00,1,ירי רקטות וטילים,1,6759
בארי,14.11.2019,17:23:49,2019-11-14T17:24:00,1,ירי רקטות וטילים,1,6760
נחל עוז,14.11.2019,17:23:49,2019-11-14T17:24:00,1,ירי רקטות וטילים,1,6761
 מכללת ספיר,14.11.2019,22:02:53,2019-11-14T22:03:00,1,ירי רקטות וטילים,1,6762
גבים,14.11.2019,22:02:53,2019-11-14T22:03:00,1,ירי רקטות וטילים,1,6762
ניר עם,14.11.2019,22:03:03,2019-11-14T22:03:00,1,ירי רקטות וטילים,1,6763
 איבים,14.11.2019,22:03:03,2019-11-14T22:03:00,1,ירי רקטות וטילים,1,6764
שדרות,14.11.2019,22:03:03,2019-11-14T22:03:00,1,ירי רקטות וטילים,1,6764
מפלסים,14.11.2019,22:03:03,2019-11-14T22:03:00,1,ירי רקטות וטילים,1,6765
מטווח ניר עם,14.11.2019,22:03:03,2019-11-14T22:03:00,1,ירי רקטות וטילים,1,6766
 מכללת ספיר,14.11.2019,22:03:29,2019-11-14T22:03:00,1,ירי רקטות וטילים,1,6767
גבים,14.11.2019,22:03:29,2019-11-14T22:03:00,1,ירי רקטות וטילים,1,6767
ניר עם,14.11.2019,22:03:29,2019-11-14T22:03:00,1,ירי רקטות וטילים,1,6768
 איבים,14.11.2019,22:03:29,2019-11-14T22:03:00,1,ירי רקטות וטילים,1,6769
שדרות,14.11.2019,22:03:29,2019-11-14T22:03:00,1,ירי רקטות וטילים,1,6769
מפלסים,14.11.2019,22:03:29,2019-11-14T22:03:00,1,ירי רקטות וטילים,1,6770
מטווח ניר עם,14.11.2019,22:03:29,2019-11-14T22:03:00,1,ירי רקטות וטילים,1,6771
שגב שלום והפזורה,16.11.2019,01:57:07,2019-11-16T01:57:00,1,ירי רקטות וטילים,1,6772
באר שבע - דרום,16.11.2019,01:57:16,2019-11-16T01:57:00,1,ירי רקטות וטילים,1,6773
באר שבע - מזרח,16.11.2019,01:57:16,2019-11-16T01:57:00,1,ירי רקטות וטילים,1,6774
לקיה והפזורה,16.11.2019,01:57:16,2019-11-16T01:57:00,1,ירי רקטות וטילים,1,6775
באר שבע - צפון,16.11.2019,01:57:33,2019-11-16T01:58:00,1,ירי רקטות וטילים,1,6776
עומר,16.11.2019,01:57:33,2019-11-16T01:58:00,1,ירי רקטות וטילים,1,6777
באר שבע - מערב,16.11.2019,01:57:48,2019-11-16T01:58:00,1,ירי רקטות וטילים,1,6778
באר שבע - מזרח,16.11.2019,01:58:23,2019-11-16T01:58:00,1,ירי רקטות וטילים,1,6779
דפנה,19.11.2019,04:52:52,2019-11-19T04:53:00,1,ירי רקטות וטילים,1,6781
כפר סאלד,19.11.2019,04:52:52,2019-11-19T04:53:00,1,ירי רקטות וטילים,1,6782
מג'דל שמס,19.11.2019,04:52:52,2019-11-19T04:53:00,1,ירי רקטות וטילים,1,6783
מסעדה,19.11.2019,04:52:52,2019-11-19T04:53:00,1,ירי רקטות וטילים,1,6784
נווה אטי''ב,19.11.2019,04:52:52,2019-11-19T04:53:00,1,ירי רקטות וטילים,1,6785
נמרוד,19.11.2019,04:52:52,2019-11-19T04:53:00,1,ירי רקטות וטילים,1,6786
עין קנייא,19.11.2019,04:52:52,2019-11-19T04:53:00,1,ירי רקטות וטילים,1,6787
שאר ישוב,19.11.2019,04:52:52,2019-11-19T04:53:00,1,ירי רקטות וטילים,1,6788
שניר,19.11.2019,04:52:52,2019-11-19T04:53:00,1,ירי רקטות וטילים,1,6789
רעים,29.11.2019,20:51:36,2019-11-29T20:52:00,1,ירי רקטות וטילים,1,6791
אזור תעשייה הדרומי אשקלון,29.11.2019,23:02:00,2019-11-29T23:02:00,1,ירי רקטות וטילים,1,6792
זיקים,29.11.2019,23:02:05,2019-11-29T23:02:00,1,ירי רקטות וטילים,1,6793
כרמיה,29.11.2019,23:02:11,2019-11-29T23:02:00,1,ירי רקטות וטילים,1,6794
נתיב העשרה,29.11.2019,23:02:11,2019-11-29T23:02:00,1,ירי רקטות וטילים,1,6795
אשקלון,29.11.2019,23:02:11,2019-11-29T23:02:00,1,ירי רקטות וטילים,1,6796
נחל עוז,12.01.2020,12:19:01,2020-01-12T12:19:00,1,ירי רקטות וטילים,1,6820
נחל עוז,15.01.2020,15:24:17,2020-01-15T15:24:00,1,ירי רקטות וטילים,1,6821
סעד,15.01.2020,15:24:22,2020-01-15T15:24:00,1,ירי רקטות וטילים,1,6822
נחל עוז,15.01.2020,15:24:42,2020-01-15T15:25:00,1,ירי רקטות וטילים,1,6823
כפר עזה,15.01.2020,15:25:03,2020-01-15T15:25:00,1,ירי רקטות וטילים,1,6824
נחל עוז,15.01.2020,15:25:03,2020-01-15T15:25:00,1,ירי רקטות וטילים,1,6825
סעד,15.01.2020,15:25:03,2020-01-15T15:25:00,1,ירי רקטות וטילים,1,6826
מטווח ניר עם,23.01.2020,20:15:03,2020-01-23T20:15:00,1,ירי רקטות וטילים,1,6827
כיסופים,29.01.2020,21:11:23,2020-01-29T21:11:00,1,ירי רקטות וטילים,1,6828
יד מרדכי,30.01.2020,13:07:02,2020-01-30T13:07:00,1,ירי רקטות וטילים,1,6829
ניר עם,30.01.2020,23:28:16,2020-01-30T23:28:00,1,ירי רקטות וטילים,1,6830
 איבים,30.01.2020,23:28:16,2020-01-30T23:28:00,1,ירי רקטות וטילים,1,6831
שדרות,30.01.2020,23:28:16,2020-01-30T23:28:00,1,ירי רקטות וטילים,1,6831
 מכללת ספיר,30.01.2020,23:28:26,2020-01-30T23:28:00,1,ירי רקטות וטילים,1,6832
גבים,30.01.2020,23:28:26,2020-01-30T23:28:00,1,ירי רקטות וטילים,1,6832
 איבים,31.01.2020,20:21:35,2020-01-31T20:22:00,1,ירי רקטות וטילים,1,6833
שדרות,31.01.2020,20:21:35,2020-01-31T20:22:00,1,ירי רקטות וטילים,1,6833
 מכללת ספיר,31.01.2020,20:22:01,2020-01-31T20:22:00,1,ירי רקטות וטילים,1,6834
גבים,31.01.2020,20:22:01,2020-01-31T20:22:00,1,ירי רקטות וטילים,1,6834
ניר עם,31.01.2020,20:22:01,2020-01-31T20:22:00,1,ירי רקטות וטילים,1,6835
 איבים,31.01.2020,20:22:01,2020-01-31T20:22:00,1,ירי רקטות וטילים,1,6836
שדרות,31.01.2020,20:22:01,2020-01-31T20:22:00,1,ירי רקטות וטילים,1,6836
אור הנר,31.01.2020,20:22:01,2020-01-31T20:22:00,1,ירי רקטות וטילים,1,6837
ארז,31.01.2020,20:22:01,2020-01-31T20:22:00,1,ירי רקטות וטילים,1,6838
ניר יצחק,31.01.2020,22:42:40,2020-01-31T22:43:00,1,ירי רקטות וטילים,1,6839
סופה,31.01.2020,22:42:40,2020-01-31T22:43:00,1,ירי רקטות וטילים,1,6840
נחל עוז,01.02.2020,21:12:18,2020-02-01T21:12:00,1,ירי רקטות וטילים,1,6841
עלומים,01.02.2020,21:12:18,2020-02-01T21:12:00,1,ירי רקטות וטילים,1,6842
נתיבות,05.02.2020,00:14:17,2020-02-05T00:14:00,1,ירי רקטות וטילים,1,6843
שרשרת,05.02.2020,00:14:17,2020-02-05T00:14:00,1,ירי רקטות וטילים,1,6844
עלומים,05.02.2020,00:14:21,2020-02-05T00:14:00,1,ירי רקטות וטילים,1,6845
יתד,06.02.2020,09:13:31,2020-02-06T09:14:00,1,ירי רקטות וטילים,1,6846
ניר עם,09.02.2020,20:29:55,2020-02-09T20:30:00,1,ירי רקטות וטילים,1,6847
 איבים,09.02.2020,20:29:55,2020-02-09T20:30:00,1,ירי רקטות וטילים,1,6848
שדרות,09.02.2020,20:29:55,2020-02-09T20:30:00,1,ירי רקטות וטילים,1,6848
כיסופים,15.02.2020,20:12:29,2020-02-15T20:12:00,1,ירי רקטות וטילים,1,6849
אזור תעשייה הדרומי אשקלון,23.02.2020,17:34:45,2020-02-23T17:35:00,1,ירי רקטות וטילים,1,6850
בית שקמה,23.02.2020,17:34:45,2020-02-23T17:35:00,1,ירי רקטות וטילים,1,6851
גיאה,23.02.2020,17:34:45,2020-02-23T17:35:00,1,ירי רקטות וטילים,1,6852
הודיה,23.02.2020,17:34:45,2020-02-23T17:35:00,1,ירי רקטות וטילים,1,6853
מבקיעים,23.02.2020,17:34:45,2020-02-23T17:35:00,1,ירי רקטות וטילים,1,6854
משען,23.02.2020,17:34:45,2020-02-23T17:35:00,1,ירי רקטות וטילים,1,6855
אשקלון,23.02.2020,17:34:45,2020-02-23T17:35:00,1,ירי רקטות וטילים,1,6856
אזור תעשייה צפוני אשקלון,23.02.2020,17:34:46,2020-02-23T17:35:00,1,ירי רקטות וטילים,1,6857
זיקים,23.02.2020,17:34:56,2020-02-23T17:35:00,1,ירי רקטות וטילים,1,6858
יד מרדכי,23.02.2020,17:34:56,2020-02-23T17:35:00,1,ירי רקטות וטילים,1,6859
כרמיה,23.02.2020,17:34:56,2020-02-23T17:35:00,1,ירי רקטות וטילים,1,6860
נתיב העשרה,23.02.2020,17:34:56,2020-02-23T17:35:00,1,ירי רקטות וטילים,1,6861
כיסופים,23.02.2020,17:39:38,2020-02-23T17:40:00,1,ירי רקטות וטילים,1,6862
כרם שלום,23.02.2020,17:41:57,2020-02-23T17:42:00,1,ירי רקטות וטילים,1,6863
אשקלון,23.02.2020,17:43:56,2020-02-23T17:44:00,1,ירי רקטות וטילים,1,6864
אזור תעשייה הדרומי אשקלון,23.02.2020,17:43:56,2020-02-23T17:44:00,1,ירי רקטות וטילים,1,6865
סופה,23.02.2020,17:43:56,2020-02-23T17:44:00,1,ירי רקטות וטילים,1,6866
נתיב העשרה,23.02.2020,17:44:02,2020-02-23T17:44:00,1,ירי רקטות וטילים,1,6867
זיקים,23.02.2020,17:44:02,2020-02-23T17:44:00,1,ירי רקטות וטילים,1,6868
כרמיה,23.02.2020,17:44:02,2020-02-23T17:44:00,1,ירי רקטות וטילים,1,6869
מבקיעים,23.02.2020,17:44:02,2020-02-23T17:44:00,1,ירי רקטות וטילים,1,6870
 מכללת ספיר,23.02.2020,17:44:02,2020-02-23T17:44:00,1,ירי רקטות וטילים,1,6871
גבים,23.02.2020,17:44:02,2020-02-23T17:44:00,1,ירי רקטות וטילים,1,6871
ניר עם,23.02.2020,17:44:02,2020-02-23T17:44:00,1,ירי רקטות וטילים,1,6872
 איבים,23.02.2020,17:44:02,2020-02-23T17:44:00,1,ירי רקטות וטילים,1,6873
שדרות,23.02.2020,17:44:02,2020-02-23T17:44:00,1,ירי רקטות וטילים,1,6873
מפלסים,23.02.2020,17:44:02,2020-02-23T17:44:00,1,ירי רקטות וטילים,1,6874
מטווח ניר עם,23.02.2020,17:44:02,2020-02-23T17:44:00,1,ירי רקטות וטילים,1,6875
ניר יצחק,23.02.2020,17:44:03,2020-02-23T17:44:00,1,ירי רקטות וטילים,1,6876
ארז,23.02.2020,17:44:14,2020-02-23T17:44:00,1,ירי רקטות וטילים,1,6877
בת הדר,23.02.2020,17:44:14,2020-02-23T17:44:00,1,ירי רקטות וטילים,1,6878
ניר עם,23.02.2020,17:44:20,2020-02-23T17:44:00,1,ירי רקטות וטילים,1,6879
 איבים,23.02.2020,17:44:20,2020-02-23T17:44:00,1,ירי רקטות וטילים,1,6880
שדרות,23.02.2020,17:44:20,2020-02-23T17:44:00,1,ירי רקטות וטילים,1,6880
גבים,23.02.2020,17:44:21,2020-02-23T17:44:00,1,ירי רקטות וטילים,1,6881
 מכללת ספיר,23.02.2020,17:44:21,2020-02-23T17:44:00,1,ירי רקטות וטילים,1,6881
אשקלון,23.02.2020,19:54:25,2020-02-23T19:54:00,1,ירי רקטות וטילים,1,6882
אזור תעשייה הדרומי אשקלון,23.02.2020,19:54:40,2020-02-23T19:55:00,1,ירי רקטות וטילים,1,6883
אשקלון,23.02.2020,19:55:01,2020-02-23T19:55:00,1,ירי רקטות וטילים,1,6884
אזור תעשייה צפוני אשקלון,23.02.2020,19:55:01,2020-02-23T19:55:00,1,ירי רקטות וטילים,1,6885
כיסופים,23.02.2020,20:03:49,2020-02-23T20:04:00,1,ירי רקטות וטילים,1,6886
 איבים,23.02.2020,21:02:12,2020-02-23T21:02:00,1,ירי רקטות וטילים,1,6887
שדרות,23.02.2020,21:02:12,2020-02-23T21:02:00,1,ירי רקטות וטילים,1,6887
גבים,23.02.2020,21:02:22,2020-02-23T21:02:00,1,ירי רקטות וטילים,1,6888
 מכללת ספיר,23.02.2020,21:02:22,2020-02-23T21:02:00,1,ירי רקטות וטילים,1,6888
ניר עם,23.02.2020,21:02:22,2020-02-23T21:02:00,1,ירי רקטות וטילים,1,6889
מטווח ניר עם,23.02.2020,21:02:22,2020-02-23T21:02:00,1,ירי רקטות וטילים,1,6890
נחל עוז,23.02.2020,21:17:37,2020-02-23T21:18:00,1,ירי רקטות וטילים,1,6891
סעד,23.02.2020,22:11:38,2020-02-23T22:12:00,1,ירי רקטות וטילים,1,6892
ניר עם,23.02.2020,22:15:15,2020-02-23T22:15:00,1,ירי רקטות וטילים,1,6893
מפלסים,23.02.2020,22:15:15,2020-02-23T22:15:00,1,ירי רקטות וטילים,1,6894
מטווח ניר עם,23.02.2020,22:15:15,2020-02-23T22:15:00,1,ירי רקטות וטילים,1,6895
גבים,23.02.2020,22:15:15,2020-02-23T22:15:00,1,ירי רקטות וטילים,1,6896
 מכללת ספיר,23.02.2020,22:15:15,2020-02-23T22:15:00,1,ירי רקטות וטילים,1,6896
שדרות,23.02.2020,22:15:15,2020-02-23T22:15:00,1,ירי רקטות וטילים,1,6897
 איבים,23.02.2020,22:15:15,2020-02-23T22:15:00,1,ירי רקטות וטילים,1,6897
גבים,23.02.2020,22:15:30,2020-02-23T22:16:00,1,ירי רקטות וטילים,1,6898
 מכללת ספיר,23.02.2020,22:15:30,2020-02-23T22:16:00,1,ירי רקטות וטילים,1,6898
 איבים,23.02.2020,22:15:30,2020-02-23T22:16:00,1,ירי רקטות וטילים,1,6899
שדרות,23.02.2020,22:15:30,2020-02-23T22:16:00,1,ירי רקטות וטילים,1,6899
 מכללת ספיר,23.02.2020,22:41:43,2020-02-23T22:42:00,1,ירי רקטות וטילים,1,6900
גבים,23.02.2020,22:41:43,2020-02-23T22:42:00,1,ירי רקטות וטילים,1,6900
ניר עם,23.02.2020,22:41:43,2020-02-23T22:42:00,1,ירי רקטות וטילים,1,6901
מפלסים,23.02.2020,22:41:43,2020-02-23T22:42:00,1,ירי רקטות וטילים,1,6902
מטווח ניר עם,23.02.2020,22:41:43,2020-02-23T22:42:00,1,ירי רקטות וטילים,1,6903
 איבים,23.02.2020,22:41:43,2020-02-23T22:42:00,1,ירי רקטות וטילים,1,6904
שדרות,23.02.2020,22:41:43,2020-02-23T22:42:00,1,ירי רקטות וטילים,1,6904
 איבים,23.02.2020,22:41:59,2020-02-23T22:42:00,1,ירי רקטות וטילים,1,6905
שדרות,23.02.2020,22:41:59,2020-02-23T22:42:00,1,ירי רקטות וטילים,1,6905
גבים,23.02.2020,22:42:09,2020-02-23T22:42:00,1,ירי רקטות וטילים,1,6906
 מכללת ספיר,23.02.2020,22:42:09,2020-02-23T22:42:00,1,ירי רקטות וטילים,1,6906
ניר עם,23.02.2020,22:42:09,2020-02-23T22:42:00,1,ירי רקטות וטילים,1,6907
ניר עם,24.02.2020,12:02:59,2020-02-24T12:03:00,1,ירי רקטות וטילים,1,6908
 איבים,24.02.2020,12:02:59,2020-02-24T12:03:00,1,ירי רקטות וטילים,1,6909
שדרות,24.02.2020,12:02:59,2020-02-24T12:03:00,1,ירי רקטות וטילים,1,6909
 מכללת ספיר,24.02.2020,12:03:04,2020-02-24T12:03:00,1,ירי רקטות וטילים,1,6910
גבים,24.02.2020,12:03:04,2020-02-24T12:03:00,1,ירי רקטות וטילים,1,6910
מפלסים,24.02.2020,12:03:10,2020-02-24T12:03:00,1,ירי רקטות וטילים,1,6911
מטווח ניר עם,24.02.2020,12:03:10,2020-02-24T12:03:00,1,ירי רקטות וטילים,1,6912
 איבים,24.02.2020,12:03:16,2020-02-24T12:03:00,1,ירי רקטות וטילים,1,6913
שדרות,24.02.2020,12:03:16,2020-02-24T12:03:00,1,ירי רקטות וטילים,1,6913
ניר עם,24.02.2020,12:32:58,2020-02-24T12:33:00,1,ירי רקטות וטילים,1,6914
 איבים,24.02.2020,12:32:58,2020-02-24T12:33:00,1,ירי רקטות וטילים,1,6915
שדרות,24.02.2020,12:32:58,2020-02-24T12:33:00,1,ירי רקטות וטילים,1,6915
